71,71,"With respect to monetary policy rules, they can be useful, and I find them useful—and long have—as a kind of benchmark for thinking about what might be the appropriate stance of policy.",0,0.9997952580451964,2015-03-18 19:04:22.760000+00:00,2015-03-18 19:04:23+00:00,2015-03-18 19:04:29+00:00,1.07713,1.07675,0.0003799999999998249,2099.993,2100.065,-0.07200000000011642
72,72,"But to chain a central bank to follow a simple mathematical rule that fails to take account of many things that are very important in making monetary policy—for example, I was earlier asked about being against the zero lower bound, which is an important special consideration—that would be a very foolish thing to do, and I oppose it.",0,0.9998189806938172,2015-03-18 19:04:29.080000+00:00,2015-03-18 19:04:29+00:00,2015-03-18 19:04:59+00:00,1.07685,1.07744,-0.0005899999999998684,2102.9770000000003,2099.992,2.9850000000001273
73,73,"But, remember, we have to put that in context: There are a lot of things that affect the U.S. outlook, and while that is serving as a drag on economic growth, overall the Committee continues to see sufficient strength—particularly in private spending—that we are expecting above-trend growth, even so.",0,0.998505711555481,2015-03-18 19:04:58.560000+00:00,2015-03-18 19:04:59+00:00,2015-03-18 19:08:29+00:00,1.07809,1.07678,0.0013099999999999223,2102.263,2102.775,-0.512000000000171
74,74,"We have pledged to communicate as clearly as we can about monetary policy, and I am trying to do that, and will continue to do so.",0,0.6026175618171692,2015-03-18 19:08:29.280000+00:00,2015-03-18 19:08:29+00:00,2015-03-18 19:09:00+00:00,1.0779200000000002,1.0780200000000002,-9.999999999998899e-05,2102.505,2102.485,0.01999999999998181
75,75,"Many, many studies over decades and decades have showed that there are lags in the way monetary policy affects the economy, and, therefore, monetary policy does have to be forward looking.",0,0.9995762705802916,2015-03-18 19:09:00.240000+00:00,2015-03-18 19:09:00+00:00,2015-03-18 19:09:15+00:00,1.07752,1.0778,-0.000280000000000058,2102.5,2102.786,-0.2860000000000582
76,76,"In spite of the fact that they are projecting that inflation will be low, they’re looking forward and they see that, by the end of 2016 or 2017, with the labor market recovering, and assuming that inflation expectations remain stable and transitory influences no longer affecting inflation, they see inflation heading back to our 2 percent objective.",0,0.9997907280921936,2015-03-18 19:09:14.760000+00:00,2015-03-18 19:09:15+00:00,2015-03-18 19:09:28+00:00,1.07752,1.07759,-7.00000000000145e-05,2101.996,2102.275,-0.27899999999999636
77,77,"We said we would do that when economic conditions were appropriate after we begin raising rates, because we want changes in the—our target range for the federal funds rate to be the main tool by which we shift the stance of monetary policy.",0,0.9907578229904176,2015-03-18 19:09:27.720000+00:00,2015-03-18 19:09:28+00:00,2015-03-18 19:11:03+00:00,1.07906,1.07754,0.0015199999999999658,2103.284,2101.993,1.2910000000001673
78,78,A positive aspect of what is fundamentally a disappointment is that the labor market has improved more rapidly than might have been expected given the pace of economic growth.,0,0.99860280752182,2015-03-18 19:11:03.240000+00:00,2015-03-18 19:11:03+00:00,2015-03-18 19:11:18+00:00,1.07895,1.07904,-8.999999999992347e-05,2102.778,2103.286,-0.5080000000002656
79,79,"So the unemployment rate has come down more rapidly than I would have expected, and the labor market has improved more rapidly than I would have expected.",0,0.9744306206703186,2015-03-18 19:11:18.120000+00:00,2015-03-18 19:11:18+00:00,2015-03-18 19:11:21+00:00,1.07915,1.07906,9.000000000014552e-05,2102.7870000000003,2102.793,-0.005999999999858119
80,80,"I would expect it to pick up, and as you can see Chair Yellen’s Press Conference FINAL from the longer-run growth projections, most FOMC participants believe it will pick up above current levels.",-1,0.9540721774101256,2015-03-18 19:11:20.840000+00:00,2015-03-18 19:11:21+00:00,2015-03-18 19:12:09+00:00,1.07884,1.0790700000000002,-0.0002300000000001745,2103.266,2102.7870000000003,0.47899999999981446
81,81,"But it means it’s something that would, if it persists, retard living standards and would likely retard real wage growth and improvement in living standards for ordinary households.",1,0.982142984867096,2015-03-18 19:12:08.880000+00:00,2015-03-18 19:12:09+00:00,,,1.0787600000000002,,,2103.273,
