,Sentences,Speaker
146,"On terms of the terminology, well, and people have different preferences about what they want to call things, I think it’s a sensible term because I think of the fiscal policies providing support to the economy.",CHAIRMAN BERNANKE.
147,"If fiscal policy becomes very contractionary, the economy will, I think, go off a cliff.",CHAIRMAN BERNANKE.
148,I think that it’s reasonable to be concerned about this.,CHAIRMAN BERNANKE.
149,I don’t buy the idea that a short-term descent off the fiscal cliff would be not costly.,CHAIRMAN BERNANKE.
150,"I think it would be costly and, in fact, we’re already seeing costs.",CHAIRMAN BERNANKE.
151,Why is it that consumer confidence  dropped so sharply this week?,CHAIRMAN BERNANKE.
152,Why is it that small business confidence dropped so sharply?,CHAIRMAN BERNANKE.
153,Why is—why are the markets volatile?,CHAIRMAN BERNANKE.
154,Why is business investment at among its weakest levels during the recovery?,CHAIRMAN BERNANKE.
155,"I think all of these things, at least to some extent, can be traced to the anticipation and the concern about the fiscal cliff and I think that, you know, we don’t know exactly what would happen but I think there is certainly a risk that it could be serious and, therefore, I think it is very important.",CHAIRMAN BERNANKE.
156,"The most helpful thing that could—that, I think, Congress, the Administration could do right now is find a resolution that, on the one hand, achieves long-run fiscal sustainability, which is critical, absolutely critical for a healthy economy, but also avoids derailing the recovery which is currently in process.",CHAIRMAN BERNANKE.
157,Jon Hilsenrath from the Wall Street Journal.,JON HILSENRATH.
158,"Mr. Chairman, I just—I want to try to square up some numbers.",JON HILSENRATH.
159,The threshold that you announced today for when rate hikes might start is 6½ percent.,JON HILSENRATH.
160,"The Committee’s assessment of the longer-run unemployment rate is 6 percent, or perhaps a bit lower, and the longer-run equilibrium fed funds rate is around 4 percent according to these projections.",JON HILSENRATH.
161,"It suggests that when the Fed does start raising interest rates down the road, it might have to move fairly quickly to get to some equilibrium fed funds rate.",JON HILSENRATH.
162,"Is that, specifically, is that the case and, more generally, can you talk about what this framework that you set up today says about the exit strategy that you had laid out some time ago and whether that’s evolving or changing?",JON HILSENRATH.
163,"Well, it’s a good question.",CHAIRMAN BERNANKE.
164,"So first of all, we don’t have a precise estimate of the long-run sustainable unemployment rate.",CHAIRMAN BERNANKE.
165,"The estimates that were provided in the Summary of Economic Projections today, as has been the case for a while, is 5.2 to 6.0 percent.",CHAIRMAN BERNANKE.
166,"So, it could be well less than 6½ percent, so that gives us some time.",CHAIRMAN BERNANKE.
167,"My anticipation is that the removal of accommodation after the takeoff point, whenever that occurs, would be relatively gradual.",CHAIRMAN BERNANKE.
168,I don’t think we’re looking at a rapid increase.,CHAIRMAN BERNANKE.
169,"Of course, that depends on where inflation is and other conditions.",CHAIRMAN BERNANKE.
170,"But it’s—the path that we’re basing these numbers on is one that assumes, first of all, as you anticipated, assumes an increase in the funds rate first occurring some time after unemployment goes below 6½ percent, but does not necessarily assume a rapid increase after that.",CHAIRMAN BERNANKE.
171,And I—what we said in our statement is that we would take a balanced approach.,CHAIRMAN BERNANKE.
172,"In other words, you know, once we get to that point, we may or may not raise rates at that point.",CHAIRMAN BERNANKE.
173,We’ll look at the situation.,CHAIRMAN BERNANKE.
174,"But assuming that inflation remains well controlled, which I fully anticipate, I think that the rate of increase in rates would be moderate.",CHAIRMAN BERNANKE.
175,This is consistent—the exit strategy that we put out is consistent with our statement today because the exit strategy was primarily about how we would normalize the balance sheet over time.,CHAIRMAN BERNANKE.
176,"And at this time we have not made any changes in that, and we believe that some increase in the size of our balance sheet is consistent still with that general sequence that we laid out in the minutes a year and a half ago.",CHAIRMAN BERNANKE.
177,"That being said, if the balance sheet grows by enough, we may have to reconsider the pace or timing of that, but I don’t see any changes that would, you know, radically change the time to normalization or the time to exit.",CHAIRMAN BERNANKE.
178,Thank you.,ZACHARY GOLDFARB.
179,Zach Goldfarb.,ZACHARY GOLDFARB.
180,"I’m going to continue the two question trend and ask—first on the fiscal cliff, it sounds like you would prefer a sensible balance of fiscal consolidation and support for the recovery, but if people in Congress can’t do that in the next two weeks, do you think postponing off this whole consolidation is preferable to going over the cliff?",ZACHARY GOLDFARB.
181,"And then, on the monetary policy actions today, can you give us a little bit  more color on how you set the thresholds at what they were?",ZACHARY GOLDFARB.
182,"And what the alternatives were, and how you weighed various alternative but similar policies?",ZACHARY GOLDFARB.
183,Sure.,CHAIRMAN BERNANKE.
184,I’m hoping that the Congress will do the right thing on the fiscal cliff.,CHAIRMAN BERNANKE.
185,"I—you know, there’s a problem with kicking the can down the road.",CHAIRMAN BERNANKE.
186,"It might avoid some of the short-term impact on the recovery, but it could create concerns about our longer-term fiscal situation and I don’t want to see that.",CHAIRMAN BERNANKE.
187,"So I think for the best—it’s in the best interest of the economy to come to a two-part solution, if you will.",CHAIRMAN BERNANKE.
188,Part one is to modify fiscal policy in a way that doesn’t create enormous headwinds for the recovery in the near term.,CHAIRMAN BERNANKE.
189,"And part two is to at least take important steps towards achieving a framework, at least, by which, perhaps through further negotiation, the Congress and the Administration can achieve a sustainable path for fiscal policy.",CHAIRMAN BERNANKE.
190,That—both of these parts are very important.,CHAIRMAN BERNANKE.
191,I don’t think that we can consider these negotiations a success unless both of them happen.,CHAIRMAN BERNANKE.
192,[Speaker unknown; inaudible remark]  CHAIRMAN BERNANKE.,CHAIRMAN BERNANKE.
193,No.,CHAIRMAN BERNANKE.
194,I think they’re equally important.,CHAIRMAN BERNANKE.
195,"On the threshold numbers, this is based—these numbers are based on substantial analysis done by staff, both here and at the Reserve Banks, trying to assess under so-called optimal policy, or in the best policy that we can come up with, what would the interest rate path look like and how would it be connected or correlated with changes in unemployment and inflation.",CHAIRMAN BERNANKE.
196,"And when we do that analysis, what we find is that the best interest rate path—as best as we can determine it based on our models and analysis, which is obviously imperfect—has rates remaining low until unemployment drops below 6½ percent.",CHAIRMAN BERNANKE.
197,"And it projects if we put in the two—the half of a percentage point above the 2 percent goal as a kind of protection against any problem with price  stability, but our projections, our actual forecast suggests that inflation will not go there.",CHAIRMAN BERNANKE.
198,"Inflation will stay around 2 percent, which will be consistent with our longer-term objective.",CHAIRMAN BERNANKE.
199,[Inaudible Remark]   CHAIRMAN BERNANKE.,ZACH GOLDFARB.
200,"If we got important new information about the structure of the economy, it’s possible, but I consider it relatively unlikely and this is one of the best—this is one of the advantages of this approach over the date-based approach.",ZACH GOLDFARB.
201,"If information comes in which says the economy is stronger or weaker than we expected, that would, in principle, require a change in the date.",ZACH GOLDFARB.
202,But it doesn’t necessarily require a change in the thresholds because that date adjustment can be made by markets just simply by looking at their own forecasts of when unemployment will cross the line and the behavior of inflation.,ZACH GOLDFARB.
203,"Scott Spoerry from CNN, sir.",SCOTT SPOERRY.
204,"When you were appearing on 60 Minutes, one of the things that happened was that you visited your old hometown, and you talked a little bit about how the economy had affected people that you grew up with and affected the people down there.",SCOTT SPOERRY.
205,There are a lot of just regular people like that who are out on the countryside wondering what really happens to them if we do go over the federal cliff.,SCOTT SPOERRY.
206,"Taxes go up, spending goes down.",SCOTT SPOERRY.
207,Do they need to look for a recession?,SCOTT SPOERRY.
208,"Are employers going to really cut back on the employment, do you think?",SCOTT SPOERRY.
209,"What do people out there really need to worry about and prepare for when it comes to actually going over that fiscal cliff, if the folks in Washington can’t get their act together?",SCOTT SPOERRY.
210,"Well, I come from a part of South Carolina which has been economically challenged for quite a long time and remains so.",CHAIRMAN BERNANKE.
211,"I mean certain parts of South Carolina have developed pretty strongly but the part where I come from—mostly agricultural, it has a little bit of manufacturing—has a very high unemployment rate, a high foreclosure rate,  and people are having a hard time there.",CHAIRMAN BERNANKE.
212,And I’ve visited there a few times since I became Chairman.,CHAIRMAN BERNANKE.
213,"So, part of the reason that, you know, we are engaging these policies is to try and create a stronger economy—more jobs—so that folks across the country, including places like the one where I grew up, you know, will have more opportunity to have better lives for themselves.",CHAIRMAN BERNANKE.
214,So that’s extremely important and I think it’s very important that we not just look at the numbers.,CHAIRMAN BERNANKE.
215,"It’s easy to look at the unemployment rate and say, well it’s one-tenth or two-tenths.",CHAIRMAN BERNANKE.
216,"Every tenth means, you know, many, many people are represented there.",CHAIRMAN BERNANKE.
217,"So it is very important to try to keep in mind the reality of unemployment, of foreclosure, of weak wage growth, et cetera, so we always try to do that.",CHAIRMAN BERNANKE.
218,And I want to—it’s always a delicate balance—you don’t want to scare people.,CHAIRMAN BERNANKE.
219,"And I actually believe that Congress will come up with a solution, and I certainly hope they will.",CHAIRMAN BERNANKE.
220,"But as many analysts, not just the Fed, have pointed out, if the fiscal cliff was allowed to occur, and certainly if it were sustained for any period, it could have a very negative effect on hiring, jobs, wages, economic activity, investment.",CHAIRMAN BERNANKE.
221,"And of course, the consequences of that will be felt by everybody but certainly by those in areas like where I grew up that are relatively weak economically, would no doubt would feel the greater brunt.",CHAIRMAN BERNANKE.
222,"So, it’s exceptionally urgent and important that the Congress and the Administration come to a sensible agreement on this issue.",CHAIRMAN BERNANKE.
223,"Okay, sir, I had a follow-up, too.",SCOTT SPOERRY.
224,I’m not going to ask you whether we’re in a bond bubble.,SCOTT SPOERRY.
225,"But obviously, the new guidance that you’ve given in the FOMC statement is going to give a lot more clues to people who own bonds about when they might start lightening up their bond portfolios and changing the composition of what they own.",SCOTT SPOERRY.
226,"Was  concerns about information about bond prices and things happening in a big hurry, in terms of some sort of a bubble popping—was that a consideration in adding this transparency?",SCOTT SPOERRY.
227,I wouldn’t say it was an important motivation for adding transparency.,CHAIRMAN BERNANKE.
228,I think transparency has a lot of value.,CHAIRMAN BERNANKE.
229,But it is the—it is a fact that this greater clarity will help markets better predict how bond yields will behave.,CHAIRMAN BERNANKE.
230,"As we go forward in time, if the economy continues to strengthen as we hope, as the exit comes closer for the Federal Reserve, then you would expect longer-term bond yields to begin to rise.",CHAIRMAN BERNANKE.
231,"And the more information we can provide to markets about the conditionality under which the Fed would consider removing accommodation, the better information they’ll have about the likely path of bonds and that will allow for a smoother adjustment.",CHAIRMAN BERNANKE.
232,So I think that’s a positive aspect of this communication.,CHAIRMAN BERNANKE.
233,It—I wouldn’t say it was the major reason.,CHAIRMAN BERNANKE.
234,"The major reason is to give the markets and the public more transparency about what’s determining our policy, but that is one potential advantage.",CHAIRMAN BERNANKE.
235,Robin Harding from the Financial Times.,ROBIN HARDING.
236,"Mr. Chairman, you said a moment ago that these thresholds are based on an analysis of optimal policy.",ROBIN HARDING.
237,"In the optimal policy path that Vice Chair Yellen laid out in her speech a few weeks ago, it showed the first rise in interest rates occurring in early 2016 and then rates rising very slowly after that.",ROBIN HARDING.
238,Is that the policy that the Fed is now following?,ROBIN HARDING.
239,"And secondly, if I may, you referred to a number of inflation forecasts in your introductory remarks.",ROBIN HARDING.
240,"In that case, how will we ever know that the inflation threshold has been hit?",ROBIN HARDING.
241,Thank you.,ROBIN HARDING.
242,"So, the kind of optimal policy path that Vice Chairman Yellen showed is indicative of the kinds of analysis we’ve done.",CHAIRMAN BERNANKE.
243,"I mean, we’ve run it for a variety of different scenarios, different assumptions about models, and so on, but the general  character of that interest rate path, i.e., that it stays low until unemployment is in the vicinity of 6½ or a little lower, and then rises relatively slowly, which goes back to the question that was asked earlier, that it doesn’t involve a rapid removal of accommodation after that point is reached.",CHAIRMAN BERNANKE.
244,"That is consistent with that kind of analysis, and that’s the type of analysis that was not the only thing we looked at but was informative in our discussion.",CHAIRMAN BERNANKE.
245,"You’ll note also in that kind of policy path, of the type that she discussed, that inflation stays essentially at 2 or very close to 2.",CHAIRMAN BERNANKE.
246,"In terms of inflation forecast, the—what the Committee will do on a regular basis is include in its statement its views of where inflation is likely to be a year from now.",CHAIRMAN BERNANKE.
247,"For example, currently, we already say that, you know, we expect inflation to run at or below the Committee’s objective in a longer term.",CHAIRMAN BERNANKE.
248,"The intellectual exercise we’ll be doing is asking ourselves if we maintain low rates along the lines suggested by this policy, would we expect inflation to cross the threshold or reach that level?",CHAIRMAN BERNANKE.
249,"Now, it’s very important that the public, the media, the markets find our projections credible, obviously.",CHAIRMAN BERNANKE.
250,"And so for that reason, you know, we will be referring extensively to publicly available information such as various measures of inflation—I mentioned some in my opening remarks—outside forecasts, the breakevens from inflation protected bonds, et cetera.",CHAIRMAN BERNANKE.
251,"So, if our outlook deviates in any sense in a significant way from sort of what all these things are saying, at a minimum, it will be incumbent on me and the rest of us to explain that.",CHAIRMAN BERNANKE.
252,"But my expectation is that our projections will be broadly consistent with public views, public information, and so I think we can manage the credibility issue.",CHAIRMAN BERNANKE.
253,"But again, just to be clear, the projection that matters for our determination is the one that the Committee collectively comes up with.",CHAIRMAN BERNANKE.
254,"Sir, you’ve articulated more clearly than ever your commitment to reduce unemployment, but you’ve also said that you’re not actually doing anything more to achieve that goal—that you still expect it to be three years away, that you’re disappointed with the pace of progress, and that inflation is not the limiting factor.",BINYAMIN APPLEBAUM.
255,What is the limiting factor?,BINYAMIN APPLEBAUM.
256,Why is the Fed not announcing today additional measures to reduce unemployment?,BINYAMIN APPLEBAUM.
257,What would it take for you to get that?,BINYAMIN APPLEBAUM.
258,"Well, we took—the question was whether this was something new relative to September, I think September was the date where we did do a substantial increase in accommodation.",CHAIRMAN BERNANKE.
259,"At that point, we announced our dissatisfaction with the state of the labor market and the outlook for jobs and said we would take further action if the outlook didn’t improve.",CHAIRMAN BERNANKE.
260,And what we’ve done today is really just following through what we said.,CHAIRMAN BERNANKE.
261,"So, I would say that, you know, looking at it from the perspective of September, that we have, in fact, taken significant additional action to provide support for the recovery and for job creation.",CHAIRMAN BERNANKE.
262,"The reason—one of the considerations though, as I’ve talked about, is that, you know, given that we are now in the world of unconventional policy that has both uncertain costs and uncertain efficacy or uncertain benefits, you know, that creates a more—somewhat more complicated policy decision than the old style of just changing the federal funds rate.",CHAIRMAN BERNANKE.
263,"You know, there are concerns that I’ve talked about in these briefings before that if the balance sheet gets indefinitely large that there would be potential risks in terms of financial stability, in terms of market functioning.",CHAIRMAN BERNANKE.
264,And the Committee takes these risks very seriously.,CHAIRMAN BERNANKE.
265,And they impose a certain cost on policy that doesn’t exist when you’re dealing only with the federal funds rate.,CHAIRMAN BERNANKE.
266,"And so what we’re trying to do here is balance the potential benefits, in terms of lower  unemployment and inflation at target, against the reality that as the balance sheet gets bigger that there’s greater costs that might be associated with that, and those have to be taken to account.",CHAIRMAN BERNANKE.
267,"Sir, if I can just follow, so these forecasts presumably incorporate the actions taken into account, and so given those actions, it will still be three years until you achieve your goals.",BINYAMIN APPLEBAUM.
268,"Is the message to people who are unemployed basically, “We are doing all we can?”  Is this the conclusion that, given that balance of factors, this is the most we can expect?",BINYAMIN APPLEBAUM.
269,"Well, first of all, again, these—the projections that you’re looking at are based on each individual—this is not a Committee collective projection.",CHAIRMAN BERNANKE.
270,"What they are, of course, is 19 separate participants making their own projections based on their own views of optimal policy.",CHAIRMAN BERNANKE.
271,"So, for example, it includes those folks who think that we shouldn’t be doing any more purchases and their forecasts are included in there as well.",CHAIRMAN BERNANKE.
272,"So, it’s not exactly an apples to apples comparison, but it is true that if we could wave a magic wand and get unemployment down to 5 percent tomorrow, obviously we would do that, but there are constraints in terms of the dynamics of the economy, in terms of the power of these tools, and in terms of the fact that we do need to take into account, you know, the possibility of other costs and risks that might be associated with a large expansion of our balance sheet.",CHAIRMAN BERNANKE.
273,"To just—Darren Gersh, Nightly Business Report.",DARREN GERSH.
274,"So just following up on that last question, how helpful would it be to see, as part of the fiscal cliff resolution, some near-term stimulus?",DARREN GERSH.
275,The President’s proposed that.,DARREN GERSH.
276,"Do you think—how helpful do you think that would be and, I’ll ask my follow up now, whatever happened to your southern accent?",DARREN GERSH.
277,"Well, on the second one, I’d like to think I’m bilingual.",CHAIRMAN BERNANKE.
278,"When I go home sometimes I—it comes out pretty strongly, but I won’t try to do that here.",CHAIRMAN BERNANKE.
279,"So, I  try to be careful, as you know, not to give views on specific tax and spending programs.",CHAIRMAN BERNANKE.
280,"I think, of course, obviously those are the province of the Administration and Congress.",CHAIRMAN BERNANKE.
281,"The attitude I’ve taken has been that, at a minimum, Congress should try to do no harm, that they should try to avoid policies that significantly slow or derail the recovery at this point.",CHAIRMAN BERNANKE.
282,So I think that’s the critical thing along with the long-term objective of achieving a sustainable fiscal path.,CHAIRMAN BERNANKE.
283,"Now, given that basic recommendation, you know, Congress can consider variations.",CHAIRMAN BERNANKE.
284,"For example, if they believe that they can achieve a strong, credible future path for fiscal policy, that would give them potentially some space to do something a little bit more expansionary in the short term.",CHAIRMAN BERNANKE.
285,"But, those are judgments I think that Congress has to make about whether they can simultaneously continue supportive fiscal policy in the short term while maintaining the credibility that, in fact, they will be addressing our structural deficit problems in the longer term.",CHAIRMAN BERNANKE.
286,And that is I think really a question for them and for their staff.,CHAIRMAN BERNANKE.
287,Kristina Peterson of Dow Jones.,KRISTINA PETERSON.
288,"Looking over the past year or several years, how would you evaluate the Fed’s accuracy making economic forecasts, and how does that affect the ability to make monetary policy decisions, especially as it’s connected to the thresholds?",KRISTINA PETERSON.
289,"Well, I think it’s fair to say that we have overestimated the pace of growth, total output growth, GDP growth, from the beginning of the recovery and we have had therefore—had to continue to scale down our estimates of output growth.",CHAIRMAN BERNANKE.
290,"But interestingly, at the same time, we have been more accurate, not perfectly accurate by any means, but we’ve been somewhat more accurate in forecasting unemployment.",CHAIRMAN BERNANKE.
291,And how do you reconcile those two things?,CHAIRMAN BERNANKE.
292,"I talked about this in remarks I gave at the New York Economic Club recently, right before Thanksgiving.",CHAIRMAN BERNANKE.
293,"And I think the reconciliation is that what we’re  learning is that, at least temporarily, the financial crisis may have reduced somewhat the underlying potential growth rate of the U.S. economy.",CHAIRMAN BERNANKE.
294,"It has interfered with business creation, with investment, with technological advances, and so on.",CHAIRMAN BERNANKE.
295,And that can account for at least part of the somewhat slower growth.,CHAIRMAN BERNANKE.
296,"At the same time, though, what—of course, what monetary policy influences is not potential growth, not the underlying structural growth.",CHAIRMAN BERNANKE.
297,That’s for—many other different kinds of policies affect that.,CHAIRMAN BERNANKE.
298,"What monetary policy affects, primarily, is the state of the business cycle, the amount of excess unemployment or the extent of recession in the economy.",CHAIRMAN BERNANKE.
299,"And there, I think we’ve also perhaps underestimated a bit the recession, but we’ve been much closer there.",CHAIRMAN BERNANKE.
300,And I think therefore that we’ve been able to address that somewhat more effectively with quite accommodative policies.,CHAIRMAN BERNANKE.
301,"That being said, of course, we have over time, as we have seen disappointment in growth and job creation, we have obviously, as we did in September, have added accommodation and we’ve continued—we continue to reassess the outlook.",CHAIRMAN BERNANKE.
302,"I think it’s only fair to say that economic forecasting beyond a few quarters is very, very difficult.",CHAIRMAN BERNANKE.
303,"And what we basically are trying to do is create a plausible scenario which we think is reasonably likely—base policy on that, but we prepared to adjust as new information comes in and as the outlook changes, and inevitably it will.",CHAIRMAN BERNANKE.
304,"Thank you, Mr. Chairman.",GREG IP.
305,Greg Ip of the Economist.,GREG IP.
306,Economists have long believed that central banks cannot affect the unemployment rate in the long run.,GREG IP.
307,That’s one reason you’ve seen a move towards central banks being given mandates for low inflation only.,GREG IP.
308,"Can you explain if the Fed, by tying its monetary policy so explicitly to an unemployment threshold, whether that is consistent or inconsistent with that longstanding view?",GREG IP.
309,"And, if it’s consistent, how is this superior to simply having a threshold for inflation only?",GREG IP.
