224,2543.800,2561.360,I would take somewhat faster wage increases to be a sign that labor market slack is diminishing and that the labor market is approaching conditions that are consistent with maximum employment.,CHAIR YELLEN.,2016-06-15 19:12:23.800000+00:00,2016-06-15 19:12:24+00:00,2016-06-15 19:12:41+00:00,1.1262200000000002,1.12633,-0.00010999999999983245,2082.827,2082.338,0.48900000000003274
225,2561.360,2572.600,"So, I think, you know, I think we have seen some hints, perhaps preliminary indications, that wage growth is picking up.",CHAIR YELLEN.,2016-06-15 19:12:41.360000+00:00,2016-06-15 19:12:41+00:00,2016-06-15 19:12:53+00:00,1.1262,1.1262200000000002,-2.0000000000131024e-05,2082.951,2082.839,0.11200000000008004
226,2572.600,2585.440,"And as much as anything, I think it’s a sign of a generally healthy labor market, which is what our mandated objective is, to achieve maximum employment.",CHAIR YELLEN.,2016-06-15 19:12:52.600000+00:00,2016-06-15 19:12:53+00:00,2016-06-15 19:13:05+00:00,1.12636,1.1262,0.00015999999999993797,2082.3520000000003,2082.865,-0.5129999999994652
227,2585.440,2587.360,And so it would be a symptom of it.,CHAIR YELLEN.,2016-06-15 19:13:05.440000+00:00,2016-06-15 19:13:05+00:00,2016-06-15 19:13:07+00:00,1.1264,1.1264,0.0,2082.341,2082.341,0.0
228,2587.360,2595.400,Greg Robb from MarketWatch.,GREG ROBB.,2016-06-15 19:13:07.360000+00:00,2016-06-15 19:13:07+00:00,2016-06-15 19:13:15+00:00,1.12645,1.12641,4.0000000000040004e-05,2081.722,2082.071,-0.3489999999997053
229,2595.400,2612.600,"There’s been a lot of discussion in last couple months about the slow pace of demand in the global economy, and some economists think that central banks should think about using helicopter money, maybe in Japan first or Europe first.",GREG ROBB.,2016-06-15 19:13:15.400000+00:00,2016-06-15 19:13:15+00:00,2016-06-15 19:13:33+00:00,1.12663,1.1265,0.00012999999999996348,2082.35,2082.078,0.2719999999999345
230,2612.600,2623.680,"But then, former Fed Chairman Ben Bernanke weighed in saying that he thought it would be a good thing for the Fed to put helicopter money in its toolkit in case there was a downturn in the United States.",GREG ROBB.,2016-06-15 19:13:32.600000+00:00,2016-06-15 19:13:33+00:00,2016-06-15 19:13:44+00:00,1.12663,1.12669,-5.999999999994898e-05,2082.108,2082.32,-0.21199999999998909
231,2623.680,2626.160,So I’d like to get your comments on that.,GREG ROBB.,2016-06-15 19:13:43.680000+00:00,2016-06-15 19:13:44+00:00,2016-06-15 19:13:46+00:00,1.12661,1.12661,0.0,2081.982,2081.982,0.0
232,2626.160,2642.840,"So, in normal times, I think it’s very important that there be a separation between monetary and fiscal policy, and it’s a primary reason for independence of a central bank.",CHAIR YELLEN.,2016-06-15 19:13:46.160000+00:00,2016-06-15 19:13:46+00:00,2016-06-15 19:14:03+00:00,1.12671,1.1266200000000002,8.999999999992347e-05,2081.855,2081.5820000000003,0.2729999999996835
233,2642.840,2675.760,"We have seen all too many examples of countries that end up with high or even hyperinflation because those in charge of fiscal policy direct their central bank to help them finance it by printing money, and maintaining price stability and low and stable inflation is very much aided by having central bank independence.",CHAIR YELLEN.,2016-06-15 19:14:02.840000+00:00,2016-06-15 19:14:03+00:00,2016-06-15 19:14:36+00:00,1.12681,1.12673,8.000000000008001e-05,2082.363,2082.108,0.2549999999996544
234,2675.760,2692.920,"Now, that said, in unusual times where the concern is with very weak growth or possibly deflation—rather rare circumstances—first of all, fiscal policy can be a very important tool.",CHAIR YELLEN.,2016-06-15 19:14:35.760000+00:00,2016-06-15 19:14:36+00:00,2016-06-15 19:14:53+00:00,1.1267,1.12678,-7.999999999985796e-05,2083.11,2082.473,0.637000000000171
235,2692.920,2705.360,"And it’s natural that if it can be employed that, just as monetary policy is doing a lot to try to stimulate growth, that fiscal policy should play a role.",CHAIR YELLEN.,2016-06-15 19:14:52.920000+00:00,2016-06-15 19:14:53+00:00,2016-06-15 19:15:05+00:00,1.12699,1.12671,0.00027999999999983594,2082.596,2083.09,-0.4940000000001419
236,2705.360,2717.400,"And normally, you would hope, in an economy with those severe downside risks, monetary and fiscal policy would not be working at cross purposes to get—but together.",CHAIR YELLEN.,2016-06-15 19:15:05.360000+00:00,2016-06-15 19:15:05+00:00,2016-06-15 19:15:17+00:00,1.12705,1.12695,0.00010000000000021103,2081.825,2082.7,-0.875
237,2717.400,2742.040,"Now, whether or not in such extreme circumstances, there might be a case for, let’s say, coordination—close coordination, with the central bank playing a role in financing fiscal policy; this is something that academics are debating, and it is something that one might legitimately consider.",CHAIR YELLEN.,2016-06-15 19:15:17.400000+00:00,2016-06-15 19:15:17+00:00,2016-06-15 19:15:42+00:00,1.12692,1.12701,-9.000000000014552e-05,2081.6,2081.619,-0.01900000000023283
238,2742.040,2760.440,"I would see this as a very abnormal, extreme situation where one needs an all-out attempt, and even then it’s a matter that academics are debating, but only in an unusual situation.",CHAIR YELLEN.,2016-06-15 19:15:42.040000+00:00,2016-06-15 19:15:42+00:00,2016-06-15 19:16:00+00:00,1.12685,1.1269,-5.0000000000105516e-05,2081.34,2081.35,-0.009999999999763531
239,2760.440,2765.800,"Justine Underhill, Yahoo Finance.",JUSTINE UNDERHILL.,2016-06-15 19:16:00.440000+00:00,2016-06-15 19:16:00+00:00,2016-06-15 19:16:06+00:00,1.12684,1.12687,-2.999999999997449e-05,2081.25,2081.46,-0.21000000000003638
240,2765.800,2780.920,"So now that the Fed has started the process of raising rates, various Fed officials have said, including Ben Bernanke, that the Fed could go cash flow negative in this scenario as capital losses are taken on the portfolio of bonds.",JUSTINE UNDERHILL.,2016-06-15 19:16:05.800000+00:00,2016-06-15 19:16:06+00:00,2016-06-15 19:16:21+00:00,1.1268200000000002,1.12684,-1.999999999990898e-05,2080.854,2081.354,-0.5
241,2780.920,2783.800,"Do you still see this happening, and when might this happen?",JUSTINE UNDERHILL.,2016-06-15 19:16:20.920000+00:00,2016-06-15 19:16:21+00:00,2016-06-15 19:16:24+00:00,1.1268200000000002,1.1268200000000002,0.0,2080.952,2080.9570000000003,-0.005000000000109139
242,2783.800,2787.440,So you’re talking about our income going negative?,CHAIR YELLEN.,2016-06-15 19:16:23.800000+00:00,2016-06-15 19:16:24+00:00,2016-06-15 19:16:27+00:00,1.12685,1.1268200000000002,2.9999999999752447e-05,2080.82,2080.822,-0.0019999999999527063
243,2787.440,2787.840,Yes.,JUSTINE UNDERHILL.,2016-06-15 19:16:27.440000+00:00,2016-06-15 19:16:27+00:00,2016-06-15 19:16:28+00:00,1.12687,1.12687,0.0,2080.856,2080.841,0.015000000000327418
244,2787.840,2814.640,"Well, it is conceivable in a scenario when—where growth and inflation really surprise us to the upside that we would have to raise short-term interest rates so rapidly that the rates we would be paying on reserves would exceed what we’re earning on our portfolio.",CHAIR YELLEN.,2016-06-15 19:16:27.840000+00:00,2016-06-15 19:16:28+00:00,2016-06-15 19:16:55+00:00,1.12684,1.1269,-5.999999999994898e-05,2081.073,2080.862,0.21099999999978536
245,2814.640,2825.760,"Now even then, we have about $2 trillion of liabilities, namely currency on which we pay no interest.",CHAIR YELLEN.,2016-06-15 19:16:54.640000+00:00,2016-06-15 19:16:55+00:00,2016-06-15 19:17:06+00:00,1.12692,1.12684,7.999999999985796e-05,2080.976,2080.824,0.15200000000004366
246,2825.760,2834.960,So this does requires an extreme scenario with very rapid increases in short-term interest rates.,CHAIR YELLEN.,2016-06-15 19:17:05.760000+00:00,2016-06-15 19:17:06+00:00,2016-06-15 19:17:15+00:00,1.12685,1.12692,-7.00000000000145e-05,2081.608,2080.98,0.6280000000001564
247,2834.960,2841.040,So it is conceivable but quite unlikely that it could happen.,CHAIR YELLEN.,2016-06-15 19:17:14.960000+00:00,2016-06-15 19:17:15+00:00,2016-06-15 19:17:21+00:00,1.12687,1.12687,0.0,2081.587,2081.609,-0.021999999999934516
248,2841.040,2849.120,"But, you know, if it were to happen, we would have an economy that would be doing very well.",CHAIR YELLEN.,2016-06-15 19:17:21.040000+00:00,2016-06-15 19:17:21+00:00,2016-06-15 19:17:29+00:00,1.12677,1.1268,-2.999999999997449e-05,2081.575,2081.605,-0.03000000000020009
249,2849.120,2870.880,"This is probably an economy that everybody would feel very pleased—was performing well and better than expected, and where monetary policy—you know, our goal is price stability and maximum employment, and we would probably feel that we had done very well in achieving that.",CHAIR YELLEN.,2016-06-15 19:17:29.120000+00:00,2016-06-15 19:17:29+00:00,2016-06-15 19:17:51+00:00,1.12679,1.12677,1.999999999990898e-05,2081.83,2081.711,0.11900000000014188
250,2870.880,2880.080,"So, we usually make money—we’ve been making a lot of money in recent years, but the goal of monetary policy is not to maximize our income.",CHAIR YELLEN.,2016-06-15 19:17:50.880000+00:00,2016-06-15 19:17:51+00:00,2016-06-15 19:18:00+00:00,1.12668,1.12677,-9.000000000014552e-05,2081.981,2081.867,0.11400000000003274
251,2880.080,2890.560,"And, you know, in a very strong economy like that, the Treasury would be seeing a lot of inflows in the form of tax revenues, too.",CHAIR YELLEN.,2016-06-15 19:18:00.080000+00:00,2016-06-15 19:18:00+00:00,2016-06-15 19:18:11+00:00,1.12678,1.12668,9.999999999998899e-05,2082.101,2081.988,0.11300000000028376
252,2890.560,2897.880,"Madam Chair, Steve Beckner of Market News International.",STEVE BECKNER.,2016-06-15 19:18:10.560000+00:00,2016-06-15 19:18:11+00:00,2016-06-15 19:18:18+00:00,1.12681,1.1268,1.0000000000065512e-05,2082.09,2082.088,0.0019999999999527063
253,2897.880,2916.440,"To what extent do you feel constrained in raising interest rates by the low or even negative rates that foreign central banks are pursuing, possibly out of concern for what it might mean for the dollar exchange rate?",STEVE BECKNER.,2016-06-15 19:18:17.880000+00:00,2016-06-15 19:18:18+00:00,2016-06-15 19:18:36+00:00,1.12685,1.12685,0.0,2081.911,2081.862,0.04899999999997817
254,2916.440,2933.800,"And, if that is a constraint, to what extent are you—might you also be concerned about the impact, long range, of low domestic rates on possibly distorting domestic markets?",STEVE BECKNER.,2016-06-15 19:18:36.440000+00:00,2016-06-15 19:18:36+00:00,2016-06-15 19:18:54+00:00,1.1268,1.12687,-7.00000000000145e-05,2081.823,2081.935,-0.11200000000008004
255,2933.800,2951.120,"So the state of foreign economies, both their growth outlooks and the stance of monetary policy, those are factors that influence the U.S. outlook and influence the appropriate stance of monetary policy.",CHAIR YELLEN.,2016-06-15 19:18:53.800000+00:00,2016-06-15 19:18:54+00:00,2016-06-15 19:19:11+00:00,1.1267,1.1268,-9.999999999998899e-05,2082.09,2081.846,0.24400000000014188
256,2951.120,2965.080,"So, of course, we do look at foreign rates, the prospects—and the prospects for growth in those economies in considering the stance of policy.",CHAIR YELLEN.,2016-06-15 19:19:11.120000+00:00,2016-06-15 19:19:11+00:00,2016-06-15 19:19:25+00:00,1.1266,1.1267,-9.999999999998899e-05,2081.967,2082.077,-0.11000000000012733
257,2965.080,2991.400,"Differentials between countries in likely policy paths do tend to spill over into exchange rates—that is a standard part of how monetary policy works—and a stronger dollar, those have a both—a depressing effect.",CHAIR YELLEN.,2016-06-15 19:19:25.080000+00:00,2016-06-15 19:19:25+00:00,2016-06-15 19:19:51+00:00,1.1267200000000002,1.1266,0.00012000000000012001,2082.112,2081.842,0.2699999999999818
258,2991.400,2997.080,It creates channels through which domestic demand is depressed.,CHAIR YELLEN.,2016-06-15 19:19:51.400000+00:00,2016-06-15 19:19:51+00:00,2016-06-15 19:19:57+00:00,1.12675,1.12675,0.0,2082.322,2082.092,0.2300000000000182
259,2997.080,3013.440,"At the moment, net exports—well, for quite some time and probably going forward, they will be somewhat of a drag on U.S. growth, so that’s a factor that we take into account.",CHAIR YELLEN.,2016-06-15 19:19:57.080000+00:00,2016-06-15 19:19:57+00:00,2016-06-15 19:20:13+00:00,1.12675,1.12676,-1.0000000000065512e-05,2082.075,2082.355,-0.2800000000002001
260,3013.440,3025.960,And increases in the dollar that we’ve seen since mid-2014 have served to push inflation down as well; it can also have impacts on commodity prices that are relevant.,CHAIR YELLEN.,2016-06-15 19:20:13.440000+00:00,2016-06-15 19:20:13+00:00,2016-06-15 19:20:26+00:00,1.1267,1.12675,-4.999999999988347e-05,2082.097,2082.083,0.014000000000123691
261,3025.960,3042.360,"So, it’s—it is certainly relevant to the stance of U.S. monetary policy and a factor, but when one says “a constraint,” I really would not go so far as to say it is a constraint on monetary policy.",CHAIR YELLEN.,2016-06-15 19:20:25.960000+00:00,2016-06-15 19:20:26+00:00,2016-06-15 19:20:42+00:00,1.1268,1.1267,9.999999999998899e-05,2082.588,2082.117,0.47100000000000364
262,3042.360,3060.800,"When we have an outlook for continuing above-trend growth—that if we held rates absolutely flat, we have reason to believe inflation would overshoot our target—we would see a case to gradually raise rates over time.",CHAIR YELLEN.,2016-06-15 19:20:42.360000+00:00,2016-06-15 19:20:42+00:00,2016-06-15 19:21:01+00:00,1.12669,1.12679,-9.999999999998899e-05,2082.348,2082.597,-0.24900000000025102
263,3060.800,3071.560,"At the moment, I think markets do expect, and this is factored into market prices, a gradual path for rates to increase over time.",CHAIR YELLEN.,2016-06-15 19:21:00.800000+00:00,2016-06-15 19:21:01+00:00,2016-06-15 19:21:12+00:00,1.12664,1.12668,-3.999999999981796e-05,2082.615,2082.571,0.04399999999986903
264,3071.560,3088.520,"But, for example, if we were to see upside surprises to growth and to inflation and had to raise short-term rates faster, thought we should, one of the channels by which that would work would be the associated impact on the dollar.",CHAIR YELLEN.,2016-06-15 19:21:11.560000+00:00,2016-06-15 19:21:12+00:00,2016-06-15 19:21:29+00:00,1.12671,1.12664,7.00000000000145e-05,2082.583,2082.588,-0.005000000000109139
265,3088.520,3100.440,"That is a standard channel through which the monetary policy transmission mechanism works, and we would take it into account and would not feel constrained, but that would be part of how it would work.",CHAIR YELLEN.,2016-06-15 19:21:28.520000+00:00,2016-06-15 19:21:29+00:00,2016-06-15 19:21:40+00:00,1.12675,1.12669,5.999999999994898e-05,2082.609,2082.61,-0.0010000000002037268
266,3100.440,3109.040,"How much do you—oh, Nancy Marshall-Genzer from Marketplace.",NANCY MARSHALL-GENZER.,2016-06-15 19:21:40.440000+00:00,2016-06-15 19:21:40+00:00,2016-06-15 19:21:49+00:00,1.1268,1.12675,5.0000000000105516e-05,2082.82,2082.617,0.20299999999997453
267,3109.040,3118.840,"How much are you watching oil prices and their impact on inflation, and how that could affect the timing of future rate increases and how much you might increase rates?",NANCY MARSHALL-GENZER.,2016-06-15 19:21:49.040000+00:00,2016-06-15 19:21:49+00:00,2016-06-15 19:21:59+00:00,1.1266500000000002,1.12676,-0.00010999999999983245,2083.094,2082.821,0.27300000000013824
268,3118.840,3127.440,"Well, oil prices have had many different effects on the economy, and so we’ve been watching oil prices closely.",CHAIR YELLEN.,2016-06-15 19:21:58.840000+00:00,2016-06-15 19:21:59+00:00,2016-06-15 19:22:07+00:00,1.12664,1.12664,0.0,2083.2200000000003,2083.098,0.12200000000029831
269,3127.440,3135.200,"As you said, falling oil prices pull down inflation.",CHAIR YELLEN.,2016-06-15 19:22:07.440000+00:00,2016-06-15 19:22:07+00:00,2016-06-15 19:22:15+00:00,1.12657,1.12664,-7.00000000000145e-05,2083.08,2083.093,-0.012999999999919964
270,3135.200,3143.960,"You know, it takes falling oil prices to lower inflation on a sustained basis.",CHAIR YELLEN.,2016-06-15 19:22:15.200000+00:00,2016-06-15 19:22:15+00:00,2016-06-15 19:22:24+00:00,1.12658,1.12659,-1.0000000000065512e-05,2083.347,2083.223,0.12400000000025102
271,3143.960,3151.720,"Once they stabilize at whatever level, their impact on inflation dissipates over time.",CHAIR YELLEN.,2016-06-15 19:22:23.960000+00:00,2016-06-15 19:22:24+00:00,2016-06-15 19:22:32+00:00,1.12645,1.12651,-5.999999999994898e-05,2083.1020000000003,2083.087,0.015000000000327418
272,3151.720,3155.240,So we’re beginning to see that happening.,CHAIR YELLEN.,2016-06-15 19:22:31.720000+00:00,2016-06-15 19:22:32+00:00,2016-06-15 19:22:35+00:00,1.12644,1.12644,0.0,2083.114,2083.094,0.01999999999998181
273,3155.240,3164.720,"Not only have they stabilized, they have moved up some, and their inflation is—their impact on inflation is waning over time.",CHAIR YELLEN.,2016-06-15 19:22:35.240000+00:00,2016-06-15 19:22:35+00:00,2016-06-15 19:22:45+00:00,1.12634,1.12641,-7.00000000000145e-05,2082.583,2082.703,-0.11999999999989086
274,3164.720,3183.960,"But oil prices have also had a very substantial negative effect on drilling and mining activity that’s led to weakness in investment spending and job loss in manufacturing and, obviously, in the energy sector.",CHAIR YELLEN.,2016-06-15 19:22:44.720000+00:00,2016-06-15 19:22:45+00:00,2016-06-15 19:23:04+00:00,1.12637,1.12633,4.0000000000040004e-05,2083.492,2082.863,0.6290000000003602
275,3183.960,3189.200,"Now, you know, it has different effects in different countries and different sectors.",CHAIR YELLEN.,2016-06-15 19:23:03.960000+00:00,2016-06-15 19:23:04+00:00,2016-06-15 19:23:09+00:00,1.12639,1.12639,0.0,2083.36,2083.331,0.028999999999996362
276,3189.200,3192.480,"For American households, it’s been a boon.",CHAIR YELLEN.,2016-06-15 19:23:09.200000+00:00,2016-06-15 19:23:09+00:00,2016-06-15 19:23:12+00:00,1.12644,1.12647,-2.999999999997449e-05,2083.325,2083.3520000000003,-0.027000000000498403
277,3192.480,3211.080,"We’ve estimated that since mid-2014, the decline in energy prices and oil prices has probably resulted in gains of about $1,400 per U.S. household, and that’s had an offsetting positive impact on spending.",CHAIR YELLEN.,2016-06-15 19:23:12.480000+00:00,2016-06-15 19:23:12+00:00,2016-06-15 19:23:31+00:00,1.12634,1.12644,-0.00010000000000021103,2083.088,2083.458,-0.36999999999989086
278,3211.080,3234.720,"But in many countries around the world that are important commodity exporters, the decline we’ve seen in oil prices has had a depressing effect on their growth, their trade with us and other trade partners, and caused problems that have had spillovers to the global economy as well.",CHAIR YELLEN.,2016-06-15 19:23:31.080000+00:00,2016-06-15 19:23:31+00:00,2016-06-15 19:23:55+00:00,1.12634,1.12634,0.0,2083.587,2083.1020000000003,0.4849999999996726
279,3234.720,3239.360,So it’s a complicated picture.,CHAIR YELLEN.,2016-06-15 19:23:54.720000+00:00,2016-06-15 19:23:55+00:00,2016-06-15 19:23:59+00:00,1.12636,1.12631,5.0000000000105516e-05,2083.325,2083.364,-0.03900000000021464
280,3239.360,3243.960,Thank you.,NANCY MARSHALL-GENZER.,2016-06-15 19:23:59.360000+00:00,2016-06-15 19:23:59+00:00,,,1.12627,,,2083.4570000000003,
