147,1880.120,1894.120,"On the other side, of course, we have seen a marked decline in drilling activity, which has depressed investment spending, and, of course, very substantial layoffs in the energy sector.",CHAIR YELLEN.,2016-03-16 19:01:20.120000+00:00,2016-03-16 19:01:20+00:00,2016-03-16 19:01:34+00:00,1.12056,1.12018,0.00038000000000004697,2022.605,2023.247,-0.6420000000000528
148,1894.120,1923.160,"With respect to impact of oil prices on inflation and what would happen if they move up, the Committee has generally tended to look through movements in oil prices, whether they were on the upside or on the downside, viewing it as a factor that should have a transitory influence.",CHAIR YELLEN.,2016-03-16 19:01:34.120000+00:00,2016-03-16 19:01:34+00:00,2016-03-16 19:02:03+00:00,1.12149,1.12087,0.0006200000000000649,2024.129,2022.405,1.7239999999999327
149,1923.160,1931.680,"And when I say that, what I mean is that if oil prices move up during the time that it’s moving up, it raises inflation.",CHAIR YELLEN.,2016-03-16 19:02:03.160000+00:00,2016-03-16 19:02:03+00:00,2016-03-16 19:02:12+00:00,1.12123,1.12136,-0.00012999999999996348,2024.715,2024.195,0.5199999999999818
150,1931.680,1942.760,"But they don’t need to move down again to their previous levels for that influence to disappear, they only need to stabilize at a higher level.",CHAIR YELLEN.,2016-03-16 19:02:11.680000+00:00,2016-03-16 19:02:12+00:00,2016-03-16 19:02:23+00:00,1.12098,1.12135,-0.00036999999999998145,2024.594,2024.71,-0.11599999999998545
151,1942.760,1958.880,"And, similarly, oil prices have obviously moved down a great deal over the last year, and we’re not expecting them to move back to their previous levels but to stabilize at some level.",CHAIR YELLEN.,2016-03-16 19:02:22.760000+00:00,2016-03-16 19:02:23+00:00,2016-03-16 19:02:39+00:00,1.1207,1.12118,-0.00048000000000003595,2024.863,2024.331,0.5320000000001528
152,1958.880,1969.440,"They’re obviously volatile, but, as they stabilize, the influence will move out of both headline—of headline inflation.",CHAIR YELLEN.,2016-03-16 19:02:38.880000+00:00,2016-03-16 19:02:39+00:00,2016-03-16 19:02:49+00:00,1.12047,1.1207,-0.00022999999999995246,2024.869,2024.708,0.16099999999983083
153,1969.440,1975.520,And that’s what you see in the forecasts of participants.,CHAIR YELLEN.,2016-03-16 19:02:49.440000+00:00,2016-03-16 19:02:49+00:00,2016-03-16 19:02:56+00:00,1.12054,1.12048,6.000000000017103e-05,2024.369,2024.583,-0.21400000000016917
154,1975.520,1995.480,"So if oil prices were to increase to 50, I mean, that would probably slightly move up our expected path for core inflation, maybe speed how rapidly would have great policy significance.",CHAIR YELLEN.,2016-03-16 19:02:55.520000+00:00,2016-03-16 19:02:56+00:00,2016-03-16 19:03:15+00:00,1.1205200000000002,1.12057,-4.999999999988347e-05,2024.854,2024.245,0.609000000000151
155,1995.480,2004.760,"Marty Crutsinger, Associated Press.",MARTIN CRUTSINGER.,2016-03-16 19:03:15.480000+00:00,2016-03-16 19:03:15+00:00,2016-03-16 19:03:25+00:00,1.1205,1.1205,0.0,2024.603,2025.216,-0.612999999999829
156,2004.760,2013.840,"You said in—the policy statement in December said that the risks to the outlook were “balanced,” and you raised rates.",MARTIN CRUTSINGER.,2016-03-16 19:03:24.760000+00:00,2016-03-16 19:03:25+00:00,2016-03-16 19:03:34+00:00,1.12064,1.1205500000000002,8.999999999992347e-05,2024.501,2024.4020000000005,0.09899999999947795
157,2013.840,2018.120,That phrasing disappeared then in January and March.,MARTIN CRUTSINGER.,2016-03-16 19:03:33.840000+00:00,2016-03-16 19:03:34+00:00,2016-03-16 19:03:38+00:00,1.12058,1.12068,-9.999999999998899e-05,2024.394,2024.461,-0.06700000000000728
158,2018.120,2025.520,"Could you talk a little bit about—but in your comments today, you seem to be indicating that not that much has changed.",MARTIN CRUTSINGER.,2016-03-16 19:03:38.120000+00:00,2016-03-16 19:03:38+00:00,2016-03-16 19:03:46+00:00,1.12067,1.12056,0.0001100000000000545,2024.115,2024.249,-0.13400000000001455
159,2025.520,2035.880,"Could you help us understand what needs to happen to get back to “balanced,” and is that the language we need to look for to see the next rate hike?",MARTIN CRUTSINGER.,2016-03-16 19:03:45.520000+00:00,2016-03-16 19:03:46+00:00,2016-03-16 19:03:56+00:00,1.12103,1.12073,0.00029999999999996696,2024.6,2024.353,0.24699999999984357
160,2035.880,2046.680,"So let me say that, in recent weeks, I think the Committee certainly thinks that risks to the outlook have diminished.",CHAIR YELLEN.,2016-03-16 19:03:55.880000+00:00,2016-03-16 19:03:56+00:00,2016-03-16 19:04:07+00:00,1.12093,1.12102,-8.999999999992347e-05,2025.258,2024.585,0.6730000000000018
161,2046.680,2053.920,"Nevertheless, we continue to see risks, which we highlighted.",CHAIR YELLEN.,2016-03-16 19:04:06.680000+00:00,2016-03-16 19:04:07+00:00,2016-03-16 19:04:14+00:00,1.12099,1.12088,0.00010999999999983245,2024.999,2024.975,0.024000000000114596
162,2053.920,2063.160,"Now, I would point out that we decided not to describe the balance of risks as weighted to the downside.",CHAIR YELLEN.,2016-03-16 19:04:13.920000+00:00,2016-03-16 19:04:14+00:00,2016-03-16 19:04:23+00:00,1.12084,1.12099,-0.00014999999999987246,2025.354,2024.955,0.3990000000001146
163,2063.160,2076.720,"So the Committee did not reach that judgment, and there is no collective judgment in this statement on whether the risks are balanced or not.",CHAIR YELLEN.,2016-03-16 19:04:23.160000+00:00,2016-03-16 19:04:23+00:00,2016-03-16 19:04:37+00:00,1.1202100000000002,1.12057,-0.00035999999999991594,2026.084,2025.233,0.8510000000001128
164,2076.720,2081.040,My—we declined to make a collective assessment.,CHAIR YELLEN.,2016-03-16 19:04:36.720000+00:00,2016-03-16 19:04:37+00:00,2016-03-16 19:04:41+00:00,1.1203,1.12027,2.999999999997449e-05,2026.377,2026.085,0.2919999999999163
165,2081.040,2089.560,"You know, my guess is that some participants see them as balanced, and some see them as weighted somewhat to the downside.",CHAIR YELLEN.,2016-03-16 19:04:41.040000+00:00,2016-03-16 19:04:41+00:00,2016-03-16 19:04:50+00:00,1.1204,1.1202200000000002,0.00017999999999984695,2025.839,2026.345,-0.5060000000000855
166,2089.560,2093.480,But I think it is important to note a couple of things.,CHAIR YELLEN.,2016-03-16 19:04:49.560000+00:00,2016-03-16 19:04:50+00:00,2016-03-16 19:04:53+00:00,1.1203,1.12033,-2.999999999997449e-05,2026.222,2025.985,0.23700000000008004
167,2093.480,2122.120,"First of all, the U.S. economy has been very resilient in recent months in the face of shocks, and we highlighted that right at the beginning of our statement, where we said that “economic activity has been expanding at a moderate pace despite the global economic and financial developments of recent months.”  And that—that is important, that the U.S. economy continues to do well.",CHAIR YELLEN.,2016-03-16 19:04:53.480000+00:00,2016-03-16 19:04:53+00:00,2016-03-16 19:05:22+00:00,1.12064,1.12028,0.000360000000000138,2025.28,2025.949,-0.6690000000000964
168,2122.120,2131.040,"Second, I would say that while global developments do pose some downside risks, the risks are not all one sided.",CHAIR YELLEN.,2016-03-16 19:05:22.120000+00:00,2016-03-16 19:05:22+00:00,2016-03-16 19:05:31+00:00,1.12077,1.12083,-5.999999999994898e-05,2024.971,2025.265,-0.2940000000000964
169,2131.040,2144.320,"A number of countries—including China, the euro area, the Bank of Japan—have taken measures to stimulate the economy, so there is also upside risk to the economic outlook.",CHAIR YELLEN.,2016-03-16 19:05:31.040000+00:00,2016-03-16 19:05:31+00:00,2016-03-16 19:05:44+00:00,1.12046,1.12077,-0.00031000000000003247,2025.59,2025.126,0.4639999999999418
170,2144.320,2157.120,"And, in addition, of some energy firms and the stresses facing some oil-producing economies.",CHAIR YELLEN.,2016-03-16 19:05:44.320000+00:00,2016-03-16 19:05:44+00:00,2016-03-16 19:05:57+00:00,1.1205200000000002,1.12041,0.00011000000000027654,2025.606,2025.749,-0.1430000000000291
171,2157.120,2163.760,"And, at the same time, low oil prices continue to boost household purchasing power.",CHAIR YELLEN.,2016-03-16 19:05:57.120000+00:00,2016-03-16 19:05:57+00:00,2016-03-16 19:06:04+00:00,1.12059,1.1206,-1.0000000000065512e-05,2026.868,2025.621,1.2469999999998436
172,2163.760,2166.120,So there are risks.,CHAIR YELLEN.,2016-03-16 19:06:03.760000+00:00,2016-03-16 19:06:04+00:00,2016-03-16 19:06:06+00:00,1.12061,1.12061,0.0,2026.609,2026.609,0.0
173,2166.120,2168.000,We’re attentive to them.,CHAIR YELLEN.,2016-03-16 19:06:06.120000+00:00,2016-03-16 19:06:06+00:00,2016-03-16 19:06:08+00:00,1.12066,1.12066,0.0,2026.499,2026.499,0.0
174,2168.000,2174.280,"We have not described them as unbalanced to the out—to the downside, and they are two sided.",CHAIR YELLEN.,2016-03-16 19:06:08+00:00,2016-03-16 19:06:08+00:00,2016-03-16 19:06:14+00:00,1.12065,1.12071,-6.000000000017103e-05,2026.857,2026.608,0.24900000000002365
175,2174.280,2177.920,One can identify both upside and downside risks there.,CHAIR YELLEN.,2016-03-16 19:06:14.280000+00:00,2016-03-16 19:06:14+00:00,2016-03-16 19:06:18+00:00,1.1207600000000002,1.12067,9.000000000014552e-05,2026.845,2026.994,-0.14899999999988722
176,2177.920,2186.360,"Hi, Jim Puzzanghera with the L.A. Times.",JIM PUZZANGHERA.,2016-03-16 19:06:17.920000+00:00,2016-03-16 19:06:18+00:00,2016-03-16 19:06:26+00:00,1.12085,1.12078,6.999999999979245e-05,2027.083,2026.963,0.12000000000011823
177,2186.360,2189.040,Wage growth thus far has been disappointing.,JIM PUZZANGHERA.,2016-03-16 19:06:26.360000+00:00,2016-03-16 19:06:26+00:00,2016-03-16 19:06:29+00:00,1.1208600000000002,1.1208600000000002,0.0,2026.862,2026.843,0.019000000000005457
178,2189.040,2190.080,It’s been very uneven.,JIM PUZZANGHERA.,2016-03-16 19:06:29.040000+00:00,2016-03-16 19:06:29+00:00,2016-03-16 19:06:30+00:00,1.12083,1.12081,1.999999999990898e-05,2026.719,2026.722,-0.0029999999999290594
179,2190.080,2193.520,"It was disappointing, figures in last month’s jobs report.",JIM PUZZANGHERA.,2016-03-16 19:06:30.080000+00:00,2016-03-16 19:06:30+00:00,2016-03-16 19:06:34+00:00,1.12068,1.12081,-0.00013000000000018552,2026.731,2026.605,0.12599999999997635
180,2193.520,2199.360,"Why do you think that is, and how important is sustained wage growth to removing your wariness on inflation?",JIM PUZZANGHERA.,2016-03-16 19:06:33.520000+00:00,2016-03-16 19:06:34+00:00,2016-03-16 19:06:39+00:00,1.12084,1.1207200000000002,0.00011999999999989797,2026.497,2026.715,-0.2179999999998472
181,2199.360,2214.240,"So I must say I’m—I do see broad-based improvement in the labor market, and I’m somewhat surprised that we’re not seeing more of a pickup in wage growth.",CHAIR YELLEN.,2016-03-16 19:06:39.360000+00:00,2016-03-16 19:06:39+00:00,2016-03-16 19:06:54+00:00,1.1209,1.1209,0.0,2025.581,2025.989,-0.40800000000012915
182,2214.240,2239.880,"But at least—and I have to say, in anecdotal reports, we do hear quite a number of reports of firms facing wage pressures and even broad-based, slightly faster increases in wages—wage increases that they’re granting.",CHAIR YELLEN.,2016-03-16 19:06:54.240000+00:00,2016-03-16 19:06:54+00:00,2016-03-16 19:07:20+00:00,1.12083,1.12081,1.999999999990898e-05,2025.243,2025.403,-0.16000000000008185
183,2239.880,2247.520,"But in the aggregate data, one doesn’t yet see any convincing evidence of a pickup in wage growth.",CHAIR YELLEN.,2016-03-16 19:07:19.880000+00:00,2016-03-16 19:07:20+00:00,2016-03-16 19:07:28+00:00,1.12088,1.1209,-1.999999999990898e-05,2025.026,2025.125,-0.0989999999999327
184,2247.520,2253.640,It’s mainly isolated to certain sectors and occupations.,CHAIR YELLEN.,2016-03-16 19:07:27.520000+00:00,2016-03-16 19:07:28+00:00,2016-03-16 19:07:34+00:00,1.12097,1.12091,5.999999999994898e-05,2026.124,2026.088,0.03600000000005821
185,2253.640,2263.400,"So I do think, consistent with the 2 percent inflation objective, that there is certainly scope for further increases in wages.",CHAIR YELLEN.,2016-03-16 19:07:33.640000+00:00,2016-03-16 19:07:34+00:00,2016-03-16 19:07:43+00:00,1.12085,1.12098,-0.00013000000000018552,2025.831,2026.103,-0.2720000000001619
186,2263.400,2276.840,"The fact that we have not seen any broad-based pickup is one of the factors that suggests to me that there is continued slack in the labor market, but I would expect wage growth to move up some.",CHAIR YELLEN.,2016-03-16 19:07:43.400000+00:00,2016-03-16 19:07:43+00:00,2016-03-16 19:07:57+00:00,1.1209600000000002,1.1209,6.000000000017103e-05,2026.733,2025.854,0.8789999999999054
187,2276.840,2281.840,Patrick Gillespie with CNNMoney.,PATRICK GILLESPIE.,2016-03-16 19:07:56.840000+00:00,2016-03-16 19:07:57+00:00,2016-03-16 19:08:02+00:00,1.12088,1.12083,5.0000000000105516e-05,2026.468,2026.588,-0.11999999999989086
188,2281.840,2290.320,"Chair Yellen, numerous polls show—by CNN and others—show that the U.S. economy is American voters’ number one concern right now.",PATRICK GILLESPIE.,2016-03-16 19:08:01.840000+00:00,2016-03-16 19:08:02+00:00,2016-03-16 19:08:10+00:00,1.12113,1.12094,0.00018999999999991246,2026.356,2026.336,0.01999999999998181
189,2290.320,2306.000,"There’s a lot of negative sentiment about the economy, yet unemployment is low, job gains have been pretty good for the past year, and consumer confidence has picked up.",PATRICK GILLESPIE.,2016-03-16 19:08:10.320000+00:00,2016-03-16 19:08:10+00:00,2016-03-16 19:08:26+00:00,1.12085,1.12113,-0.000280000000000058,2027.273,2026.606,0.6669999999999163
190,2306.000,2308.080,progress and how voters feel?,PATRICK GILLESPIE.,2016-03-16 19:08:26+00:00,2016-03-16 19:08:26+00:00,2016-03-16 19:08:28+00:00,1.1209600000000002,1.1209600000000002,0.0,2027.238,2027.238,0.0
191,2308.080,2316.160,"And my second question is, how does any negative sentiment about the economy factor into your economic outlook and the decisions you make on monetary policy?",PATRICK GILLESPIE.,2016-03-16 19:08:28.080000+00:00,2016-03-16 19:08:28+00:00,2016-03-16 19:08:36+00:00,1.12114,1.12103,0.0001100000000000545,2027.217,2027.223,-0.005999999999858119
192,2316.160,2317.760,Thank you.,PATRICK GILLESPIE.,2016-03-16 19:08:36.160000+00:00,2016-03-16 19:08:36+00:00,2016-03-16 19:08:38+00:00,1.12115,1.12115,0.0,2027.109,2027.109,0.0
193,2317.760,2321.240,"Let me start with your second question, if I might.",CHAIR YELLEN.,2016-03-16 19:08:37.760000+00:00,2016-03-16 19:08:38+00:00,2016-03-16 19:08:41+00:00,1.12113,1.12114,-1.0000000000065512e-05,2027.157,2027.126,0.03099999999994907
194,2321.240,2334.360,"So in trying to judge the outlook for the economy, we do look at measures pertaining to consumer sentiment, and they are in solid territory.",CHAIR YELLEN.,2016-03-16 19:08:41.240000+00:00,2016-03-16 19:08:41+00:00,2016-03-16 19:08:54+00:00,1.12114,1.12109,5.0000000000105516e-05,2027.088,2027.09,-0.0019999999999527063
195,2334.360,2338.280,Household balance sheets are much improved.,CHAIR YELLEN.,2016-03-16 19:08:54.360000+00:00,2016-03-16 19:08:54+00:00,2016-03-16 19:08:58+00:00,1.12122,1.12115,7.00000000000145e-05,2026.724,2026.996,-0.2720000000001619
196,2338.280,2345.440,Gains in inflation-adjusted disposable income are running at a healthy pace.,CHAIR YELLEN.,2016-03-16 19:08:58.280000+00:00,2016-03-16 19:08:58+00:00,2016-03-16 19:09:05+00:00,1.12132,1.12125,7.00000000000145e-05,2026.983,2026.557,0.4259999999999309
197,2345.440,2359.800,"As I mentioned, households have benefited pretty significantly from lower oil prices, and measures of consumer sentiment do reflect—do reflect that.",CHAIR YELLEN.,2016-03-16 19:09:05.440000+00:00,2016-03-16 19:09:05+00:00,2016-03-16 19:09:20+00:00,1.12134,1.1213,4.0000000000040004e-05,2026.605,2026.825,-0.22000000000002728
198,2359.800,2362.400,So they are not at low levels.,CHAIR YELLEN.,2016-03-16 19:09:19.800000+00:00,2016-03-16 19:09:20+00:00,2016-03-16 19:09:22+00:00,1.12142,1.12142,0.0,2026.583,2026.583,0.0
199,2362.400,2368.040,"And, really, the labor market, I think, has improved a great deal.",CHAIR YELLEN.,2016-03-16 19:09:22.400000+00:00,2016-03-16 19:09:22+00:00,2016-03-16 19:09:28+00:00,1.12153,1.12146,7.00000000000145e-05,2026.729,2026.594,0.1349999999999909
200,2368.040,2385.560,"And every demographic group that, you know, we track regularly has seen improvement in their labor market situation—perhaps not all equally, but almost all demographic groups have seen improvement.",CHAIR YELLEN.,2016-03-16 19:09:28.040000+00:00,2016-03-16 19:09:28+00:00,2016-03-16 19:09:46+00:00,1.12124,1.12149,-0.0002500000000000835,2026.985,2026.424,0.5609999999999218
201,2385.560,2393.840,"So I—I think it’s right to say the economy is improving, and most groups are seeing benefits.",CHAIR YELLEN.,2016-03-16 19:09:45.560000+00:00,2016-03-16 19:09:46+00:00,2016-03-16 19:09:54+00:00,1.12128,1.12125,2.999999999997449e-05,2027.082,2026.979,0.10300000000006548
202,2393.840,2407.600,"That said, we know that inequality has been rising in the United States over many years, not just the last several but going back to the mid-’80s.",CHAIR YELLEN.,2016-03-16 19:09:53.840000+00:00,2016-03-16 19:09:54+00:00,2016-03-16 19:10:08+00:00,1.12129,1.12129,0.0,2027.105,2027.082,0.02299999999991087
203,2407.600,2440.760,"There has been downward pressure on real wage groups—on real wage gains for groups, particularly those that are less skilled and educated, and those longer-term trends that may be associated with a number of factors—technological change and globalization—have been a concern for many, many years, and that may be part of what you’re—we’re seeing expressed.",CHAIR YELLEN.,2016-03-16 19:10:07.600000+00:00,2016-03-16 19:10:08+00:00,2016-03-16 19:10:41+00:00,1.12074,1.12131,-0.0005699999999999594,2028.403,2027.154,1.2490000000000236
204,2440.760,2447.400,"Thank you, right here.",CHRISTOPHER CONDON.,2016-03-16 19:10:40.760000+00:00,2016-03-16 19:10:41+00:00,2016-03-16 19:10:47+00:00,1.12065,1.12077,-0.00012000000000012001,2028.59,2028.22,0.36999999999989086
205,2447.400,2478.360,"Chair Yellen, there seems to be some growing sentiment that even if the direct economic ties between the U.S. and other economies is still relatively modest, that the impact through financial markets and exchange rates difficult for the Fed to diverge from other major central banks with its benchmark interest rate.",CHRISTOPHER CONDON.,2016-03-16 19:10:47.400000+00:00,2016-03-16 19:10:47+00:00,2016-03-16 19:11:18+00:00,1.1208600000000002,1.12066,0.00020000000000020002,2027.995,2028.344,-0.34900000000016007
206,2478.360,2481.520,Would you generally agree with that sentiment?,CHRISTOPHER CONDON.,2016-03-16 19:11:18.360000+00:00,2016-03-16 19:11:18+00:00,2016-03-16 19:11:22+00:00,1.12083,1.12083,0.0,2027.858,2027.862,-0.004000000000132786
207,2481.520,2482.680,Why or why not?,CHRISTOPHER CONDON.,2016-03-16 19:11:21.520000+00:00,2016-03-16 19:11:22+00:00,2016-03-16 19:11:23+00:00,1.12083,1.12083,0.0,2027.83,2027.878,-0.04800000000000182
208,2482.680,2499.600,"And, very briefly, second, if I may—in your mind, does it undermine in any way the standing of the Federal Reserve as a nonpartisan institution when one of its sitting Governors contributes to the campaign of a national political figure?",CHRISTOPHER CONDON.,2016-03-16 19:11:22.680000+00:00,2016-03-16 19:11:23+00:00,2016-03-16 19:11:40+00:00,1.12102,1.12083,0.00018999999999991246,2026.732,2027.973,-1.2409999999999854
209,2499.600,2500.960,Thank you.,CHRISTOPHER CONDON.,2016-03-16 19:11:39.600000+00:00,2016-03-16 19:11:40+00:00,2016-03-16 19:11:41+00:00,1.12109,1.12113,-4.0000000000040004e-05,2026.566,2026.484,0.08200000000010732
210,2500.960,2505.040,So let me start with the question pertaining to exchange rates.,CHAIR YELLEN.,2016-03-16 19:11:40.960000+00:00,2016-03-16 19:11:41+00:00,2016-03-16 19:11:45+00:00,1.12103,1.12095,8.000000000008001e-05,2026.679,2026.518,0.1610000000000582
211,2505.040,2508.920,We have global capital markets.,CHAIR YELLEN.,2016-03-16 19:11:45.040000+00:00,2016-03-16 19:11:45+00:00,2016-03-16 19:11:49+00:00,1.12095,1.12093,1.999999999990898e-05,2026.641,2026.748,-0.1069999999999709
212,2508.920,2525.200,"In—in a world with highly integrated capital markets, monetary policy actions in any country have effects—spillovers to other countries.",CHAIR YELLEN.,2016-03-16 19:11:48.920000+00:00,2016-03-16 19:11:49+00:00,2016-03-16 19:12:05+00:00,1.1210700000000002,1.1208600000000002,0.00021000000000004349,2025.866,2026.64,-0.7740000000001146
213,2525.200,2531.880,"That’s true of our monetary policy, and it’s true of other countries’ monetary policies.",CHAIR YELLEN.,2016-03-16 19:12:05.200000+00:00,2016-03-16 19:12:05+00:00,2016-03-16 19:12:12+00:00,1.12124,1.12124,0.0,2025.737,2025.72,0.01700000000005275
214,2531.880,2550.520,"In part, that shows up through movements in exchange rates, and those movements are a factor that any country needs to take into account in deciding what is the appropriate stance of monetary policy.",CHAIR YELLEN.,2016-03-16 19:12:11.880000+00:00,2016-03-16 19:12:12+00:00,2016-03-16 19:12:31+00:00,1.12119,1.12124,-5.0000000000105516e-05,2025.586,2025.645,-0.05899999999996908
215,2550.520,2559.960,So the fact that there are these linkages is an important factor in designing a monetary policy.,CHAIR YELLEN.,2016-03-16 19:12:30.520000+00:00,2016-03-16 19:12:31+00:00,2016-03-16 19:12:40+00:00,1.12095,1.12121,-0.000260000000000149,2026.241,2025.723,0.5180000000000291
216,2559.960,2563.760,But it does not mean that monetary—U.S.,CHAIR YELLEN.,2016-03-16 19:12:39.960000+00:00,2016-03-16 19:12:40+00:00,2016-03-16 19:12:44+00:00,1.12093,1.1209600000000002,-3.0000000000196536e-05,2026.23,2026.241,-0.010999999999967258
217,2563.760,2574.800,monetary policy is somehow constrained in a way that makes it impossible for our monetary policy to diverge from policies abroad.,CHAIR YELLEN.,2016-03-16 19:12:43.760000+00:00,2016-03-16 19:12:44+00:00,2016-03-16 19:12:55+00:00,1.12105,1.12093,0.00012000000000012001,2026.228,2026.086,0.14200000000005275
218,2574.800,2597.480,"There are many periods when monetary policies in different countries have moved in different directions, and, you know, the United States has been growing more strongly and had better success in the labor market than many other advanced countries.",CHAIR YELLEN.,2016-03-16 19:12:54.800000+00:00,2016-03-16 19:12:55+00:00,2016-03-16 19:13:17+00:00,1.1207,1.12103,-0.00032999999999994145,2026.461,2026.596,-0.1349999999999909
219,2597.480,2605.280,"And, at this point, it’s natural that there should be some divergence in our monetary policies.",CHAIR YELLEN.,2016-03-16 19:13:17.480000+00:00,2016-03-16 19:13:17+00:00,2016-03-16 19:13:25+00:00,1.12065,1.12067,-2.0000000000131024e-05,2026.577,2026.486,0.0909999999998945
220,2605.280,2609.680,Movements in exchange rates partly reflect that.,CHAIR YELLEN.,2016-03-16 19:13:25.280000+00:00,2016-03-16 19:13:25+00:00,2016-03-16 19:13:30+00:00,1.12064,1.12065,-9.999999999843467e-06,2026.703,2026.591,0.11200000000008004
221,2609.680,2621.040,"So I wouldn’t want to endorse the notion if, you know—that you’re suggesting, that our policy is in some way crippled by the fact that there are these interlinkages.",CHAIR YELLEN.,2016-03-16 19:13:29.680000+00:00,2016-03-16 19:13:30+00:00,2016-03-16 19:13:41+00:00,1.12053,1.12047,5.999999999994898e-05,2026.225,2026.703,-0.4780000000000655
222,2621.040,2624.720,That’s simply how the global financial system works.,CHAIR YELLEN.,2016-03-16 19:13:41.040000+00:00,2016-03-16 19:13:41+00:00,2016-03-16 19:13:45+00:00,1.12002,1.12047,-0.00045000000000006146,2026.728,2026.494,0.23400000000015098
223,2624.720,2648.320,"We—this is one reason we meet—meet frequently with other developments evolve, and try to keep one another apprised of economic developments and likely policy responses.",CHAIR YELLEN.,2016-03-16 19:13:44.720000+00:00,2016-03-16 19:13:45+00:00,2016-03-16 19:14:08+00:00,1.12027,1.11992,0.0003500000000000725,2027.006,2026.998,0.008000000000038199
224,2648.320,2655.520,Your second question concerned the political contributions.,CHAIR YELLEN.,2016-03-16 19:14:08.320000+00:00,2016-03-16 19:14:08+00:00,2016-03-16 19:14:16+00:00,1.12033,1.12023,9.999999999998899e-05,2026.701,2026.677,0.024000000000114596
225,2655.520,2684.760,"So I want to start by saying that I’ve been involved for many years in the Federal Reserve System, and we are a nonpartisan, independent institution devoted to pursuing our congressionally mandated objectives, and I have never seen political views in any way influence the policy judgments that are made inside the Federal Reserve.",CHAIR YELLEN.,2016-03-16 19:14:15.520000+00:00,2016-03-16 19:14:16+00:00,2016-03-16 19:14:45+00:00,1.11999,1.1204200000000002,-0.0004300000000001525,2028.731,2026.745,1.9860000000001037
226,2684.760,2690.280,I want to say that emphatically.,CHAIR YELLEN.,2016-03-16 19:14:44.760000+00:00,2016-03-16 19:14:45+00:00,2016-03-16 19:14:50+00:00,1.11998,1.11997,1.0000000000065512e-05,2028.455,2028.731,-0.2760000000000673
227,2690.280,2702.840,"The political activities of Governors, participants, government employees are governed by the Hatch Act.",CHAIR YELLEN.,2016-03-16 19:14:50.280000+00:00,2016-03-16 19:14:50+00:00,2016-03-16 19:15:03+00:00,1.12023,1.12007,0.00016000000000016001,2028.215,2028.228,-0.013000000000147338
228,2702.840,2712.600,"We are all subject to that, and the Hatch Act does allow campaign contributions to be made.",CHAIR YELLEN.,2016-03-16 19:15:02.840000+00:00,2016-03-16 19:15:03+00:00,2016-03-16 19:15:13+00:00,1.1202200000000002,1.12015,7.000000000023654e-05,2027.361,2028.215,-0.8539999999998145
229,2712.600,2719.480,It outlaws other forms of partisan activity.,CHAIR YELLEN.,2016-03-16 19:15:12.600000+00:00,2016-03-16 19:15:13+00:00,2016-03-16 19:15:19+00:00,1.11992,1.12009,-0.00017000000000000348,2027.658,2027.221,0.43699999999989814
