230,2719.480,2729.960,"And I would say, within that, so it is each—it’s up to each individual to decide what is appropriate, in their point of view.",CHAIR YELLEN.,2016-03-16 19:15:19.480000+00:00,2016-03-16 19:15:19+00:00,2016-03-16 19:15:30+00:00,1.11992,1.11992,0.0,2028.218,2028.12,0.09800000000018372
231,2729.960,2736.040,But the Federal Reserve is not—is not a partisan political organization.,CHAIR YELLEN.,2016-03-16 19:15:29.960000+00:00,2016-03-16 19:15:30+00:00,2016-03-16 19:15:36+00:00,1.12,1.1199100000000002,8.999999999992347e-05,2028.112,2028.222,-0.10999999999989996
232,2736.040,2742.840,"Binya Appelbaum, the New York Times.",BINYAMIN APPELBAUM.,2016-03-16 19:15:36.040000+00:00,2016-03-16 19:15:36+00:00,2016-03-16 19:15:43+00:00,1.12002,1.11997,5.0000000000105516e-05,2027.862,2027.988,-0.12599999999997635
233,2742.840,2749.480,"The policy, the projections—the new economic projections appear to reflect an increase in your estimate of the extent of labor market slack.",BINYAMIN APPELBAUM.,2016-03-16 19:15:42.840000+00:00,2016-03-16 19:15:43+00:00,2016-03-16 19:15:49+00:00,1.12019,1.12019,0.0,2028.084,2027.96,0.12400000000002365
234,2749.480,2754.080,"You talked about one possible reason for that, which is the softness of wage growth.",BINYAMIN APPELBAUM.,2016-03-16 19:15:49.480000+00:00,2016-03-16 19:15:49+00:00,2016-03-16 19:15:54+00:00,1.12034,1.12018,0.00015999999999993797,2028.367,2028.227,0.13999999999987267
235,2754.080,2759.720,Are there other considerations that have led you to increase your estimate of how much slack there is in the labor market?,BINYAMIN APPELBAUM.,2016-03-16 19:15:54.080000+00:00,2016-03-16 19:15:54+00:00,2016-03-16 19:16:00+00:00,1.1206,1.1203200000000002,0.00027999999999983594,2028.486,2028.235,0.2510000000002037
236,2759.720,2768.800,So I should point out that I think what you’re talking about is the slight decline in the median estimate of the longer-run normal unemployment rate.,CHAIR YELLEN.,2016-03-16 19:15:59.720000+00:00,2016-03-16 19:16:00+00:00,2016-03-16 19:16:09+00:00,1.12069,1.12068,1.0000000000065512e-05,2027.955,2028.341,-0.38599999999996726
237,2768.800,2773.200,Is that—is that what you’re— BINYAMIN APPELBAUM.,CHAIR YELLEN.,2016-03-16 19:16:08.800000+00:00,2016-03-16 19:16:09+00:00,2016-03-16 19:16:13+00:00,1.12073,1.1207200000000002,9.999999999843467e-06,2028.237,2028.233,0.004000000000132786
238,2773.200,2787.440,"That, and the slope of the path of rate increases combined with projections of relatively low inflation.",CHAIR YELLEN.,2016-03-16 19:16:13.200000+00:00,2016-03-16 19:16:13+00:00,2016-03-16 19:16:27+00:00,1.12099,1.12073,0.00025999999999992696,2029.098,2028.22,0.8779999999999291
239,2787.440,2791.840,decline in estimates of the longer-run normal unemployment rate.,CHAIR YELLEN.,2016-03-16 19:16:27.440000+00:00,2016-03-16 19:16:27+00:00,2016-03-16 19:16:32+00:00,1.12108,1.12099,9.000000000014552e-05,2028.112,2028.585,-0.47299999999995634
240,2791.840,2800.480,"That, I would say, reflects, for those who brought it down, an estimate of greater slack in the labor market.",CHAIR YELLEN.,2016-03-16 19:16:31.840000+00:00,2016-03-16 19:16:32+00:00,2016-03-16 19:16:40+00:00,1.12109,1.12098,0.00010999999999983245,2028.086,2028.279,-0.19299999999998363
241,2800.480,2803.440,The fed funds rate projection is not just that.,CHAIR YELLEN.,2016-03-16 19:16:40.480000+00:00,2016-03-16 19:16:40+00:00,2016-03-16 19:16:43+00:00,1.1211,1.12112,-1.999999999990898e-05,2028.086,2028.112,-0.026000000000067303
242,2803.440,2818.200,"It’s also, as I mentioned, a reflection of shifts in other views about, for example, the likely pace of global growth that affects what we need, as a policy path, to achieve our objectives.",CHAIR YELLEN.,2016-03-16 19:16:43.440000+00:00,2016-03-16 19:16:43+00:00,2016-03-16 19:16:58+00:00,1.121,1.12121,-0.00021000000000004349,2028.493,2028.358,0.1349999999999909
243,2818.200,2844.240,"But the slow pace of wage growth, the fact that part-time employment for economic reasons and voluntary part-time employment remains high—we have seen an upward move in labor force participation, which is heartening and suggests that there was scope there for further improvement in the labor market.",CHAIR YELLEN.,2016-03-16 19:16:58.200000+00:00,2016-03-16 19:16:58+00:00,2016-03-16 19:17:24+00:00,1.1207,1.12094,-0.00024000000000001798,2029.721,2028.459,1.2619999999999436
244,2844.240,2855.600,My guess is that those things influenced individuals who wrote down a slightly lower number for the longer-run unemployment rate.,CHAIR YELLEN.,2016-03-16 19:17:24.240000+00:00,2016-03-16 19:17:24+00:00,2016-03-16 19:17:36+00:00,1.12074,1.12077,-2.999999999997449e-05,2029.768,2029.722,0.04600000000004911
245,2855.600,2864.080,Nancy Marshall-Genzer from Marketplace.,NANCY MARSHALL-GENZER.,2016-03-16 19:17:35.600000+00:00,2016-03-16 19:17:36+00:00,2016-03-16 19:17:44+00:00,1.12099,1.1207,0.00028999999999990145,2029.592,2029.724,-0.13199999999983447
246,2864.080,2880.160,"We’ve heard a lot of talk today about President Obama’s pick for the Supreme Court, but there are a number of vacancies on the Fed Board of Governors, and there’s a new position, the Vice Chair[man] for Supervision, that the President hasn’t even nominated anyone for.",NANCY MARSHALL-GENZER.,2016-03-16 19:17:44.080000+00:00,2016-03-16 19:17:44+00:00,2016-03-16 19:18:00+00:00,1.12087,1.12099,-0.00011999999999989797,2029.62,2029.584,0.035999999999830834
247,2880.160,2887.160,"Would you like the President to nominate someone for that position, and what effect are those vacancies having on the Fed?",NANCY MARSHALL-GENZER.,2016-03-16 19:18:00.160000+00:00,2016-03-16 19:18:00+00:00,2016-03-16 19:18:07+00:00,1.12081,1.12089,-7.999999999985796e-05,2029.496,2029.612,-0.11599999999998545
248,2887.160,2906.000,"Well, I think Congress intended for the Federal Reserve Board to have seven members, and that tends to bring on board people with a wide spectrum of views and experience and perspectives.",CHAIR YELLEN.,2016-03-16 19:18:07.160000+00:00,2016-03-16 19:18:07+00:00,2016-03-16 19:18:26+00:00,1.12093,1.12081,0.00011999999999989797,2029.94,2029.373,0.5670000000000073
249,2906.000,2918.440,"I think that’s valuable, and I would like to see the Senate move forward and consider these nominees so that we could operate with a full complement.",CHAIR YELLEN.,2016-03-16 19:18:26+00:00,2016-03-16 19:18:26+00:00,2016-03-16 19:18:38+00:00,1.12104,1.12093,0.0001100000000000545,2029.708,2029.953,-0.24499999999989086
250,2918.440,2926.680,"With respect to the nomination for Vice Chair[man] [for] Supervision, that’s a question that I think you need to pose to the White House.",CHAIR YELLEN.,2016-03-16 19:18:38.440000+00:00,2016-03-16 19:18:38+00:00,2016-03-16 19:18:47+00:00,1.12093,1.121,-7.00000000000145e-05,2029.481,2029.708,-0.22700000000008913
251,2926.680,2932.160,"I, you know, would say that we are doing a time to that issue.",CHAIR YELLEN.,2016-03-16 19:18:46.680000+00:00,2016-03-16 19:18:47+00:00,2016-03-16 19:18:52+00:00,1.12092,1.1209600000000002,-4.000000000026205e-05,2029.481,2029.481,0.0
252,2932.160,2940.600,"So, really, it’s—the nomination question is one for the White House.",CHAIR YELLEN.,2016-03-16 19:18:52.160000+00:00,2016-03-16 19:18:52+00:00,2016-03-16 19:19:01+00:00,1.12084,1.12092,-7.999999999985796e-05,2029.599,2029.592,0.006999999999834472
253,2940.600,2949.800,"Thank you, Madam Chair.",JOHN HELTMAN.,2016-03-16 19:19:00.600000+00:00,2016-03-16 19:19:01+00:00,2016-03-16 19:19:10+00:00,1.12061,1.12083,-0.00021999999999988695,2029.578,2029.474,0.10400000000004184
254,2949.800,2951.760,John Heltman with American Banker.,JOHN HELTMAN.,2016-03-16 19:19:09.800000+00:00,2016-03-16 19:19:10+00:00,2016-03-16 19:19:12+00:00,1.12069,1.12069,0.0,2029.466,2029.466,0.0
255,2951.760,2966.400,The President last week expressed concern about what he termed “cynicism” on both sides of the aisle concerning progress made since the crisis to reform the banking sector and the financial sector more generally.,JOHN HELTMAN.,2016-03-16 19:19:11.760000+00:00,2016-03-16 19:19:12+00:00,2016-03-16 19:19:26+00:00,1.12095,1.12068,0.00026999999999999247,2028.48,2029.487,-1.0070000000000618
256,2966.400,2978.520,"Do you share that concern about, kind of, public attitudes that either not enough has been done or what has been done has not been effective in changing the regulatory landscape in banking?",JOHN HELTMAN.,2016-03-16 19:19:26.400000+00:00,2016-03-16 19:19:26+00:00,2016-03-16 19:19:39+00:00,1.12118,1.12099,0.0001900000000001345,2028.328,2028.591,-0.26299999999991996
257,2978.520,2981.600,Just what are your thoughts?,JOHN HELTMAN.,2016-03-16 19:19:38.520000+00:00,2016-03-16 19:19:39+00:00,2016-03-16 19:19:42+00:00,1.12126,1.12119,7.00000000000145e-05,2028.093,2028.224,-0.13099999999985812
258,2981.600,2985.000,So I feel a great deal has been done.,CHAIR YELLEN.,2016-03-16 19:19:41.600000+00:00,2016-03-16 19:19:42+00:00,2016-03-16 19:19:45+00:00,1.1213,1.1212700000000002,2.9999999999752447e-05,2028.118,2027.966,0.15200000000004366
259,2985.000,2996.160,"We have been working at this for a number of years, and I believe we have made very substantial progress.",CHAIR YELLEN.,2016-03-16 19:19:45+00:00,2016-03-16 19:19:45+00:00,2016-03-16 19:19:56+00:00,1.1211600000000002,1.12132,-0.00015999999999993797,2027.955,2027.853,0.10199999999986176
260,2996.160,3005.200,"We have a—much more capital, higher-quality capital, liquidity in the banking system.",CHAIR YELLEN.,2016-03-16 19:19:56.160000+00:00,2016-03-16 19:19:56+00:00,2016-03-16 19:20:05+00:00,1.12125,1.1212,5.0000000000105516e-05,2028.217,2027.955,0.262000000000171
261,3005.200,3015.680,"Our supervision has—we have made very meaningful changes for—in our supervision, for example.",CHAIR YELLEN.,2016-03-16 19:20:05.200000+00:00,2016-03-16 19:20:05+00:00,2016-03-16 19:20:16+00:00,1.12125,1.12124,1.0000000000065512e-05,2027.71,2028.348,-0.63799999999992
262,3015.680,3039.280,"The stress tests—the stress-test methodology that we use routinely to evaluate the robustness of the capital positions and plans of the largest institutions constitutes a quantum leap in terms of, I think, the quality of the supervision we are providing, especially of the largest firms.",CHAIR YELLEN.,2016-03-16 19:20:15.680000+00:00,2016-03-16 19:20:16+00:00,2016-03-16 19:20:39+00:00,1.12108,1.12125,-0.00017000000000000348,2026.472,2027.445,-0.9729999999999563
263,3039.280,3044.680,So we have finished writing most of the Dodd-Frank rules.,CHAIR YELLEN.,2016-03-16 19:20:39.280000+00:00,2016-03-16 19:20:39+00:00,2016-03-16 19:20:45+00:00,1.12123,1.12112,0.0001100000000000545,2026.485,2026.49,-0.005000000000109139
264,3044.680,3053.120,"We are working very hard on “too big to fail,” which is of grave concern to the American people.",CHAIR YELLEN.,2016-03-16 19:20:44.680000+00:00,2016-03-16 19:20:45+00:00,2016-03-16 19:20:53+00:00,1.1213,1.12126,4.0000000000040004e-05,2027.03,2026.499,0.5309999999999491
265,3053.120,3077.040,"In addition to having a financial system that is more robust and less likely to experience a failure, we have also worked very hard, continue to work on making sure we have the ability to resolve a firm if it were to fail in spite—in spite of having more capital and liquidity.",CHAIR YELLEN.,2016-03-16 19:20:53.120000+00:00,2016-03-16 19:20:53+00:00,2016-03-16 19:21:17+00:00,1.1213,1.12131,-1.0000000000065512e-05,2027.451,2026.861,0.5899999999999181
266,3077.040,3080.360,"And there, too, I think, we have made very substantial progress.",CHAIR YELLEN.,2016-03-16 19:21:17.040000+00:00,2016-03-16 19:21:17+00:00,2016-03-16 19:21:20+00:00,1.12125,1.12132,-7.00000000000145e-05,2027.339,2027.339,0.0
267,3080.360,3116.520,"A month or so ago, we came out with a rule—so-called TLAC rule—that would require the largest firms to hold a substantial buffer of long-term debt that, in the event that they were to injecting capital into the firms—it would provide loss absorption in that event.",CHAIR YELLEN.,2016-03-16 19:21:20.360000+00:00,2016-03-16 19:21:20+00:00,2016-03-16 19:21:57+00:00,1.12146,1.12125,0.00020999999999982144,2025.715,2027.247,-1.5320000000001528
268,3116.520,3125.840,"And working jointly, closely with the FDIC, firms have made a great deal of progress with their living wills.",CHAIR YELLEN.,2016-03-16 19:21:56.520000+00:00,2016-03-16 19:21:57+00:00,2016-03-16 19:22:06+00:00,1.12148,1.1214700000000002,9.999999999843467e-06,2025.323,2025.852,-0.5289999999999964
269,3125.840,3130.360,We’re in the process of evaluating the most recent submissions.,CHAIR YELLEN.,2016-03-16 19:22:05.840000+00:00,2016-03-16 19:22:06+00:00,2016-03-16 19:22:10+00:00,1.1215700000000002,1.12148,9.000000000014552e-05,2025.328,2025.322,0.0060000000000854925
270,3130.360,3144.560,"And working with the FDIC, I think, potential techniques that could be used in the event of a failure of a significant financial institution, we have also made a lot of progress there.",CHAIR YELLEN.,2016-03-16 19:22:10.360000+00:00,2016-03-16 19:22:10+00:00,2016-03-16 19:22:25+00:00,1.12173,1.12156,0.00017000000000000348,2025.13,2025.32,-0.1899999999998272
271,3144.560,3163.920,"I think I was at the meeting of financial regulators with the President when he made those comments, and I understood that what he was trying to tell the American people, that they should understand there really has been very substantial progress, and that’s something they should be aware of.",CHAIR YELLEN.,2016-03-16 19:22:24.560000+00:00,2016-03-16 19:22:25+00:00,2016-03-16 19:22:44+00:00,1.12143,1.12166,-0.0002300000000001745,2024.671,2024.736,-0.06500000000005457
272,3163.920,3168.720,"Can I follow up, just real quick?",JOHN HELTMAN.,2016-03-16 19:22:43.920000+00:00,2016-03-16 19:22:44+00:00,2016-03-16 19:22:49+00:00,1.12145,1.12151,-5.999999999994898e-05,2024.861,2024.745,0.11600000000021282
273,3168.720,3169.040,Sorry.,JOHN HELTMAN.,2016-03-16 19:22:48.720000+00:00,2016-03-16 19:22:49+00:00,2016-03-16 19:22:49+00:00,1.12145,1.1214,5.0000000000105516e-05,2024.861,2024.863,-0.0019999999999527063
274,3169.040,3178.120,"But do you think that, despite all that progress, that there—why hasn’t that message—why hasn’t—why haven’t these improvements made its way to the public?",JOHN HELTMAN.,2016-03-16 19:22:49.040000+00:00,2016-03-16 19:22:49+00:00,2016-03-16 19:22:58+00:00,1.12141,1.1214,1.0000000000065512e-05,2025.168,2024.863,0.3049999999998363
275,3178.120,3190.960,"And perhaps, like, do you find that that is an obstacle either among people that you meet, people in the public, or the representatives in Congress that maybe have this pervasive view that nothing has changed?",JOHN HELTMAN.,2016-03-16 19:22:58.120000+00:00,2016-03-16 19:22:58+00:00,2016-03-16 19:23:11+00:00,1.12136,1.1214,-4.0000000000040004e-05,2025.243,2025.096,0.14699999999993452
276,3190.960,3192.080,Is that an obstacle?,JOHN HELTMAN.,2016-03-16 19:23:10.960000+00:00,2016-03-16 19:23:11+00:00,2016-03-16 19:23:12+00:00,1.12135,1.12135,0.0,2025.339,2025.341,-0.0019999999999527063
277,3192.080,3192.400,Is that a problem?,JOHN HELTMAN.,2016-03-16 19:23:12.080000+00:00,2016-03-16 19:23:12+00:00,2016-03-16 19:23:12+00:00,1.12135,1.1214,-4.999999999988347e-05,2025.339,2025.334,0.004999999999881766
278,3192.400,3209.480,"Well, I think—I think it’s our job as we make these improvements to explain what we’re doing and to try to educate the public about what’s happened, and they may not understand how much has changed.",CHAIR YELLEN.,2016-03-16 19:23:12.400000+00:00,2016-03-16 19:23:12+00:00,2016-03-16 19:23:29+00:00,1.12145,1.1214,5.0000000000105516e-05,2026.083,2025.334,0.7490000000000236
279,3209.480,3215.560,It’s certainly part of my own responsibility to try to explain that to the American people.,CHAIR YELLEN.,2016-03-16 19:23:29.480000+00:00,2016-03-16 19:23:29+00:00,2016-03-16 19:23:36+00:00,1.12154,1.12145,8.999999999992347e-05,2026.056,2026.083,-0.027000000000043656
280,3215.560,3223.080,Karen Mracek with Market News International.,KAREN MRACEK.,2016-03-16 19:23:35.560000+00:00,2016-03-16 19:23:36+00:00,2016-03-16 19:23:43+00:00,1.12156,1.12162,-6.000000000017103e-05,2025.714,2025.604,0.10999999999989996
281,3223.080,3255.760,"In the SEP today, the unemployment rate forecast for future years—for 2017, 2018—was marked down without changes to inflation, and there seems to be a growing debate about the relationship between relationship, the Phillips curve, and how does that view weigh in to just how much actual inflation versus anticipation—anticipated inflation you’ll need to see?",KAREN MRACEK.,2016-03-16 19:23:43.080000+00:00,2016-03-16 19:23:43+00:00,2016-03-16 19:24:16+00:00,1.12158,1.1215700000000002,9.999999999843467e-06,2026.849,2025.591,1.2580000000000382
282,3255.760,3266.640,"Okay, so that was a complicated question, and there—let me start with the Phillips curve.",CHAIR YELLEN.,2016-03-16 19:24:15.760000+00:00,2016-03-16 19:24:16+00:00,2016-03-16 19:24:27+00:00,1.12159,1.12158,1.0000000000065512e-05,2026.609,2026.47,0.13899999999989632
283,3266.640,3289.360,"So the Phillips curve posits that there is a relationship between the degree of slack in the labor market and inflation, and it is an empirical relationship that, while not absolutely tight, has been a consistent relationship over time, and I believe that relationship still holds.",CHAIR YELLEN.,2016-03-16 19:24:26.640000+00:00,2016-03-16 19:24:27+00:00,2016-03-16 19:24:49+00:00,1.12166,1.12158,8.000000000008001e-05,2026.454,2026.719,-0.26500000000010004
284,3289.360,3296.760,But the impact of shifts in the unemployment rate on inflation should not be overstated.,CHAIR YELLEN.,2016-03-16 19:24:49.360000+00:00,2016-03-16 19:24:49+00:00,2016-03-16 19:24:57+00:00,1.12169,1.12168,1.0000000000065512e-05,2026.098,2026.466,-0.36799999999993815
285,3296.760,3313.360,"The Phillips curve has become, according to most estimates, quite flat in the sense that movements in unemployment have only a modest impact on inflation, so we shouldn’t overblow how large that is.",CHAIR YELLEN.,2016-03-16 19:24:56.760000+00:00,2016-03-16 19:24:57+00:00,2016-03-16 19:25:13+00:00,1.12185,1.12174,0.0001100000000000545,2025.741,2026.098,-0.3569999999999709
286,3313.360,3334.280,"In addition, the Phillips curve theory suggests that inflation expectations are also an important driver of actual wage- and price-setting decisions and inflation behavior, and I believe there’s also solid empirical evidence for that.",CHAIR YELLEN.,2016-03-16 19:25:13.360000+00:00,2016-03-16 19:25:13+00:00,2016-03-16 19:25:34+00:00,1.12185,1.12185,0.0,2026.015,2025.726,0.28899999999998727
287,3334.280,3351.600,"And it’s one of the reasons that I highlighted in my statement, and we continue to highlight in the FOMC statement, that we are tracking indicators of the inflation expectations that matter to wage and price setting.",CHAIR YELLEN.,2016-03-16 19:25:34.280000+00:00,2016-03-16 19:25:34+00:00,2016-03-16 19:25:52+00:00,1.12178,1.12184,-5.999999999994898e-05,2026.972,2025.995,0.9770000000000891
288,3351.600,3356.680,"Now, unfortunately, we don’t have perfect measures of these things.",CHAIR YELLEN.,2016-03-16 19:25:51.600000+00:00,2016-03-16 19:25:52+00:00,2016-03-16 19:25:57+00:00,1.1218100000000002,1.1218,1.0000000000287557e-05,2026.96,2026.995,-0.03499999999985448
289,3356.680,3358.400,We have survey measures.,CHAIR YELLEN.,2016-03-16 19:25:56.680000+00:00,2016-03-16 19:25:57+00:00,2016-03-16 19:25:58+00:00,1.1218100000000002,1.1218100000000002,0.0,2026.988,2026.961,0.027000000000043656
290,3358.400,3378.720,"We know that household measures, even when households are asked about longer-term inflation—at longer-term inflation, they tend to move in response to salient changes in prices that they see every day.",CHAIR YELLEN.,2016-03-16 19:25:58.400000+00:00,2016-03-16 19:25:58+00:00,2016-03-16 19:26:19+00:00,1.12176,1.12179,-2.999999999997449e-05,2026.992,2027.115,-0.1230000000000473
291,3378.720,3395.240,"In particular, when gas prices go down, which is very noticeable to most households, you tend to see a view—you tend to see responses about long-term inflation marked down.",CHAIR YELLEN.,2016-03-16 19:26:18.720000+00:00,2016-03-16 19:26:19+00:00,2016-03-16 19:26:35+00:00,1.12174,1.12176,-2.0000000000131024e-05,2027.546,2026.964,0.5820000000001073
292,3395.240,3401.200,So that’s kind of an overresponse to something that’s transitory.,CHAIR YELLEN.,2016-03-16 19:26:35.240000+00:00,2016-03-16 19:26:35+00:00,2016-03-16 19:26:41+00:00,1.1217700000000002,1.12175,2.0000000000131024e-05,2027.27,2027.491,-0.22100000000000364
293,3401.200,3415.120,So it’s difficult to get a clear read from those survey measures.,CHAIR YELLEN.,2016-03-16 19:26:41.200000+00:00,2016-03-16 19:26:41+00:00,2016-03-16 19:26:55+00:00,1.12186,1.12176,9.999999999998899e-05,2027.607,2027.251,0.35599999999999454
294,3415.120,3418.560,premia and liquidity premia.,CHAIR YELLEN.,2016-03-16 19:26:55.120000+00:00,2016-03-16 19:26:55+00:00,2016-03-16 19:26:59+00:00,1.12186,1.1218,6.000000000017103e-05,2027.614,2027.577,0.03700000000003456
295,3418.560,3435.440,"And so, it’s also—we monitor those closely and discuss them in the statement in paragraph one, but, again, there’s not a straight read on what’s happening to the expectations that influence wage and price setting.",CHAIR YELLEN.,2016-03-16 19:26:58.560000+00:00,2016-03-16 19:26:59+00:00,2016-03-16 19:27:15+00:00,1.1219100000000002,1.12188,3.0000000000196536e-05,2027.826,2027.605,0.22100000000000364
296,3435.440,3450.840,"But this model continues to at least influence my own thinking, and it certainly is a factor that I and at least some of my colleagues are incorporating in these projections.",CHAIR YELLEN.,2016-03-16 19:27:15.440000+00:00,2016-03-16 19:27:15+00:00,2016-03-16 19:27:31+00:00,1.12186,1.12192,-5.999999999994898e-05,2027.706,2027.843,-0.13700000000017099
297,3450.840,3457.760,"Erik Schatzker, Bloomberg Television.",ERIK SCHATZKER.,2016-03-16 19:27:30.840000+00:00,2016-03-16 19:27:31+00:00,2016-03-16 19:27:38+00:00,1.1219,1.12185,4.999999999988347e-05,2027.858,2027.828,0.029999999999972715
298,3457.760,3459.600,"Madam Chair, thank you.",ERIK SCHATZKER.,2016-03-16 19:27:37.760000+00:00,2016-03-16 19:27:38+00:00,2016-03-16 19:27:40+00:00,1.12193,1.12193,0.0,2027.858,2027.858,0.0
299,3459.600,3470.680,"Notwithstanding what the dots tell us about rate expectations, has there been any discussion among members of the Committee about the potential need for further stimulus?",ERIK SCHATZKER.,2016-03-16 19:27:39.600000+00:00,2016-03-16 19:27:40+00:00,2016-03-16 19:27:51+00:00,1.12194,1.12187,7.00000000000145e-05,2028.496,2027.858,0.6380000000001473
300,3470.680,3494.280,"And even if there hasn’t been such a discussion yet, could you share with us what you have learned from the reevaluation of negative interest rates, whether you consider negative interest rates effective, how effective relative to quantitative easing, and whether the Committee would hypothetically use them instead of or in conjunction with quantitative easing in the event that the economy should warrant further stimulus?",ERIK SCHATZKER.,2016-03-16 19:27:50.680000+00:00,2016-03-16 19:27:51+00:00,2016-03-16 19:28:14+00:00,1.12192,1.12184,8.000000000008001e-05,2029.041,2028.499,0.5419999999999163
301,3494.280,3495.320,Okay.,CHAIR YELLEN.,2016-03-16 19:28:14.280000+00:00,2016-03-16 19:28:14+00:00,2016-03-16 19:28:15+00:00,1.12192,1.12194,-1.999999999990898e-05,2029.006,2029.026,-0.01999999999998181
302,3495.320,3502.600,So what I would like to make clear is that this is not actively a subject that we are considering or discussing.,CHAIR YELLEN.,2016-03-16 19:28:15.320000+00:00,2016-03-16 19:28:15+00:00,2016-03-16 19:28:23+00:00,1.1219100000000002,1.12192,-9.999999999843467e-06,2028.905,2028.954,-0.04899999999997817
303,3502.600,3512.520,The Committee continues to feel that we are on a course where the economy is improving and inflation is moving back up.,CHAIR YELLEN.,2016-03-16 19:28:22.600000+00:00,2016-03-16 19:28:23+00:00,2016-03-16 19:28:33+00:00,1.12187,1.1219100000000002,-4.000000000026205e-05,2028.977,2028.823,0.15399999999999636
304,3512.520,3524.240,"And, as I indicated, if events continue to unfold in that way, we are likely to gradually raise rates over time.",CHAIR YELLEN.,2016-03-16 19:28:32.520000+00:00,2016-03-16 19:28:33+00:00,2016-03-16 19:28:44+00:00,1.1218,1.12184,-4.0000000000040004e-05,2028.743,2028.977,-0.23400000000015098
305,3524.240,3527.280,"Again, that’s not fixed in stone.",CHAIR YELLEN.,2016-03-16 19:28:44.240000+00:00,2016-03-16 19:28:44+00:00,2016-03-16 19:28:47+00:00,1.1217700000000002,1.12175,2.0000000000131024e-05,2028.743,2028.743,0.0
306,3527.280,3530.640,We’ll watch how the economy behaves.,CHAIR YELLEN.,2016-03-16 19:28:47.280000+00:00,2016-03-16 19:28:47+00:00,2016-03-16 19:28:51+00:00,1.1218,1.12182,-2.0000000000131024e-05,2028.998,2028.829,0.1690000000000964
307,3530.640,3550.920,"We’re prepared to respond if things transpire differently, but we are not spending time actively debating and considering things we could do for additional accommodation and certainly not actively considering negative rates.",CHAIR YELLEN.,2016-03-16 19:28:50.640000+00:00,2016-03-16 19:28:51+00:00,2016-03-16 19:29:11+00:00,1.1219,1.12178,0.00011999999999989797,2028.701,2028.845,-0.14400000000000546
308,3550.920,3567.560,"We are looking at the experience in other countries, and I guess I would judge they seem to have mixed effects, you know, some positive and some negative things.",CHAIR YELLEN.,2016-03-16 19:29:10.920000+00:00,2016-03-16 19:29:11+00:00,2016-03-16 19:29:28+00:00,1.12202,1.1219,0.00012000000000012001,2028.837,2028.685,0.15200000000004366
