69,978.760,995.640,"Indeed, they are not even—the median should not be interpreted as a Committee-endorsed forecast, and there’s a lot of uncertainty around each participant’s projection.",STEVE LIESMAN.,2016-03-16 18:46:18.760000+00:00,2016-03-16 18:46:19+00:00,2016-03-16 18:46:36+00:00,1.12083,1.12123,-0.00039999999999995595,2030.795,2030.844,-0.04899999999997817
70,995.640,1012.560,And they will evolve—those assessments of appropriate policy are completely contingent on each participant’s forecast of the economy and how economic events will unfold.,STEVE LIESMAN.,2016-03-16 18:46:35.640000+00:00,2016-03-16 18:46:36+00:00,2016-03-16 18:46:53+00:00,1.12077,1.12082,-4.999999999988347e-05,2029.873,2030.824,-0.9510000000000218
71,1012.560,1038.440,"And they are, of course, uncertain, and you should fully expect that forecasts for the appropriate path of policy on the part of all participants will evolve over time as shocks, positive or negative, hit the economy that alter those forecasts.",STEVE LIESMAN.,2016-03-16 18:46:52.560000+00:00,2016-03-16 18:46:53+00:00,2016-03-16 18:47:18+00:00,1.12034,1.12075,-0.00041000000000002146,2030.529,2029.901,0.6279999999999291
72,1038.440,1069.480,"So you have seen a shift this time in most participants’ assessments of the appropriate path for policy, and, as I tried to indicate, I think that largely reflects a somewhat slower projected path for global growth—for growth in the global economy outside the United States—and for some tightening in credit conditions in the form of an increase in spreads.",STEVE LIESMAN.,2016-03-16 18:47:18.440000+00:00,2016-03-16 18:47:18+00:00,2016-03-16 18:47:49+00:00,1.12043,1.12044,-1.0000000000065512e-05,2029.459,2030.24,-0.7809999999999491
73,1069.480,1087.680,And those changes in financial conditions and in the path of the global economy have induced changes in the assessment of individual participants in what path is appropriate to achieve our objectives.,STEVE LIESMAN.,2016-03-16 18:47:49.480000+00:00,2016-03-16 18:47:49+00:00,2016-03-16 18:48:08+00:00,1.11997,1.1203200000000002,-0.0003500000000002945,2029.459,2029.409,0.049999999999954525
74,1087.680,1090.520,So that’s what you see.,STEVE LIESMAN.,2016-03-16 18:48:07.680000+00:00,2016-03-16 18:48:08+00:00,2016-03-16 18:48:11+00:00,1.12006,1.11989,0.00017000000000000348,2029.498,2029.498,0.0
75,1090.520,1091.560,That’s what you see.,STEVE LIESMAN.,2016-03-16 18:48:10.520000+00:00,2016-03-16 18:48:11+00:00,2016-03-16 18:48:12+00:00,1.12005,1.12006,-1.0000000000065512e-05,2029.408,2029.457,-0.049000000000205546
76,1091.560,1119.880,"Now, I guess you asked me also what would we need to see to continue raising rates, and I think it’s worth pointing out here that the Committee—most participants do continue to envision that if economic developments unfold as they expect, that further increases in the federal funds rate will prove appropriate over time.",STEVE LIESMAN.,2016-03-16 18:48:11.560000+00:00,2016-03-16 18:48:12+00:00,2016-03-16 18:48:40+00:00,1.1203,1.1201,0.00019999999999997797,2028.543,2029.391,-0.8480000000001837
77,1119.880,1126.680,"Most participants anticipate that, and that the pace will be gradual.",STEVE LIESMAN.,2016-03-16 18:48:39.880000+00:00,2016-03-16 18:48:40+00:00,2016-03-16 18:48:47+00:00,1.12037,1.12034,3.0000000000196536e-05,2028.975,2028.68,0.2949999999998454
78,1126.680,1164.560,"As I emphasized, most empirical work attempting to assess what the equilibrium level of the fed funds rate is, a level that would be neither expansionary nor the stance of policy, and we do expect, over time, that neutral rate to move up, but, you know, we’re not positive what rate—what the pace of change of that will be over time.",STEVE LIESMAN.,2016-03-16 18:48:46.680000+00:00,2016-03-16 18:48:47+00:00,2016-03-16 18:49:25+00:00,1.12066,1.12043,0.00022999999999995246,2029.171,2028.99,0.18100000000004002
79,1164.560,1180.480,"But, given that the economy is now close to our maximum employment objective, you know, hopefully inflation is moving up—I  mentioned, as you mentioned, recent readings on inflation have moved up.",STEVE LIESMAN.,2016-03-16 18:49:24.560000+00:00,2016-03-16 18:49:25+00:00,2016-03-16 18:49:40+00:00,1.12051,1.12067,-0.00016000000000016001,2029.489,2029.542,-0.052999999999883585
80,1180.480,1189.600,"There may be some—you know, I want to warn that there may be some transitory factors that are influencing that.",STEVE LIESMAN.,2016-03-16 18:49:40.480000+00:00,2016-03-16 18:49:40+00:00,2016-03-16 18:49:50+00:00,1.12041,1.12051,-9.999999999998899e-05,2029.476,2029.463,0.013000000000147338
81,1189.600,1212.120,"But, certainly, our projections are for a gradual increase in inflation, and the Committee—at least, most participants continue to expect that if we follow along this course, that some further adjustments in the federal funds rate will be appropriate but gradual.",STEVE LIESMAN.,2016-03-16 18:49:49.600000+00:00,2016-03-16 18:49:50+00:00,2016-03-16 18:50:12+00:00,1.12085,1.12036,0.0004899999999998794,2029.633,2029.316,0.3170000000000073
82,1212.120,1213.160,Sam Fleming from the Financial Times.,SAM FLEMING.,2016-03-16 18:50:12.120000+00:00,2016-03-16 18:50:12+00:00,2016-03-16 18:50:13+00:00,1.12077,1.12078,-1.0000000000065512e-05,2029.748,2029.772,-0.023999999999887223
83,1213.160,1215.080,Can I just follow up on this inflation point?,SAM FLEMING.,2016-03-16 18:50:13.160000+00:00,2016-03-16 18:50:13+00:00,2016-03-16 18:50:15+00:00,1.12066,1.12066,0.0,2029.687,2029.687,0.0
84,1215.080,1220.400,"Because the numbers have been ticking up, as you said—somewhat, at least.",SAM FLEMING.,2016-03-16 18:50:15.080000+00:00,2016-03-16 18:50:15+00:00,2016-03-16 18:50:20+00:00,1.12074,1.12063,0.0001100000000000545,2029.423,2029.654,-0.23099999999999454
85,1220.400,1225.480,"And we’re also, as you said, also at a point where we have quite close to full employment.",SAM FLEMING.,2016-03-16 18:50:20.400000+00:00,2016-03-16 18:50:20+00:00,2016-03-16 18:50:25+00:00,1.12075,1.12074,9.999999999843467e-06,2029.117,2029.324,-0.20700000000010732
86,1225.480,1240.080,"Is there a risk that we’re heading for an overshoot in inflation, and is there, given the greater symmetry the Fed has been flagging up, in terms of its inflation target, a greater tolerance for a modest overshoot, especially given the long period of undershoots that we’ve been through?",SAM FLEMING.,2016-03-16 18:50:25.480000+00:00,2016-03-16 18:50:25+00:00,2016-03-16 18:50:40+00:00,1.12104,1.12079,0.0002500000000000835,2029.295,2029.142,0.15300000000002
87,1240.080,1252.880,"So I want to make clear that our inflation objective is 2 percent, and we are projecting a move back to 2 percent.",CHAIR YELLEN.,2016-03-16 18:50:40.080000+00:00,2016-03-16 18:50:40+00:00,2016-03-16 18:50:53+00:00,1.12187,1.1210600000000002,0.0008099999999997554,2029.345,2029.203,0.14200000000005275
88,1252.880,1265.760,"And we are not trying to engineer an overshoot of inflation, not to compensate for past undershoots, so 2 percent is our objective.",CHAIR YELLEN.,2016-03-16 18:50:52.880000+00:00,2016-03-16 18:50:53+00:00,2016-03-16 18:51:06+00:00,1.12176,1.1221,-0.00034000000000000696,2028.676,2029.25,-0.5740000000000691
89,1265.760,1274.160,"But it is a symmetric objective, and we certainly don’t seek to overshoot our objective.",CHAIR YELLEN.,2016-03-16 18:51:05.760000+00:00,2016-03-16 18:51:06+00:00,2016-03-16 18:51:14+00:00,1.12173,1.12149,0.00023999999999979593,2029.132,2029.234,-0.10199999999986176
90,1274.160,1290.000,"But some undershoots and overshoots are part of how the economy operates, and our tolerance for those is symmetric with respect to under- and overshoots.",CHAIR YELLEN.,2016-03-16 18:51:14.160000+00:00,2016-03-16 18:51:14+00:00,2016-03-16 18:51:30+00:00,1.12125,1.1219100000000002,-0.000660000000000105,2028.183,2028.822,-0.6389999999998963
91,1290.000,1297.120,We did take note in the statement of the fact that inflation has picked up in recent months.,CHAIR YELLEN.,2016-03-16 18:51:30+00:00,2016-03-16 18:51:30+00:00,2016-03-16 18:51:37+00:00,1.12138,1.1211600000000002,0.00021999999999988695,2028.404,2028.188,0.2159999999998945
92,1297.120,1324.720,"I see some of that as having to do with unusually high inflation readings in categories that tend to be quite volatile without very much significance uptick that will be lasting in, for example, in core inflation.",CHAIR YELLEN.,2016-03-16 18:51:37.120000+00:00,2016-03-16 18:51:37+00:00,2016-03-16 18:52:05+00:00,1.1220100000000002,1.12133,0.000680000000000236,2028.173,2028.451,-0.27800000000002
93,1324.720,1359.800,"But we note—the Committee notes, as it did in December, that we continue to monitor development trends and developments closely, and that would include both the fact that recent inflation readings have been on the high side, and, as I mentioned, on the other side, that readings on measures of inflation compensation and some survey measures have been on the low side.",CHAIR YELLEN.,2016-03-16 18:52:04.720000+00:00,2016-03-16 18:52:05+00:00,2016-03-16 18:52:40+00:00,1.12256,1.12188,0.0006800000000000139,2028.341,2028.097,0.2439999999999145
94,1359.800,1367.720,"So, in that sense, there are risks around the inflation forecast in both—in both directions.",CHAIR YELLEN.,2016-03-16 18:52:39.800000+00:00,2016-03-16 18:52:40+00:00,2016-03-16 18:52:48+00:00,1.12245,1.12237,7.999999999985796e-05,2028.292,2028.377,-0.08500000000003638
95,1367.720,1374.080,"Hi, Lindsay Dunsmuir with Reuters.",LINDSAY DUNSMUIR.,2016-03-16 18:52:47.720000+00:00,2016-03-16 18:52:48+00:00,2016-03-16 18:52:54+00:00,1.12263,1.12246,0.00017000000000000348,2028.24,2028.254,-0.013999999999896318
96,1374.080,1383.440,"Your statement did note that, as you’re saying, that inflation has picked up in recent months, and you do still see it going back to 2 percent over the medium term.",LINDSAY DUNSMUIR.,2016-03-16 18:52:54.080000+00:00,2016-03-16 18:52:54+00:00,2016-03-16 18:53:03+00:00,1.12247,1.12264,-0.00017000000000000348,2027.921,2028.083,-0.16200000000003456
97,1383.440,1391.440,Yet policymakers have downgraded GDP growth forecasts for this year and one of the inflation measures.,LINDSAY DUNSMUIR.,2016-03-16 18:53:03.440000+00:00,2016-03-16 18:53:03+00:00,2016-03-16 18:53:11+00:00,1.12251,1.12245,5.999999999994898e-05,2027.982,2027.719,0.26299999999991996
98,1391.440,1402.200,"So that to me would indicate a weakening economic environment, and I’m wondering how, in that environment, you justify the possibility of two rate hikes this year.",LINDSAY DUNSMUIR.,2016-03-16 18:53:11.440000+00:00,2016-03-16 18:53:11+00:00,2016-03-16 18:53:22+00:00,1.12217,1.12249,-0.000320000000000098,2027.851,2027.746,0.10500000000001819
99,1402.200,1409.600,So there has been a slight downgrading of the assessment of economic growth for this year.,CHAIR YELLEN.,2016-03-16 18:53:22.200000+00:00,2016-03-16 18:53:22+00:00,2016-03-16 18:53:30+00:00,1.12173,1.12202,-0.0002900000000001235,2027.88,2027.97,-0.08999999999991815
100,1409.600,1445.920,"But, nevertheless, growth is expected to run in—somewhat in excess of potential, so that the labor market is expected to continue to tighten, and by the end of the year, even edge below levels that—of the unemployment rate—that are estimated to be longer in the normal run, and inflation is expected to gradually move back to 2 percent over time.",CHAIR YELLEN.,2016-03-16 18:53:29.600000+00:00,2016-03-16 18:53:30+00:00,2016-03-16 18:54:06+00:00,1.12164,1.1219,-0.00025999999999992696,2027.646,2027.871,-0.22500000000013642
101,1445.920,1464.320,"We still have, weighing on inflation, the influence of earlier declines in energy prices and a prolonged effect from the appreciation of the dollar, but we do expect those transitory influences to fade.",CHAIR YELLEN.,2016-03-16 18:54:05.920000+00:00,2016-03-16 18:54:06+00:00,2016-03-16 18:54:24+00:00,1.12194,1.1216700000000002,0.0002699999999997704,2027.842,2027.645,0.19700000000011642
102,1464.320,1474.800,"And with a continuing—continuing improvement in the labor market, I think we’ll see upward pressure on inflation.",CHAIR YELLEN.,2016-03-16 18:54:24.320000+00:00,2016-03-16 18:54:24+00:00,2016-03-16 18:54:35+00:00,1.1219100000000002,1.1219,1.0000000000287557e-05,2027.943,2027.906,0.03700000000003456
103,1474.800,1489.720,"And, in that context, the Committee sees it appropriate to—if things unfold in that way, to have some further increases in the federal funds rate.",CHAIR YELLEN.,2016-03-16 18:54:34.800000+00:00,2016-03-16 18:54:35+00:00,2016-03-16 18:54:50+00:00,1.12189,1.12186,2.999999999997449e-05,2028.363,2027.943,0.42000000000007276
104,1489.720,1499.240,It remains inflation to go back to 2 percent.,CHAIR YELLEN.,2016-03-16 18:54:49.720000+00:00,2016-03-16 18:54:50+00:00,2016-03-16 18:54:59+00:00,1.1218,1.12186,-6.000000000017103e-05,2028.017,2028.363,-0.34600000000000364
105,1499.240,1520.840,"But we also want to be careful not to see some significant overshoots, so that we would get behind the curve and potentially be faced with a need to tighten in a very rapid fashion later in a way that could undermine the sustainability of the employment gains we have had.",CHAIR YELLEN.,2016-03-16 18:54:59.240000+00:00,2016-03-16 18:54:59+00:00,2016-03-16 18:55:21+00:00,1.12153,1.12171,-0.000180000000000069,2027.348,2027.875,-0.5270000000000437
106,1520.840,1528.000,But we do see some continued tightening in monetary policy to be appropriate in that event.,CHAIR YELLEN.,2016-03-16 18:55:20.840000+00:00,2016-03-16 18:55:21+00:00,2016-03-16 18:55:28+00:00,1.12153,1.12143,9.999999999998899e-05,2027.457,2027.228,0.22900000000004184
107,1528.000,1531.200,"Chair Yellen, over here.",PETER BARNES.,2016-03-16 18:55:28+00:00,2016-03-16 18:55:28+00:00,2016-03-16 18:55:31+00:00,1.1215700000000002,1.1214700000000002,9.999999999998899e-05,2027.455,2027.455,0.0
108,1531.200,1532.960,"Hi, Peter Barnes with Fox Business.",PETER BARNES.,2016-03-16 18:55:31.200000+00:00,2016-03-16 18:55:31+00:00,2016-03-16 18:55:33+00:00,1.12168,1.12168,0.0,2027.384,2027.384,0.0
109,1532.960,1539.160,Could you get a little bit more specific about the global and economic financial developments that continue to pose risks to the U.S. economy?,PETER BARNES.,2016-03-16 18:55:32.960000+00:00,2016-03-16 18:55:33+00:00,2016-03-16 18:55:39+00:00,1.12164,1.12166,-2.0000000000131024e-05,2027.148,2027.359,-0.21100000000001273
110,1539.160,1544.040,You did mention a strong dollar there just a second ago and slowing global growth.,PETER BARNES.,2016-03-16 18:55:39.160000+00:00,2016-03-16 18:55:39+00:00,2016-03-16 18:55:44+00:00,1.1218100000000002,1.12176,5.0000000000105516e-05,2027.441,2027.182,0.25900000000001455
111,1544.040,1552.080,"But are you specifically concerned about, for example, China, the emerging markets, and the E.U.?",PETER BARNES.,2016-03-16 18:55:44.040000+00:00,2016-03-16 18:55:44+00:00,2016-03-16 18:55:52+00:00,1.1218100000000002,1.12187,-5.999999999972694e-05,2026.763,2027.158,-0.3949999999999818
112,1552.080,1554.400,Could you expand on the risks?,PETER BARNES.,2016-03-16 18:55:52.080000+00:00,2016-03-16 18:55:52+00:00,2016-03-16 18:55:54+00:00,1.12173,1.12173,0.0,2026.66,2026.66,0.0
113,1554.400,1566.320,"So there has been, by many forecasters, a slight downgrading of forecasts of global growth in—over the coming several years.",CHAIR YELLEN.,2016-03-16 18:55:54.400000+00:00,2016-03-16 18:55:54+00:00,2016-03-16 18:56:06+00:00,1.12182,1.12159,0.00022999999999995246,2026.878,2026.592,0.28599999999983083
114,1566.320,1573.200,"The IMF has slightly downgraded their forecasts, and other international agencies have as well.",CHAIR YELLEN.,2016-03-16 18:56:06.320000+00:00,2016-03-16 18:56:06+00:00,2016-03-16 18:56:13+00:00,1.1219,1.12188,1.999999999990898e-05,2026.601,2026.507,0.09400000000005093
115,1573.200,1579.400,Chinese growth hasn’t proven a great surprise.,CHAIR YELLEN.,2016-03-16 18:56:13.200000+00:00,2016-03-16 18:56:13+00:00,2016-03-16 18:56:19+00:00,1.12198,1.12195,2.999999999997449e-05,2026.393,2026.487,-0.09400000000005093
116,1579.400,1586.280,"We’ve anticipated that it would slow over time, and it seems to be slowing as well.",CHAIR YELLEN.,2016-03-16 18:56:19.400000+00:00,2016-03-16 18:56:19+00:00,2016-03-16 18:56:26+00:00,1.12179,1.12193,-0.000140000000000029,2026.166,2026.436,-0.2699999999999818
117,1586.280,1597.280,"Japanese growth in the fourth quarter was negative, and that was something of a surprise.",CHAIR YELLEN.,2016-03-16 18:56:26.280000+00:00,2016-03-16 18:56:26+00:00,2016-03-16 18:56:37+00:00,1.12175,1.12141,0.00034000000000000696,2025.822,2026.155,-0.3330000000000837
118,1597.280,1606.440,"And with respect to the euro area, recent indicators suggest perhaps slightly weaker growth.",CHAIR YELLEN.,2016-03-16 18:56:37.280000+00:00,2016-03-16 18:56:37+00:00,2016-03-16 18:56:46+00:00,1.12164,1.12174,-9.999999999998899e-05,2025.875,2025.571,0.3040000000000873
119,1606.440,1620.480,"So there’s been a number of emerging markets—as you know, we’re suffering under the weight of declines in oil prices that are affecting their economic activity.",CHAIR YELLEN.,2016-03-16 18:56:46.440000+00:00,2016-03-16 18:56:46+00:00,2016-03-16 18:57:00+00:00,1.1214,1.1216700000000002,-0.0002700000000002145,2025.223,2025.749,-0.5260000000000673
120,1620.480,1631.560,"Our neighbors both to the north and south, Canada and Mexico, are feeling the impacts of lower oil prices on their growth.",CHAIR YELLEN.,2016-03-16 18:57:00.480000+00:00,2016-03-16 18:57:00+00:00,2016-03-16 18:57:12+00:00,1.1211700000000002,1.12142,-0.00024999999999986144,2025.867,2025.534,0.3329999999998563
121,1631.560,1644.920,"So our projection for global growth, for those reasons, is slightly lower—not dramatically lower, but enough lower to make some difference to our forecast.",CHAIR YELLEN.,2016-03-16 18:57:11.560000+00:00,2016-03-16 18:57:12+00:00,2016-03-16 18:57:25+00:00,1.12135,1.1210700000000002,0.00027999999999983594,2026.259,2026.151,0.10799999999994725
122,1644.920,1672.920,"And, as I indicated, I think that’s part of the reason, along with the associated increase we have seen in some spreads that are involved think that a slightly lower path for the federal funds rate will be appropriate to achieve our objectives.",CHAIR YELLEN.,2016-03-16 18:57:24.920000+00:00,2016-03-16 18:57:25+00:00,2016-03-16 18:57:53+00:00,1.12078,1.12141,-0.0006299999999999084,2026.239,2026.112,0.1269999999999527
123,1672.920,1689.280,And so what you see here is a virtually unchanged path of economic projections and a slightly more accommodative path that most participants are writing down for what’s necessary to achieve that.,CHAIR YELLEN.,2016-03-16 18:57:52.920000+00:00,2016-03-16 18:57:53+00:00,2016-03-16 18:58:09+00:00,1.12013,1.12064,-0.0005100000000000104,2026.374,2026.052,0.3220000000001164
124,1689.280,1697.280,Thank you.,KATE DAVIDSON.,2016-03-16 18:58:09.280000+00:00,2016-03-16 18:58:09+00:00,2016-03-16 18:58:17+00:00,1.1199,1.11995,-5.0000000000105516e-05,2026.264,2026.246,0.01799999999980173
125,1697.280,1699.160,Kate Davidson from the Wall Street Journal.,KATE DAVIDSON.,2016-03-16 18:58:17.280000+00:00,2016-03-16 18:58:17+00:00,2016-03-16 18:58:19+00:00,1.11992,1.11992,0.0,2026.556,2026.556,0.0
126,1699.160,1703.720,"Madam Chair, you’ve emphasized repeatedly that every meeting of the FOMC is a live meeting.",KATE DAVIDSON.,2016-03-16 18:58:19.160000+00:00,2016-03-16 18:58:19+00:00,2016-03-16 18:58:24+00:00,1.12,1.12004,-3.999999999981796e-05,2026.497,2026.529,-0.03199999999992542
127,1703.720,1704.920,You have a meeting next month.,KATE DAVIDSON.,2016-03-16 18:58:23.720000+00:00,2016-03-16 18:58:24+00:00,2016-03-16 18:58:25+00:00,1.12004,1.12002,1.999999999990898e-05,2026.509,2026.548,-0.03899999999998727
128,1704.920,1714.240,"Is it possible that you could get enough information between now and then to, you know, get you comfortable with raising rates again in April, and what would you need to see?",KATE DAVIDSON.,2016-03-16 18:58:24.920000+00:00,2016-03-16 18:58:25+00:00,2016-03-16 18:58:34+00:00,1.12028,1.12008,0.00019999999999997797,2026.604,2026.494,0.11000000000012733
129,1714.240,1720.000,So I will say again that every meeting is a live meeting.,CHAIR YELLEN.,2016-03-16 18:58:34.240000+00:00,2016-03-16 18:58:34+00:00,2016-03-16 18:58:40+00:00,1.11982,1.12015,-0.00032999999999994145,2026.51,2026.682,-0.17200000000002547
130,1720.000,1727.400,"April remains a live meeting, and we will be tracking incoming data.",CHAIR YELLEN.,2016-03-16 18:58:40+00:00,2016-03-16 18:58:40+00:00,2016-03-16 18:58:47+00:00,1.11978,1.1199100000000002,-0.00013000000000018552,2026.29,2026.373,-0.08300000000008367
131,1727.400,1729.360,It’s a slightly shorter period.,CHAIR YELLEN.,2016-03-16 18:58:47.400000+00:00,2016-03-16 18:58:47+00:00,2016-03-16 18:58:49+00:00,1.11974,1.11974,0.0,2026.303,2026.303,0.0
132,1729.360,1740.240,"We have six weeks, but there will be additional data on the labor market and on various factors that pertain to inflation.",CHAIR YELLEN.,2016-03-16 18:58:49.360000+00:00,2016-03-16 18:58:49+00:00,2016-03-16 18:59:00+00:00,1.11936,1.11976,-0.000400000000000178,2026.056,2026.375,-0.31899999999996
133,1740.240,1752.040,"So that’s, you know, that’s—that is certainly a live possibility.",CHAIR YELLEN.,2016-03-16 18:59:00.240000+00:00,2016-03-16 18:59:00+00:00,2016-03-16 18:59:12+00:00,1.11948,1.11915,0.00032999999999994145,2024.958,2025.782,-0.8239999999998417
134,1752.040,1753.240,Two questions.,STEVEN MUFSON.,2016-03-16 18:59:12.040000+00:00,2016-03-16 18:59:12+00:00,2016-03-16 18:59:13+00:00,1.11956,1.11955,1.0000000000065512e-05,2024.939,2024.944,-0.004999999999881766
135,1753.240,1755.440,The oil—lower oil prices.,STEVEN MUFSON.,2016-03-16 18:59:13.240000+00:00,2016-03-16 18:59:13+00:00,2016-03-16 18:59:15+00:00,1.11931,1.11931,0.0,2024.975,2024.975,0.0
136,1755.440,1759.240,I think a lot of people expect it to lead to more consumer spending.,STEVEN MUFSON.,2016-03-16 18:59:15.440000+00:00,2016-03-16 18:59:15+00:00,2016-03-16 18:59:19+00:00,1.11913,1.11932,-0.0001900000000001345,2025.248,2024.953,0.29500000000007276
137,1759.240,1766.840,What do you—how do you see and how do you explain that that hasn’t worked out as well—the way a lot of people expected?,STEVEN MUFSON.,2016-03-16 18:59:19.240000+00:00,2016-03-16 18:59:19+00:00,2016-03-16 18:59:27+00:00,1.1194,1.1192700000000002,0.00012999999999974143,2025.232,2025.097,0.1349999999999909
138,1766.840,1776.520,"And also, if oil prices were to pop back up to, say, $50, not that high by some standards, what impact would that have on inflation?",STEVEN MUFSON.,2016-03-16 18:59:26.840000+00:00,2016-03-16 18:59:27+00:00,2016-03-16 18:59:37+00:00,1.1192,1.11939,-0.0001900000000001345,2024.221,2024.96,-0.7390000000000327
139,1776.520,1779.200,And would you be paying more attention to the overall inflation rate?,STEVEN MUFSON.,2016-03-16 18:59:36.520000+00:00,2016-03-16 18:59:37+00:00,2016-03-16 18:59:39+00:00,1.11941,1.11941,0.0,2023.983,2023.983,0.0
140,1779.200,1785.480,Or would you then look to the core rate to—to—to determine what the Fed’s policies would be?,STEVEN MUFSON.,2016-03-16 18:59:39.200000+00:00,2016-03-16 18:59:39+00:00,2016-03-16 18:59:45+00:00,1.11939,1.11948,-8.999999999992347e-05,2023.843,2023.952,-0.1089999999999236
141,1785.480,1792.840,So let me start with the impact of oil prices on consumer spending.,CHAIR YELLEN.,2016-03-16 18:59:45.480000+00:00,2016-03-16 18:59:45+00:00,2016-03-16 18:59:53+00:00,1.11955,1.11933,0.000220000000000109,2022.96,2023.839,-0.8789999999999054
142,1792.840,1818.200,"I have to say, it’s very difficult when you look at patterns of consumer spending to—there are many factors that influence it, and to definitively say that lower oil prices have not boosted way.",CHAIR YELLEN.,2016-03-16 18:59:52.840000+00:00,2016-03-16 18:59:53+00:00,2016-03-16 19:00:18+00:00,1.1194700000000002,1.11971,-0.00023999999999979593,2022.861,2022.593,0.2680000000000291
143,1818.200,1831.920,"The typical—the average household in the United States with oil prices where they are now is probably benefiting around $1,000 a year.",CHAIR YELLEN.,2016-03-16 19:00:18.200000+00:00,2016-03-16 19:00:18+00:00,2016-03-16 19:00:32+00:00,1.11941,1.11944,-2.999999999997449e-05,2023.088,2022.742,0.34600000000000364
144,1831.920,1856.440,"And some very detailed microdata that I’ve seen on household spending patterns suggest that there may be a link, as you would expect, from reduced bills—you know, reduced amounts that people pay at the pump to other spending, like eating out at—for restaurant meals and other things.",CHAIR YELLEN.,2016-03-16 19:00:31.920000+00:00,2016-03-16 19:00:32+00:00,2016-03-16 19:00:56+00:00,1.11963,1.11946,0.00017000000000000348,2023.236,2023.352,-0.11599999999998545
145,1856.440,1866.280,"But the aggregate data, I—you know, is not as strong as it—and spending is not as strong as it could be, given the decline.",CHAIR YELLEN.,2016-03-16 19:00:56.440000+00:00,2016-03-16 19:00:56+00:00,2016-03-16 19:01:06+00:00,1.1199,1.11966,0.00023999999999979593,2023.223,2022.73,0.49299999999993815
146,1866.280,1880.120,"And, of course, on the other side, we are—and, you know, it may be that it will take a while, and it’s something that will slowly strengthen over time if oil prices stay low.",CHAIR YELLEN.,2016-03-16 19:01:06.280000+00:00,2016-03-16 19:01:06+00:00,2016-03-16 19:01:20+00:00,1.12005,1.12002,2.999999999997449e-05,2023.208,2023.38,-0.17200000000002547
