,Start Time,End Time,Sentence,Speaker,Local Start Time,Rounded Start Local Time,Rounded End Local Time,Closest EURUSD End Close Delayed,Closest EURUSD Start Close non Delayed,EURUSD Close Difference,Closest USA500.IDXUSD End Close Delayed,Closest USA500.IDXUSD Start Close non Delayed,USA500.IDXUSD Close Difference
0,0.000,13.880,Good afternoon.,CHAIR YELLEN.,2017-09-20 18:30:00+00:00,2017-09-20 18:30:00+00:00,2017-09-20 18:30:14+00:00,1.18972,1.1903100000000002,-0.0005900000000000905,2498.63,2498.849,-0.21900000000005093
1,13.880,31.240,"At our meeting that concluded earlier today, my colleagues and I on the Federal Open Market Committee decided to maintain the target range for the federal funds rate at 1 to 1¼ percent.",CHAIR YELLEN.,2017-09-20 18:30:13.880000+00:00,2017-09-20 18:30:14+00:00,2017-09-20 18:30:31+00:00,1.18969,1.1896600000000002,2.9999999999752447e-05,2498.88,2498.719,0.1610000000000582
2,31.240,43.000,"This accommodative policy should support some further strengthening in the job market and a return to 2 percent inflation, consistent with our statutory objectives.",CHAIR YELLEN.,2017-09-20 18:30:31.240000+00:00,2017-09-20 18:30:31+00:00,2017-09-20 18:30:43+00:00,1.1897,1.18963,7.00000000000145e-05,2498.849,2498.6,0.24900000000025102
3,43.000,51.880,We also decided that in October we will begin the balance sheet normalization program that we outlined in June.,CHAIR YELLEN.,2017-09-20 18:30:43+00:00,2017-09-20 18:30:43+00:00,2017-09-20 18:30:52+00:00,1.18955,1.1896600000000002,-0.0001100000000000545,2498.599,2498.599,0.0
4,51.880,58.240,This program will reduce our securities holdings in a gradual and predictable manner.,CHAIR YELLEN.,2017-09-20 18:30:51.880000+00:00,2017-09-20 18:30:52+00:00,2017-09-20 18:30:58+00:00,1.18942,1.18959,-0.00017000000000000348,2498.719,2498.63,0.08899999999994179
5,58.240,66.160,"I’ll have more to say about these decisions shortly, but first I’ll review recent economic developments and the outlook.",CHAIR YELLEN.,2017-09-20 18:30:58.240000+00:00,2017-09-20 18:30:58+00:00,2017-09-20 18:31:06+00:00,1.1891200000000002,1.1892,-7.999999999985796e-05,2497.85,2498.63,-0.7800000000002001
6,66.160,76.920,"As we expected, and smoothing through some variation from quarter to quarter, economic activity has been rising moderately so far this year.",CHAIR YELLEN.,2017-09-20 18:31:06.160000+00:00,2017-09-20 18:31:06+00:00,2017-09-20 18:31:17+00:00,1.18914,1.18913,1.0000000000065512e-05,2497.599,2497.849,-0.25
7,76.920,82.040,Household spending has been supported by ongoing strength in the job market.,CHAIR YELLEN.,2017-09-20 18:31:16.920000+00:00,2017-09-20 18:31:17+00:00,2017-09-20 18:31:22+00:00,1.18873,1.18914,-0.00041000000000002146,2497.629,2497.599,0.02999999999974534
8,82.040,92.160,"Business investment has picked up, and exports have shown greater strength this year, in part reflecting improved economic conditions abroad.",CHAIR YELLEN.,2017-09-20 18:31:22.040000+00:00,2017-09-20 18:31:22+00:00,2017-09-20 18:31:32+00:00,1.189,1.18876,0.00024000000000001798,2498.349,2497.629,0.7200000000002547
9,92.160,100.160,"Overall, we expect that the economy will continue to expand at a moderate pace over the next few years.",CHAIR YELLEN.,2017-09-20 18:31:32.160000+00:00,2017-09-20 18:31:32+00:00,2017-09-20 18:31:40+00:00,1.18895,1.18901,-5.999999999994898e-05,2498.129,2498.379,-0.25
10,100.160,111.280,"In the third quarter, however, economic growth will be held down by the severe disruptions caused by Hurricanes Harvey, Irma, and Maria.",CHAIR YELLEN.,2017-09-20 18:31:40.160000+00:00,2017-09-20 18:31:40+00:00,2017-09-20 18:31:51+00:00,1.18879,1.1889,-0.0001100000000000545,2498.6,2498.13,0.4699999999997999
11,111.280,117.560,"As activity resumes and rebuilding gets under way, growth likely will bounce back.",CHAIR YELLEN.,2017-09-20 18:31:51.280000+00:00,2017-09-20 18:31:51+00:00,2017-09-20 18:31:58+00:00,1.18868,1.18876,-8.000000000008001e-05,2498.6,2498.6,0.0
12,117.560,132.600,"Based on past experience, these effects are unlikely to materially alter the course of the national economy beyond the next couple of quarters.",CHAIR YELLEN.,2017-09-20 18:31:57.560000+00:00,2017-09-20 18:31:58+00:00,2017-09-20 18:32:13+00:00,1.18864,1.1888200000000002,-0.00018000000000029104,2498.88,2498.6,0.2800000000002001
13,132.600,160.280,"Of course, for the families and communities that have been devastated by the storms, recovery will take time, and on behalf of the Federal Reserve, let me express our sympathy for in August—a solid rate of growth that remained well above estimates of the pace necessary to absorb new entrants to the labor force.",CHAIR YELLEN.,2017-09-20 18:32:12.600000+00:00,2017-09-20 18:32:13+00:00,2017-09-20 18:32:40+00:00,1.18873,1.18865,8.000000000008001e-05,2498.88,2498.629,0.2510000000002037
14,160.280,177.240,"We know from some timely indicators, such as initial claims for unemployment insurance, that the hurricanes severely disrupted the labor market in the affected areas, and payroll employment may be substantially affected in September.",CHAIR YELLEN.,2017-09-20 18:32:40.280000+00:00,2017-09-20 18:32:40+00:00,2017-09-20 18:32:57+00:00,1.18868,1.18873,-5.0000000000105516e-05,2498.85,2498.88,-0.03000000000020009
15,177.240,181.600,"However, such effects should unwind relatively quickly.",CHAIR YELLEN.,2017-09-20 18:32:57.240000+00:00,2017-09-20 18:32:57+00:00,2017-09-20 18:33:02+00:00,1.1887,1.1887200000000002,-2.0000000000131024e-05,2498.849,2498.879,-0.02999999999974534
16,181.600,195.800,"Meanwhile, the unemployment rate has stayed low in recent months and, at 4.4 percent in August, was modestly below the median of FOMC participants’ estimates of its longer-run normal level.",CHAIR YELLEN.,2017-09-20 18:33:01.600000+00:00,2017-09-20 18:33:02+00:00,2017-09-20 18:33:16+00:00,1.1884,1.18879,-0.0003900000000001125,2498.629,2498.849,-0.22000000000025466
17,195.800,204.080,"Participation in the labor force has changed little, both recently and over the past four years.",CHAIR YELLEN.,2017-09-20 18:33:15.800000+00:00,2017-09-20 18:33:16+00:00,2017-09-20 18:33:24+00:00,1.18846,1.18846,0.0,2498.629,2498.629,0.0
18,204.080,220.160,"Given the underlying downward trend in participation stemming largely from the aging of the U.S. population, a relatively steady participation rate is a further sign of improving conditions in the labor market.",CHAIR YELLEN.,2017-09-20 18:33:24.080000+00:00,2017-09-20 18:33:24+00:00,2017-09-20 18:33:40+00:00,1.18845,1.18825,0.00019999999999997797,2498.63,2498.629,0.0010000000002037268
19,220.160,224.520,We expect that the job market will strengthen somewhat further.,CHAIR YELLEN.,2017-09-20 18:33:40.160000+00:00,2017-09-20 18:33:40+00:00,2017-09-20 18:33:45+00:00,1.18847,1.18847,0.0,2498.129,2498.63,-0.5010000000002037
20,224.520,236.600,"Turning to inflation, the 12-month change in the price index for personal consumption expenditures was 1.4 percent in July, down noticeably from earlier in the year.",CHAIR YELLEN.,2017-09-20 18:33:44.520000+00:00,2017-09-20 18:33:45+00:00,2017-09-20 18:33:57+00:00,1.18846,1.18849,-2.999999999997449e-05,2498.63,2498.13,0.5
21,236.600,244.440,Core inflation—which excludes the volatile food and energy categories—has also moved lower.,CHAIR YELLEN.,2017-09-20 18:33:56.600000+00:00,2017-09-20 18:33:57+00:00,2017-09-20 18:34:04+00:00,1.18847,1.18847,0.0,2498.88,2498.599,0.28099999999994907
22,244.440,251.600,"For quite some time, inflation has been running below the Committee’s 2 percent longer-run objective.",CHAIR YELLEN.,2017-09-20 18:34:04.440000+00:00,2017-09-20 18:34:04+00:00,2017-09-20 18:34:12+00:00,1.18828,1.18839,-0.0001100000000000545,2498.879,2498.879,0.0
23,251.600,262.640,"However, we believe this year’s shortfall in inflation primarily reflects developments that are largely unrelated to broader economic conditions.",CHAIR YELLEN.,2017-09-20 18:34:11.600000+00:00,2017-09-20 18:34:12+00:00,2017-09-20 18:34:23+00:00,1.18819,1.1882700000000002,-8.000000000008001e-05,2498.629,2498.85,-0.22100000000000364
24,262.640,278.600,"For example, one-off reductions earlier this year in certain categories of prices, such as wireless telephone services, are currently holding down inflation, but these effects should be transitory.",CHAIR YELLEN.,2017-09-20 18:34:22.640000+00:00,2017-09-20 18:34:23+00:00,2017-09-20 18:34:39+00:00,1.1879,1.18812,-0.000220000000000109,2498.629,2498.629,0.0
25,278.600,297.480,"Such developments are not uncommon and, as long as inflation expectations remain reasonably well anchored, are not of great concern inflation, but only temporarily.",CHAIR YELLEN.,2017-09-20 18:34:38.600000+00:00,2017-09-20 18:34:39+00:00,2017-09-20 18:34:57+00:00,1.18755,1.1879,-0.00034999999999985043,2499.35,2498.629,0.7210000000000036
26,297.480,321.560,"More broadly, with employment near assessments of its maximum sustainable level and the labor market continuing to strengthen, the Committee continues to expect inflation to move up and stabilize around 2 percent over the next couple of years, in line with our longer-run objective.",CHAIR YELLEN.,2017-09-20 18:34:57.480000+00:00,2017-09-20 18:34:57+00:00,2017-09-20 18:35:22+00:00,1.18717,1.1875700000000002,-0.000400000000000178,2498.849,2499.35,-0.500999999999749
27,321.560,336.680,"Nonetheless, our understanding of the forces driving inflation is imperfect, and in light of the unexpected lower inflation readings this year, the Committee is monitoring inflation developments closely.",CHAIR YELLEN.,2017-09-20 18:35:21.560000+00:00,2017-09-20 18:35:22+00:00,2017-09-20 18:35:37+00:00,1.1875,1.18742,8.000000000008001e-05,2498.629,2498.849,-0.22000000000025466
28,336.680,347.960,"As always, the Committee is prepared to adjust monetary policy as needed to achieve its inflation and employment objectives over the medium term.",CHAIR YELLEN.,2017-09-20 18:35:36.680000+00:00,2017-09-20 18:35:37+00:00,2017-09-20 18:35:48+00:00,1.18693,1.18728,-0.00034999999999985043,2498.349,2498.599,-0.25
29,347.960,356.960,"Let me turn to the economic projections that Committee participants submitted for this meeting, which now extend through 2020.",CHAIR YELLEN.,2017-09-20 18:35:47.960000+00:00,2017-09-20 18:35:48+00:00,2017-09-20 18:35:57+00:00,1.18688,1.18699,-0.0001100000000000545,2498.35,2498.349,0.0009999999997489795
30,356.960,372.800,"As always, participants conditioned their projections on their own individual views of appropriate monetary policy, which, in turn, depend on each participant’s assessments of the many factors that shape the outlook.",CHAIR YELLEN.,2017-09-20 18:35:56.960000+00:00,2017-09-20 18:35:57+00:00,2017-09-20 18:36:13+00:00,1.18683,1.1867200000000002,0.00010999999999983245,2497.629,2498.13,-0.5010000000002037
31,372.800,386.840,"The median projection for growth of inflation-adjusted gross domestic product, or real GDP, is 2.4 percent this year and about 2 percent in 2018 and 2019.",CHAIR YELLEN.,2017-09-20 18:36:12.800000+00:00,2017-09-20 18:36:13+00:00,2017-09-20 18:36:27+00:00,1.18685,1.18685,0.0,2497.63,2497.629,0.0010000000002037268
32,386.840,396.120,"By 2020, the median growth projection moderates to 1.8 percent, in line with its estimated longer-run rate.",CHAIR YELLEN.,2017-09-20 18:36:26.840000+00:00,2017-09-20 18:36:27+00:00,2017-09-20 18:36:36+00:00,1.1867,1.18685,-0.00014999999999987246,2497.129,2497.63,-0.5010000000002037
33,396.120,415.000,"The median projection for the unemployment rate stands at 4.3 percent in the fourth quarter of this year and runs a little above 4 percent over the next three years, modestly below the median estimate of its longer-run normal rate.",CHAIR YELLEN.,2017-09-20 18:36:36.120000+00:00,2017-09-20 18:36:36+00:00,2017-09-20 18:36:55+00:00,1.18659,1.1866200000000002,-3.0000000000196536e-05,2497.85,2496.969,0.8809999999998581
34,415.000,437.120,"Finally, the median inflation projection is 1.6 percent this year, 1.9 percent next year, and 2 percent in 2019 and 2020.",CHAIR YELLEN.,2017-09-20 18:36:55+00:00,2017-09-20 18:36:55+00:00,2017-09-20 18:37:17+00:00,1.18688,1.18678,9.999999999998899e-05,2497.85,2497.85,0.0
35,437.120,472.240,"Compared with the projections made in June, real GDP growth is a touch stronger this year, and inflation—particularly core inflation—is slightly softer this year maintain its target for the federal funds rate, we continue to expect that the ongoing strength of the economy will warrant gradual increases in that rate to sustain a healthy labor market and stabilize inflation around our 2 percent longer-run objective.",CHAIR YELLEN.,2017-09-20 18:37:17.120000+00:00,2017-09-20 18:37:17+00:00,2017-09-20 18:37:52+00:00,1.18731,1.1867100000000002,0.0005999999999999339,2499.129,2497.85,1.2789999999999964
36,472.240,492.240,"That expectation is based on our view that the federal funds rate remains somewhat below its neutral level—that is, the level that is neither expansionary nor contractionary and keeps the economy operating on an even keel.",CHAIR YELLEN.,2017-09-20 18:37:52.240000+00:00,2017-09-20 18:37:52+00:00,2017-09-20 18:38:12+00:00,1.18769,1.18718,0.0005100000000000104,2499.63,2499.129,0.5010000000002037
37,492.240,505.240,"Because the neutral rate currently appears to be quite low by historical standards, the federal funds rate would not have to rise much further to get to a neutral policy stance.",CHAIR YELLEN.,2017-09-20 18:38:12.240000+00:00,2017-09-20 18:38:12+00:00,2017-09-20 18:38:25+00:00,1.18801,1.18782,0.00018999999999991246,2499.599,2499.129,0.47000000000025466
38,505.240,520.520,"But because we also expect the neutral level of the federal funds rate to rise somewhat over time, additional gradual rate hikes are likely to be appropriate over the next few years to sustain the economic expansion.",CHAIR YELLEN.,2017-09-20 18:38:25.240000+00:00,2017-09-20 18:38:25+00:00,2017-09-20 18:38:41+00:00,1.18838,1.1881000000000002,0.00027999999999983594,2499.63,2499.599,0.03099999999994907
39,520.520,534.120,"Even so, the Committee continues to anticipate that the longer-run neutral level of the federal funds rate is likely to remain below levels that prevailed in previous decades.",CHAIR YELLEN.,2017-09-20 18:38:40.520000+00:00,2017-09-20 18:38:41+00:00,2017-09-20 18:38:54+00:00,1.18786,1.18839,-0.0005300000000001415,2498.63,2498.879,-0.24899999999979627
40,534.120,540.880,This view is consistent with participants’ projections of appropriate monetary policy.,CHAIR YELLEN.,2017-09-20 18:38:54.120000+00:00,2017-09-20 18:38:54+00:00,2017-09-20 18:39:01+00:00,1.18802,1.1878,0.000220000000000109,2498.85,2498.63,0.2199999999997999
41,540.880,557.440,"The median projection for the federal funds rate is 1.4 percent at the end of this year, 2.1 percent at the end of next year, 2.7 percent at the end of 2019, and 2.9 percent in 2020.",CHAIR YELLEN.,2017-09-20 18:39:00.880000+00:00,2017-09-20 18:39:01+00:00,2017-09-20 18:39:17+00:00,1.18792,1.18812,-0.00019999999999997797,2498.879,2498.629,0.25
42,557.440,572.280,"Compared with the projections made in June, the median path for the federal funds rate is essentially unchanged, although the median estimate of the longer-run normal value edged down to 2.8 percent.",CHAIR YELLEN.,2017-09-20 18:39:17.440000+00:00,2017-09-20 18:39:17+00:00,2017-09-20 18:39:32+00:00,1.18742,1.1877700000000002,-0.0003500000000002945,2499.379,2498.879,0.5
43,572.280,588.480,"As always, the economic outlook is highly uncertain, and participants will adjust their assessments of the appropriate path for the federal funds rate in response to changes to their economic outlooks and views of the risks to their outlooks.",CHAIR YELLEN.,2017-09-20 18:39:32.280000+00:00,2017-09-20 18:39:32+00:00,2017-09-20 18:39:48+00:00,1.18768,1.18743,0.0002500000000000835,2499.13,2499.379,-0.24899999999979627
44,588.480,592.800,Policy is not on a preset course.,CHAIR YELLEN.,2017-09-20 18:39:48.480000+00:00,2017-09-20 18:39:48+00:00,2017-09-20 18:39:53+00:00,1.18768,1.18772,-4.0000000000040004e-05,2499.38,2499.38,0.0
45,592.800,601.080,"As I noted, the Committee announced today that it will begin its balance sheet normalization program in October.",CHAIR YELLEN.,2017-09-20 18:39:52.800000+00:00,2017-09-20 18:39:53+00:00,2017-09-20 18:40:01+00:00,1.18747,1.1876600000000002,-0.0001900000000001345,2499.129,2499.35,-0.22100000000000364
46,601.080,619.480,"This program, which was described in the June addendum to result, our balance sheet will decline gradually and predictably.",CHAIR YELLEN.,2017-09-20 18:40:01.080000+00:00,2017-09-20 18:40:01+00:00,2017-09-20 18:40:19+00:00,1.18711,1.18723,-0.00011999999999989797,2498.629,2498.85,-0.22100000000000364
47,619.480,639.240,"For October through December, the decline in our securities holdings will be capped at $6 billion per month for Treasuries and $4 billion per month for agencies.",CHAIR YELLEN.,2017-09-20 18:40:19.480000+00:00,2017-09-20 18:40:19+00:00,2017-09-20 18:40:39+00:00,1.18657,1.1870200000000002,-0.0004500000000002835,2498.63,2498.849,-0.21900000000005093
48,639.240,658.400,These caps will gradually rise over the course of the following year to maximums of $30 billion per month for Treasuries and $20 billion per month for agency securities and will remain in place through the process of normalizing the size of our balance sheet.,CHAIR YELLEN.,2017-09-20 18:40:39.240000+00:00,2017-09-20 18:40:39+00:00,2017-09-20 18:40:58+00:00,1.18632,1.18652,-0.00019999999999997797,2498.63,2498.63,0.0
49,658.400,673.800,"By limiting the volume of securities that private investors will have to absorb as we reduce our holdings, the caps should guard against outsized moves in interest rates and other potential market strains.",CHAIR YELLEN.,2017-09-20 18:40:58.400000+00:00,2017-09-20 18:40:58+00:00,2017-09-20 18:41:14+00:00,1.18624,1.18632,-8.000000000008001e-05,2498.129,2498.629,-0.5
50,673.800,685.000,"Finally, as we have noted previously, changing the target range for the federal funds rate is our primary means of adjusting the stance of monetary policy.",CHAIR YELLEN.,2017-09-20 18:41:13.800000+00:00,2017-09-20 18:41:14+00:00,2017-09-20 18:41:25+00:00,1.18654,1.18642,0.00011999999999989797,2499.099,2498.349,0.75
51,685.000,692.760,Our balance sheet is not intended to be an active tool for monetary policy in normal times.,CHAIR YELLEN.,2017-09-20 18:41:25+00:00,2017-09-20 18:41:25+00:00,2017-09-20 18:41:33+00:00,1.1864,1.18656,-0.00016000000000016001,2499.13,2498.879,0.2510000000002037
52,692.760,699.080,We therefore do not plan on making adjustments to our balance sheet normalization program.,CHAIR YELLEN.,2017-09-20 18:41:32.760000+00:00,2017-09-20 18:41:33+00:00,2017-09-20 18:41:39+00:00,1.18619,1.18639,-0.00019999999999997797,2498.77,2499.13,-0.36000000000012733
53,699.080,715.800,"But, of course, as we stated in June, the Committee would be prepared to resume reinvestments if a material deterioration in the economic outlook were to warrant a sizable reduction in the federal funds rate.",CHAIR YELLEN.,2017-09-20 18:41:39.080000+00:00,2017-09-20 18:41:39+00:00,2017-09-20 18:41:56+00:00,1.18636,1.18633,2.999999999997449e-05,2499.129,2498.85,0.27899999999999636
54,715.800,716.760,Thank you.,CHAIR YELLEN.,2017-09-20 18:41:55.800000+00:00,2017-09-20 18:41:56+00:00,2017-09-20 18:41:57+00:00,1.18633,1.18637,-3.999999999981796e-05,2499.129,2499.35,-0.22100000000000364
55,716.760,718.920,I’d be happy to take your questions.,CHAIR YELLEN.,2017-09-20 18:41:56.760000+00:00,2017-09-20 18:41:57+00:00,2017-09-20 18:41:59+00:00,1.18642,1.18642,0.0,2499.35,2499.35,0.0
56,718.920,727.360,"Chris Condon, Bloomberg News.",CHRISTOPHER CONDON.,2017-09-20 18:41:58.920000+00:00,2017-09-20 18:41:59+00:00,2017-09-20 18:42:07+00:00,1.18653,1.18649,4.0000000000040004e-05,2498.85,2499.13,-0.2800000000002001
57,727.360,742.640,"Chair Yellen, there’s been extraordinary progress during your term as Chair in lowering several measures of unemployment and underemployment, and all while inflation has remained subdued.",CHRISTOPHER CONDON.,2017-09-20 18:42:07.360000+00:00,2017-09-20 18:42:07+00:00,2017-09-20 18:42:23+00:00,1.1868,1.1864,0.000400000000000178,2498.38,2498.599,-0.21900000000005093
58,742.640,745.840,"But some people are even asking, why stop there?",CHRISTOPHER CONDON.,2017-09-20 18:42:22.640000+00:00,2017-09-20 18:42:23+00:00,2017-09-20 18:42:26+00:00,1.18679,1.18673,5.999999999994898e-05,2498.38,2498.38,0.0
59,745.840,783.240,"Bill Spriggs, the chief economist at the AFL-CIO, who I think you know well, criticized the Fed last week for seeking to maintain unemployment above 4 percent, which he notes necessarily means keeping the unemployment rate among black the Fed’s preferred measure of inflation has not exceeded 3 percent in more than 25 years.",CHRISTOPHER CONDON.,2017-09-20 18:42:25.840000+00:00,2017-09-20 18:42:26+00:00,2017-09-20 18:43:03+00:00,1.18687,1.1868200000000002,4.999999999988347e-05,2498.129,2498.38,-0.2510000000002037
60,783.240,797.160,So I’m wondering how you would respond to his frustration over the Fed’s desire to continue raising rates when core inflation really shows no sign of heading above the Fed’s symmetric goal for inflation.,CHRISTOPHER CONDON.,2017-09-20 18:43:03.240000+00:00,2017-09-20 18:43:03+00:00,2017-09-20 18:43:17+00:00,1.18719,1.18686,0.00032999999999994145,2498.63,2498.129,0.5010000000002037
61,797.160,798.760,Thank you.,CHRISTOPHER CONDON.,2017-09-20 18:43:17.160000+00:00,2017-09-20 18:43:17+00:00,2017-09-20 18:43:19+00:00,1.1873600000000002,1.1873600000000002,0.0,2498.719,2498.719,0.0
62,798.760,804.240,So let me first say that employment is a very important part of our mandate.,CHAIR YELLEN.,2017-09-20 18:43:18.760000+00:00,2017-09-20 18:43:19+00:00,2017-09-20 18:43:24+00:00,1.18747,1.18751,-4.0000000000040004e-05,2498.849,2498.88,-0.03099999999994907
63,804.240,812.560,"We’re charged by Congress with trying to pursue maximum employment, and we have taken that very seriously.",CHAIR YELLEN.,2017-09-20 18:43:24.240000+00:00,2017-09-20 18:43:24+00:00,2017-09-20 18:43:33+00:00,1.1875700000000002,1.18744,0.00013000000000018552,2498.879,2498.63,0.24899999999979627
64,812.560,827.640,"I’m very pleased and heartened by the improvement we have seen in the labor market, and at 4.4 percent, the unemployment rate has really fallen to quite a low level.",CHAIR YELLEN.,2017-09-20 18:43:32.560000+00:00,2017-09-20 18:43:33+00:00,2017-09-20 18:43:48+00:00,1.18762,1.18743,0.00018999999999991246,2498.6,2498.6,0.0
65,827.640,853.480,"As that’s happened, the unemployment rates for less advantaged groups in the labor market, particularly African Americans and Hispanics, has fallen more dramatically than that for the nation as a whole, reversing the outsized increases that those groups experienced when the financial crisis and Great Recession hit.",CHAIR YELLEN.,2017-09-20 18:43:47.640000+00:00,2017-09-20 18:43:48+00:00,2017-09-20 18:44:13+00:00,1.1879,1.18772,0.00017999999999984695,2498.629,2498.849,-0.22000000000025466
66,853.480,857.680,And these are really very positive developments.,CHAIR YELLEN.,2017-09-20 18:44:13.480000+00:00,2017-09-20 18:44:13+00:00,2017-09-20 18:44:18+00:00,1.18809,1.1879700000000002,0.00011999999999989797,2499.099,2499.099,0.0
67,857.680,879.280,"So we certainly seek a strong labor market, but we have a dual mandate, which is inflation and unemployment, and we also have to be mindful of our obligation to achieve a 2 percent inflation objective over the medium term.",CHAIR YELLEN.,2017-09-20 18:44:17.680000+00:00,2017-09-20 18:44:18+00:00,2017-09-20 18:44:39+00:00,1.1880700000000002,1.18813,-5.999999999972694e-05,2499.349,2499.38,-0.03099999999994907
68,879.280,897.440,"Now, I recognize and it’s important that inflation has been running under our 2 percent objective for a number of years, and that is a concern, particularly if it were to translate into lower inflation expectations.",CHAIR YELLEN.,2017-09-20 18:44:39.280000+00:00,2017-09-20 18:44:39+00:00,2017-09-20 18:44:57+00:00,1.1880700000000002,1.18805,2.0000000000131024e-05,2499.13,2499.599,-0.46900000000005093
69,897.440,942.520,"For a number of years there were very understandable reasons for that shortfall, and they included quite a lot of slack in the labor market—which, my judgment would be, has largely disappeared—very large reductions in energy prices, and a large mystery, and I will not say that the Committee clearly understands what the causes are of that.",CHAIR YELLEN.,2017-09-20 18:44:57.440000+00:00,2017-09-20 18:44:57+00:00,2017-09-20 18:45:43+00:00,1.18857,1.1881000000000002,0.0004699999999997484,2499.88,2499.379,0.5010000000002037
70,942.520,951.240,"Now, we do, in our regular projection, show fan charts indicating the typical size of forecast errors.",CHAIR YELLEN.,2017-09-20 18:45:42.520000+00:00,2017-09-20 18:45:43+00:00,2017-09-20 18:45:51+00:00,1.1887,1.1886200000000002,7.999999999985796e-05,2500.349,2500.13,0.21900000000005093
71,951.240,969.080,"All of the variables—GDP, the unemployment rate, and inflation—are forecast by ourselves and private forecasters with errors, and so there is variation in these economic variables from year to year.",CHAIR YELLEN.,2017-09-20 18:45:51.240000+00:00,2017-09-20 18:45:51+00:00,2017-09-20 18:46:09+00:00,1.1887100000000002,1.18869,2.0000000000131024e-05,2500.13,2500.629,-0.4989999999997963
72,969.080,980.920,"I would say our judgment, as I said in the statement, is that the shortfall is not largely related to cyclical considerations.",CHAIR YELLEN.,2017-09-20 18:46:09.080000+00:00,2017-09-20 18:46:09+00:00,2017-09-20 18:46:21+00:00,1.18916,1.18883,0.00032999999999994145,2500.769,2500.599,0.169999999999618
