222,2946.720,2951.200,We are working very hard on it.,CHAIR YELLEN.,2017-09-20 19:19:06.720000+00:00,2017-09-20 19:19:07+00:00,2017-09-20 19:19:11+00:00,1.18765,1.1877,-4.999999999988347e-05,2503.099,2503.099,0.0
223,2951.200,2957.680,"Hi, thank you.",DAVID HARRISON.,2017-09-20 19:19:11.200000+00:00,2017-09-20 19:19:11+00:00,2017-09-20 19:19:18+00:00,1.18765,1.18765,0.0,2503.13,2503.099,0.03099999999994907
224,2957.680,2964.360,David Harrison with Dow Jones.,DAVID HARRISON.,2017-09-20 19:19:17.680000+00:00,2017-09-20 19:19:18+00:00,2017-09-20 19:19:24+00:00,1.1876700000000002,1.1876600000000002,1.0000000000065512e-05,2503.13,2503.13,0.0
225,2964.360,2967.480,"I’d like to follow up on the balance sheet question, if I may.",DAVID HARRISON.,2017-09-20 19:19:24.360000+00:00,2017-09-20 19:19:24+00:00,2017-09-20 19:19:27+00:00,1.18765,1.18765,0.0,2503.13,2503.13,0.0
226,2967.480,2978.920,"What specifically would it take for you to reverse the decision to wind down the balance sheet, and under what conditions would you consider adding to the balance sheet again?",DAVID HARRISON.,2017-09-20 19:19:27.480000+00:00,2017-09-20 19:19:27+00:00,2017-09-20 19:19:39+00:00,1.18763,1.18769,-5.999999999994898e-05,2503.099,2503.099,0.0
227,2978.920,2992.600,"And separately, as a follow-up to that, looking more broadly, how do you think history will judge the effectiveness of your asset purchases and the conditions under which that policy should be used?",DAVID HARRISON.,2017-09-20 19:19:38.920000+00:00,2017-09-20 19:19:39+00:00,2017-09-20 19:19:53+00:00,1.18763,1.18765,-2.0000000000131024e-05,2503.38,2503.099,0.28099999999994907
228,2992.600,2995.640,Thank you.,DAVID HARRISON.,2017-09-20 19:19:52.600000+00:00,2017-09-20 19:19:53+00:00,2017-09-20 19:19:56+00:00,1.18765,1.1876600000000002,-1.0000000000065512e-05,2503.38,2503.38,0.0
229,2995.640,3040.720,"So, starting with the last part of the question, I mean, my own judgment, based on my experience and the economic research that has tried to estimate the effectiveness of our balance sheet actions starting in 2008 and has also looked at the similar balance sheet actions in other parts of the world, including the euro area, is that these actions were successful in making financial conditions more accommodative and, I believe, in stimulating a faster recovery than we otherwise would have had.",CHAIR YELLEN.,2017-09-20 19:19:55.640000+00:00,2017-09-20 19:19:56+00:00,2017-09-20 19:20:41+00:00,1.18755,1.1876600000000002,-0.0001100000000000545,2503.38,2503.38,0.0
230,3040.720,3058.280,A recent Fed working paper estimated that the full set of balance sheet actions that we took during the crisis may have lowered long-term interest rates by about 100 basis points.,CHAIR YELLEN.,2017-09-20 19:20:40.720000+00:00,2017-09-20 19:20:41+00:00,2017-09-20 19:20:58+00:00,1.18745,1.18754,-9.000000000014552e-05,2503.35,2503.38,-0.03000000000020009
231,3058.280,3068.600,"Obviously, there are different—there are different estimates around—of what difference it made, but I would say that it’s effective.",CHAIR YELLEN.,2017-09-20 19:20:58.280000+00:00,2017-09-20 19:20:58+00:00,2017-09-20 19:21:09+00:00,1.1875,1.18745,5.0000000000105516e-05,2503.35,2503.35,0.0
232,3068.600,3088.360,"It will be up to future policymakers to decide, in the event of a severe downturn, whether they think it’s appropriate to again resort to balance sheet—to adding assets to a balance sheet.",CHAIR YELLEN.,2017-09-20 19:21:08.600000+00:00,2017-09-20 19:21:09+00:00,2017-09-20 19:21:28+00:00,1.1875700000000002,1.1875,7.000000000023654e-05,2503.38,2503.35,0.03000000000020009
233,3088.360,3144.720,"I would say that if economists are correct that we’re living in a world where the level of neutral bear out to be correct, but it is a view that many people adhere to when there is evidence of it—then future policymakers will be faced with the question of, in the event of a severe downturn where they’re not able to provide as much stimulus as they would ideally like by cutting overnight interest rates, what other actions are available to them?",CHAIR YELLEN.,2017-09-20 19:21:28.360000+00:00,2017-09-20 19:21:28+00:00,2017-09-20 19:22:25+00:00,1.18761,1.18763,-1.999999999990898e-05,2503.88,2503.599,0.28099999999994907
234,3144.720,3158.720,"And during the crisis, we bought longer-term assets and used forward guidance, and for my own part, I would want to keep those things in the toolkit as being available.",CHAIR YELLEN.,2017-09-20 19:22:24.720000+00:00,2017-09-20 19:22:25+00:00,2017-09-20 19:22:39+00:00,1.18748,1.18765,-0.00017000000000000348,2504.13,2503.88,0.25
235,3158.720,3187.480,"It will be up to future policymakers to decide how to rank those, or whether or not there might be other options that are available to them, but I don’t think this issue will go away, although perhaps it’s only—well, this could well be a decision that future policymakers will have to face in the event of a significant asset—economic shock.",CHAIR YELLEN.,2017-09-20 19:22:38.720000+00:00,2017-09-20 19:22:39+00:00,2017-09-20 19:23:07+00:00,1.1873,1.18748,-0.000180000000000069,2504.1,2504.13,-0.03000000000020009
236,3187.480,3234.920,"I mean, you asked me what would it take for us to resume reinvestment, and I can’t really say much more than we said in the guidance that we provided, which is that if there is a material deterioration in the economic outlook and we thought we might be faced with a situation where we would need to substantially cut the federal funds rate and could be limited by the so-called zero lower bound, it is that type of determination that our Committee is saying would—might lead us to resume reinvestment.",CHAIR YELLEN.,2017-09-20 19:23:07.480000+00:00,2017-09-20 19:23:07+00:00,2017-09-20 19:23:55+00:00,1.18753,1.18734,0.00018999999999991246,2503.63,2504.129,-0.4989999999997963
237,3234.920,3247.280,"So that’s—our Committee has been unanimous in affirming this statement of intentions, so, you know, I think that’s where our Committee stands.",CHAIR YELLEN.,2017-09-20 19:23:54.920000+00:00,2017-09-20 19:23:55+00:00,2017-09-20 19:24:07+00:00,1.18742,1.18753,-0.0001100000000000545,2503.629,2503.63,-0.0010000000002037268
238,3247.280,3266.440,"So that is a somewhat high bar to resume reinvestments, and that’s why, in answering previous questions, I would say, well, you know, if there’s some small, negative shock, our first tool—our most important and reliable tool—will be the federal funds rate.",CHAIR YELLEN.,2017-09-20 19:24:07.280000+00:00,2017-09-20 19:24:07+00:00,2017-09-20 19:24:26+00:00,1.1875700000000002,1.18741,0.00016000000000016001,2503.63,2503.629,0.0010000000002037268
239,3266.440,3296.480,"But if there is a significant shock that’s a material the Financial Stability Oversight Council for a few years now, and I was wondering if you had any thoughts on whether the designation process for Systemically Important Financial Institutions should be changed or improved in any way.",CHAIR YELLEN.,2017-09-20 19:24:26.440000+00:00,2017-09-20 19:24:26+00:00,2017-09-20 19:24:56+00:00,1.18759,1.1875700000000002,1.9999999999686935e-05,2503.6,2503.63,-0.03000000000020009
240,3296.480,3311.360,"And a somewhat separate, but related, question:  The situation with Equifax—I was wondering if there’s anything related to that that might raise systemic issues that FSOC would need to discuss.",CHAIR YELLEN.,2017-09-20 19:24:56.480000+00:00,2017-09-20 19:24:56+00:00,2017-09-20 19:25:11+00:00,1.18763,1.18761,1.999999999990898e-05,2503.629,2503.6,0.028999999999996362
241,3311.360,3318.000,So you asked first about the designation process.,CHAIR YELLEN.,2017-09-20 19:25:11.360000+00:00,2017-09-20 19:25:11+00:00,2017-09-20 19:25:18+00:00,1.1876700000000002,1.18764,3.0000000000196536e-05,2503.599,2503.629,-0.02999999999974534
242,3318.000,3330.320,"So during the time that I’ve been on the FSOC, only one firm was—several firms were designated before I participated.",CHAIR YELLEN.,2017-09-20 19:25:18+00:00,2017-09-20 19:25:18+00:00,2017-09-20 19:25:30+00:00,1.18764,1.18763,1.0000000000065512e-05,2503.38,2503.38,0.0
243,3330.320,3338.840,"MetLife was designated during the time that I was there, and I have seen how the designation process works.",CHAIR YELLEN.,2017-09-20 19:25:30.320000+00:00,2017-09-20 19:25:30+00:00,2017-09-20 19:25:39+00:00,1.1876600000000002,1.1876700000000002,-1.0000000000065512e-05,2503.629,2503.629,0.0
244,3338.840,3344.280,I do think designation is important.,CHAIR YELLEN.,2017-09-20 19:25:38.840000+00:00,2017-09-20 19:25:39+00:00,2017-09-20 19:25:44+00:00,1.18764,1.18764,0.0,2503.6,2503.629,-0.028999999999996362
245,3344.280,3364.560,We saw during the financial crisis that some systemically important nonbanking organizations like Lehman and AIG—that their distress produced broad systemic consequences that were adverse for the U.S. economy.,CHAIR YELLEN.,2017-09-20 19:25:44.280000+00:00,2017-09-20 19:25:44+00:00,2017-09-20 19:26:05+00:00,1.18762,1.18764,-2.0000000000131024e-05,2503.6,2503.38,0.2199999999997999
246,3364.560,3388.600,"And having the ability to designate firms when the FSOC makes the determination that their distress or failure could have systemic repercussions, I believe that’s an important—that’s an important policy tool for FSOC to have available.",CHAIR YELLEN.,2017-09-20 19:26:04.560000+00:00,2017-09-20 19:26:05+00:00,2017-09-20 19:26:29+00:00,1.18763,1.18763,0.0,2503.6,2503.6,0.0
247,3388.600,3403.400,"Now, it’s not meant to be a one-way street, in the sense that a firm that’s designated—the procedures require annual reviews.",CHAIR YELLEN.,2017-09-20 19:26:28.600000+00:00,2017-09-20 19:26:29+00:00,2017-09-20 19:26:43+00:00,1.18763,1.18762,1.0000000000065512e-05,2503.629,2503.6,0.028999999999996362
248,3403.400,3429.600,"Firms may change their business models or just how they conduct their business, and we should welcome de-designation of firms if their business model is changed in a way that leads us to believe that their failure or distress would no longer be systemically important and those are decisions that we make every year.",CHAIR YELLEN.,2017-09-20 19:26:43.400000+00:00,2017-09-20 19:26:43+00:00,2017-09-20 19:27:10+00:00,1.18781,1.18763,0.000180000000000069,2503.379,2503.629,-0.25
249,3429.600,3433.040,"So, you know, I’m satisfied with that process so far.",CHAIR YELLEN.,2017-09-20 19:27:09.600000+00:00,2017-09-20 19:27:10+00:00,2017-09-20 19:27:13+00:00,1.18782,1.18781,1.0000000000065512e-05,2503.379,2503.379,0.0
250,3433.040,3451.520,"GE Capital dramatically changed its you know, glad to consider them as, you know, part of the FSOC process, but I think it’s been important and basically working.",CHAIR YELLEN.,2017-09-20 19:27:13.040000+00:00,2017-09-20 19:27:13+00:00,2017-09-20 19:27:32+00:00,1.18782,1.18781,1.0000000000065512e-05,2503.629,2503.379,0.25
251,3451.520,3463.760,"You asked about Equifax and, you know, of course that is a very serious data breach.",CHAIR YELLEN.,2017-09-20 19:27:31.520000+00:00,2017-09-20 19:27:32+00:00,2017-09-20 19:27:44+00:00,1.18796,1.18788,7.999999999985796e-05,2503.35,2503.629,-0.27899999999999636
252,3463.760,3475.280,We would really urge consumers now to be very careful in monitoring their credit reports and financial situation.,CHAIR YELLEN.,2017-09-20 19:27:43.760000+00:00,2017-09-20 19:27:44+00:00,2017-09-20 19:27:55+00:00,1.1882,1.18798,0.00021999999999988695,2503.379,2503.35,0.028999999999996362
253,3475.280,3506.720,"And, through our supervision, we’re working with the banks that we supervise to make sure that they take appropriate actions with respect to their business processes in light of the fact that there could be breaches or fraudulent transactions or information that they received that they might use—for example, in credit determinations—could be contaminated by bad data.",CHAIR YELLEN.,2017-09-20 19:27:55.280000+00:00,2017-09-20 19:27:55+00:00,2017-09-20 19:28:27+00:00,1.18783,1.18824,-0.00041000000000002146,2503.63,2503.379,0.2510000000002037
254,3506.720,3524.240,"More generally, it points to the importance of strong cybersecurity controls and attention to cybersecurity risks, which we do see as one of the most significant risks to the financial sector.",CHAIR YELLEN.,2017-09-20 19:28:26.720000+00:00,2017-09-20 19:28:27+00:00,2017-09-20 19:28:44+00:00,1.1878,1.18785,-5.0000000000105516e-05,2503.379,2503.63,-0.2510000000002037
255,3524.240,3532.720,And we are very focused in our banking supervision in making sure that banks have appropriate controls in place.,CHAIR YELLEN.,2017-09-20 19:28:44.240000+00:00,2017-09-20 19:28:44+00:00,2017-09-20 19:28:53+00:00,1.18778,1.1877700000000002,9.999999999843467e-06,2503.63,2503.63,0.0
256,3532.720,3540.680,"And the Equifax breach, I think, highlights the importance of that.",CHAIR YELLEN.,2017-09-20 19:28:52.720000+00:00,2017-09-20 19:28:53+00:00,2017-09-20 19:29:01+00:00,1.1877700000000002,1.1877700000000002,0.0,2503.63,2503.63,0.0
257,3540.680,3543.720,Michael McKee from Bloomberg Television and Radio.,MICHAEL MCKEE.,2017-09-20 19:29:00.680000+00:00,2017-09-20 19:29:01+00:00,2017-09-20 19:29:04+00:00,1.18776,1.18776,0.0,2503.63,2503.63,0.0
258,3543.720,3549.240,"We’ve talked a lot today about what you’re going to do and what you may do, but not necessarily about why.",MICHAEL MCKEE.,2017-09-20 19:29:03.720000+00:00,2017-09-20 19:29:04+00:00,2017-09-20 19:29:09+00:00,1.1876600000000002,1.1876600000000002,0.0,2503.629,2503.629,0.0
259,3549.240,3555.400,"With four rate increases behind you, financial conditions are looser than before you began.",MICHAEL MCKEE.,2017-09-20 19:29:09.240000+00:00,2017-09-20 19:29:09+00:00,2017-09-20 19:29:15+00:00,1.18791,1.18773,0.000180000000000069,2503.629,2503.629,0.0
260,3555.400,3572.600,"And I’m wondering if that bothers you, if you’re concerned about overstimulating the economy, or if you feel inflation could break out much more quickly than we have seen, or if you feel there’s a financial stability question because stocks, bonds, and real estate are all so expensive now.",MICHAEL MCKEE.,2017-09-20 19:29:15.400000+00:00,2017-09-20 19:29:15+00:00,2017-09-20 19:29:33+00:00,1.18792,1.18793,-9.999999999843467e-06,2503.599,2503.629,-0.02999999999974534
261,3572.600,3593.000,"How would you explain what the Fed is doing, why the Fed is doing it, to the American about rates and today about our balance sheet are ones we’ve taken because we feel the U.S. economy is performing well.",MICHAEL MCKEE.,2017-09-20 19:29:32.600000+00:00,2017-09-20 19:29:33+00:00,2017-09-20 19:29:53+00:00,1.1880000000000002,1.18791,9.000000000014552e-05,2503.599,2503.599,0.0
262,3593.000,3606.080,We are working down our balance sheet because we feel that’s stimulus that in some sense is no longer needed.,MICHAEL MCKEE.,2017-09-20 19:29:53+00:00,2017-09-20 19:29:53+00:00,2017-09-20 19:30:06+00:00,1.18792,1.18808,-0.00015999999999993797,2504.129,2503.88,0.24899999999979627
263,3606.080,3612.160,"So the basic message here is, U.S. economic performance has been good.",MICHAEL MCKEE.,2017-09-20 19:30:06.080000+00:00,2017-09-20 19:30:06+00:00,2017-09-20 19:30:12+00:00,1.18792,1.18788,4.0000000000040004e-05,2504.099,2504.13,-0.03099999999994907
264,3612.160,3616.600,The labor market has strengthened substantially.,MICHAEL MCKEE.,2017-09-20 19:30:12.160000+00:00,2017-09-20 19:30:12+00:00,2017-09-20 19:30:17+00:00,1.18796,1.18792,3.999999999981796e-05,2504.1,2504.099,0.0009999999997489795
265,3616.600,3651.400,"Every measure of the labor market, whether it’s the narrow unemployment rate, the broader unemployment rate, the number of people working in part-time jobs who want full-time work, the level of job openings, the quit rate, the difficulty that firms are facing in hiring workers, the level of confidence we see in surveys about the labor market—all of that is pointing to vast and continuing improvement in the labor market.",MICHAEL MCKEE.,2017-09-20 19:30:16.600000+00:00,2017-09-20 19:30:17+00:00,2017-09-20 19:30:51+00:00,1.18784,1.18795,-0.0001100000000000545,2504.13,2504.1,0.03000000000020009
266,3651.400,3670.040,"And we see sufficient strength in the economy, in terms of spending—that growth, with its ups and downs, but nevertheless is strong enough—looks to be strong enough in the medium term to support ongoing improvement in the labor market.",MICHAEL MCKEE.,2017-09-20 19:30:51.400000+00:00,2017-09-20 19:30:51+00:00,2017-09-20 19:31:10+00:00,1.18798,1.18785,0.00012999999999996348,2504.879,2504.13,0.7489999999997963
267,3670.040,3687.080,"And all of that is good, and I think that the American people should feel the steps we’re taking to normalize monetary policy are ones that we feel are well justified, given the very substantial progress we’ve seen in the economy.",MICHAEL MCKEE.,2017-09-20 19:31:10.040000+00:00,2017-09-20 19:31:10+00:00,2017-09-20 19:31:27+00:00,1.1881000000000002,1.1880000000000002,9.999999999998899e-05,2504.6,2504.849,-0.24900000000025102
268,3687.080,3696.600,"Now, inflation is running below where we want it to be, and we’ve talked about that a lot during this—the last hour.",MICHAEL MCKEE.,2017-09-20 19:31:27.080000+00:00,2017-09-20 19:31:27+00:00,2017-09-20 19:31:37+00:00,1.18823,1.18814,8.999999999992347e-05,2504.6,2504.38,0.2199999999997999
269,3696.600,3727.840,"This past year, where it’s not clear what the reasons are—I think it’s not been mysterious in the past, but, one way or another, we have had four or five years in which inflation is running below our 2 percent objective, and we are also committed to achieving that.",MICHAEL MCKEE.,2017-09-20 19:31:36.600000+00:00,2017-09-20 19:31:37+00:00,2017-09-20 19:32:08+00:00,1.1882,1.1883,-9.999999999998899e-05,2504.13,2504.6,-0.4699999999997999
270,3727.840,3745.360,So the monetary policy path that we follow and the paths that my colleagues are writing down in market on a sustainable basis.,MICHAEL MCKEE.,2017-09-20 19:32:07.840000+00:00,2017-09-20 19:32:08+00:00,2017-09-20 19:32:25+00:00,1.18821,1.18819,1.999999999990898e-05,2504.379,2504.1,0.27899999999999636
271,3745.360,3752.320,"And in making these judgments about the path of policy, we have to balance various risks.",MICHAEL MCKEE.,2017-09-20 19:32:25.360000+00:00,2017-09-20 19:32:25+00:00,2017-09-20 19:32:32+00:00,1.18822,1.18821,1.0000000000065512e-05,2504.38,2504.38,0.0
272,3752.320,3767.760,"One risk is that if we tighten policy too quickly, we may find out that, although we don’t think this now, that the inflation shortfall is something that’s going to be persistent.",MICHAEL MCKEE.,2017-09-20 19:32:32.320000+00:00,2017-09-20 19:32:32+00:00,2017-09-20 19:32:48+00:00,1.18845,1.1882700000000002,0.00017999999999984695,2504.599,2504.38,0.21900000000005093
273,3767.760,3783.400,"And if we tighten too quickly, we could undermine inflation performance—leave it at too low a level—inflation expectations could fall, and that could become ingrained, and that would be dangerous.",MICHAEL MCKEE.,2017-09-20 19:32:47.760000+00:00,2017-09-20 19:32:48+00:00,2017-09-20 19:33:03+00:00,1.18893,1.18843,0.0004999999999999449,2504.6,2504.629,-0.028999999999996362
274,3783.400,3790.200,And so that’s a reason to be cautious about raising interest rates when inflation is as low as it is.,MICHAEL MCKEE.,2017-09-20 19:33:03.400000+00:00,2017-09-20 19:33:03+00:00,2017-09-20 19:33:10+00:00,1.18925,1.18898,0.00026999999999999247,2504.629,2504.879,-0.25
275,3790.200,3795.480,"But, on the other hand, we have a strong labor market and a low unemployment rate.",MICHAEL MCKEE.,2017-09-20 19:33:10.200000+00:00,2017-09-20 19:33:10+00:00,2017-09-20 19:33:15+00:00,1.18917,1.1891200000000002,4.999999999988347e-05,2504.88,2504.849,0.03099999999994907
276,3795.480,3825.400,"And although the pace of job gains is not quite as strong this year as, for example, as it was in 2016, we’re still averaging 175,000 jobs a month this year, which is quite a bit above the pace of maybe 100 to 120,000 that would be consistent with a stable unemployment rate if labor force participation begins to move down in the manner we expect.",MICHAEL MCKEE.,2017-09-20 19:33:15.480000+00:00,2017-09-20 19:33:15+00:00,2017-09-20 19:33:45+00:00,1.18897,1.18931,-0.00034000000000000696,2505.17,2505.129,0.04100000000016735
277,3825.400,3846.920,"So if we don’t do anything to remove policy accommodation, and the labor market tightens and just continues to tighten, as you mentioned, arguably—we could, you know—arguably, financial conditions overall haven’t tightened that much.",MICHAEL MCKEE.,2017-09-20 19:33:45.400000+00:00,2017-09-20 19:33:45+00:00,2017-09-20 19:34:07+00:00,1.1891,1.189,9.999999999998899e-05,2505.38,2505.629,-0.24899999999979627
278,3846.920,3854.120,"We think the economy could overheat, inflation could rise more quickly and above our objective.",MICHAEL MCKEE.,2017-09-20 19:34:06.920000+00:00,2017-09-20 19:34:07+00:00,2017-09-20 19:34:14+00:00,1.18925,1.1891200000000002,0.00012999999999974143,2505.38,2505.38,0.0
279,3854.120,3866.400,"That’s something that would occur with a lag, and that would force us later on to tighten policy more rapidly than would be ideal, and we could risk a recession if we did that.",MICHAEL MCKEE.,2017-09-20 19:34:14.120000+00:00,2017-09-20 19:34:14+00:00,2017-09-20 19:34:26+00:00,1.18951,1.18938,0.00012999999999996348,2505.38,2505.629,-0.24899999999979627
280,3866.400,3900.320,"So there are risks on both sides to our objectives, and most of my colleagues and I have concluded that a gradual path of rate increases—while constantly watching incoming data, being open to revising our views on the outlook, and revising our expectations about policy—is the",MICHAEL MCKEE.,2017-09-20 19:34:26.400000+00:00,2017-09-20 19:34:26+00:00,,,1.1894600000000002,,,2505.38,
