,Sentences,Speaker
0,Good afternoon.,CHAIRMAN POWELL.
1,Thanks very much for being here.,CHAIRMAN POWELL.
2,"I know that a number of you will want to talk about the details of our announcement today, and I am happy to do that in a few minutes.",CHAIRMAN POWELL.
3,"But because monetary policy affects everyone, I want to start with a plain-English summary of how the economy is doing, what my colleagues and I at the Federal Reserve are trying to do, and why.",CHAIRMAN POWELL.
4,The main takeaway is that the economy is doing very well.,CHAIRMAN POWELL.
5,"Most people who want to find jobs are finding them, and unemployment and inflation are low.",CHAIRMAN POWELL.
6,Interest rates have been low for some years while the economy has been recovering from the financial crisis.,CHAIRMAN POWELL.
7,"For the past few years, we have been gradually raising interest rates, and along the way we’ve tried to explain the reasoning behind our decisions.",CHAIRMAN POWELL.
8,"In particular, we think that gradually returning interest rates to a more normal level as the economy strengthens is the best way the Fed can help sustain an environment in which American households and businesses can thrive.",CHAIRMAN POWELL.
9,"Today, we’ve taken another step in that process by raising our target range for the federal funds rate by ¼ of a percentage point.",CHAIRMAN POWELL.
10,My colleagues and I meet eight times a year and take a fresh look each time at what is happening in the economy and consider whether our policy needs adjusting.,CHAIRMAN POWELL.
11,"We don’t put our interest rate decisions on hold or on autopilot, because the economy can always evolve in unexpected ways.",CHAIRMAN POWELL.
12,History has shown that moving interest rates either too quickly or too slowly can lead to bad economic outcomes.,CHAIRMAN POWELL.
13,We think the outcomes are likely to be better overall if we are as clear as possible about what we are likely to do and why.,CHAIRMAN POWELL.
14,"To that end, we try to give a sense of our expectations for how the economy will evolve and how our policy stance may change.",CHAIRMAN POWELL.
15,"As Chairman, I hope to foster a public conversation about what the Fed is doing to support a strong and resilient economy.",CHAIRMAN POWELL.
16,And one practical step in doing so is to have a press conference like this after every one of our scheduled FOMC meetings.,CHAIRMAN POWELL.
17,And we’re going to do that beginning in January.,CHAIRMAN POWELL.
18,That will give us more opportunities to explain our actions and to answer your questions.,CHAIRMAN POWELL.
19,I want to point out that having twice as many press conferences does not signal anything about the timing or pace of future interest rate changes.,CHAIRMAN POWELL.
20,This change is only about improving communications.,CHAIRMAN POWELL.
21,My FOMC colleagues and I will also continue to issue our economic projections on the existing quarterly schedule.,CHAIRMAN POWELL.
22,"Now, let me go into more detail over developments in the economy, our economic projections, and our policy decision.",CHAIRMAN POWELL.
23,"Economic growth appears to have picked up in the current quarter, largely reflecting a bounceback in household spending.",CHAIRMAN POWELL.
24,"Business investment continues to grow strongly, and the overall outlook for growth remains favorable.",CHAIRMAN POWELL.
25,"Several factors support this assessment:  Fiscal policy is boosting the economy, ongoing job gains are raising incomes and confidence, foreign economies continue to expand, and overall financial conditions remain accommodative.",CHAIRMAN POWELL.
26,These observations are consistent with the projections that Committee participants submitted for this meeting.,CHAIRMAN POWELL.
27,"The median projection for the growth of real GDP is 2.8 percent this year, 2.4 percent next year, and 2 percent in 2020.",CHAIRMAN POWELL.
28,"Compared with the projections made in March, this median growth path is little changed.",CHAIRMAN POWELL.
29,"In the labor market, job gains averaged 180,000 per month over the past three months, well above the pace needed in the longer run to provide jobs for new entrants into the workforce.",CHAIRMAN POWELL.
30,"The unemployment rate declined over the past two months and stood at 3.8 percent in May, its lowest level in nearly two decades.",CHAIRMAN POWELL.
31,"Meanwhile, the labor force participation rate has been roughly unchanged since late 2013.",CHAIRMAN POWELL.
32,"That is a positive sign, given that the aging of our population is putting downward pressure on the participation rate.",CHAIRMAN POWELL.
33,And we expect the job market to remain strong.,CHAIRMAN POWELL.
34,"As you can see in our Summary of Economic Projections, the median of Committee participants’ projections for the unemployment rate stands at 3.6 percent in the fourth quarter of this year and runs at 3.5 percent over the next two years, a percentage point below the median estimate of its longer-run normal rate.",CHAIRMAN POWELL.
35,This median path is just a bit lower than that from March.,CHAIRMAN POWELL.
36,"After many years of running below our 2 percent longer-run objective, inflation has recently moved close to that level.",CHAIRMAN POWELL.
37,"Indeed, overall consumer prices, as measured by the price index for personal consumption expenditures, increased 2 percent over the 12 months ending in April.",CHAIRMAN POWELL.
38,"The core PCE index, which excludes prices of energy and food and tends to be a better indicator of future inflation, rose 1.8 percent over the same period.",CHAIRMAN POWELL.
39,"As we had expected, inflation moved up as the unusually low readings from last March dropped out of the calculation.",CHAIRMAN POWELL.
40,"The recent inflation data have been encouraging, but after many years of inflation below our objective, we do not want to declare victory.",CHAIRMAN POWELL.
41,We want to ensure that inflation remains near our symmetric 2 percent longer-run goal on a sustained basis.,CHAIRMAN POWELL.
42,"As we note in our Statement of Longer-Run Goals and Monetary Policy Strategy, the Committee would be concerned if inflation were running persistently above or below our 2 percent objective.",CHAIRMAN POWELL.
43,"Of course, many factors affect inflation—some temporary and others more lasting—and at any given time inflation may be above or below 2 percent.",CHAIRMAN POWELL.
44,"For example, the recent rise in oil prices will likely push inflation somewhat above 2 percent in coming months.",CHAIRMAN POWELL.
45,"But that transitory development should have little, if any, consequence for inflation over the next few years.",CHAIRMAN POWELL.
46,The median of participants’ projections for inflation runs at 2.1 percent through 2020.,CHAIRMAN POWELL.
47,"Relative to the March projections, the median inflation projection is a little higher this year and next.",CHAIRMAN POWELL.
48,"As I mentioned, today we took another step in gradually scaling back monetary policy accommodation by raising the target range for the federal funds rate by ¼ percentage point, bringing it to 1¾ to 2 percent.",CHAIRMAN POWELL.
49,"We also made some changes to our policy statement, reflecting that policy normalization is proceeding broadly as we have expected.",CHAIRMAN POWELL.
50,None of these changes signals a change in our policy views.,CHAIRMAN POWELL.
51,"For example, we removed the language stating that “the federal funds rate is likely to remain, for some time, below levels that are expected to prevail in the longer run.”  Since we introduced that language a few years ago, the economy has strengthened, and the Committee has raised the federal funds rate from near 0 to 1¾ to 2 percent.",CHAIRMAN POWELL.
52,"As we continue to note in our statement, we expect to make further gradual increases in that rate.",CHAIRMAN POWELL.
53,"As a result, if the economy evolves broadly as we anticipate, the federal funds rate will, over the next year or so, move well within the range of estimates of the normal long-run level.",CHAIRMAN POWELL.
54,"Therefore, we thought that now is an appropriate time to remove this forward guidance from our policy statement.",CHAIRMAN POWELL.
55,"We continue to believe that a gradual approach for increasing the federal funds rate will best promote a sustained expansion of economic activity, strong labor market conditions, and inflation near our symmetric 2 percent goal.",CHAIRMAN POWELL.
56,"We are aware that raising rates too slowly might raise the risk that monetary policy would need to tighten abruptly down the road in response to an unexpectedly sharp increase in inflation or financial excesses, jeopardizing the economic expansion.",CHAIRMAN POWELL.
57,"Conversely, if we raise interest rates too rapidly, the economy could weaken, and inflation could continue to run persistently below our objective.",CHAIRMAN POWELL.
58,The Committee’s gradual approach is reflected in participants’ projections for the appropriate path for the federal funds rate.,CHAIRMAN POWELL.
59,"The median projection for the federal funds rate is 2.4 percent at the end of this year, 3.1 percent at the end of 2019, and 3.4 percent at the end of 2020.",CHAIRMAN POWELL.
60,"By 2020, the median federal funds rate is modestly above its estimated longer-run level.",CHAIRMAN POWELL.
61,These projections are very similar to those made in March.,CHAIRMAN POWELL.
62,"Although the median federal funds rate edged up this year and next, most participants did not revise their projections.",CHAIRMAN POWELL.
63,I’ll conclude by mentioning two additional matters.,CHAIRMAN POWELL.
64,"First, our program for reducing our balance sheet, which began in October, is proceeding smoothly.",CHAIRMAN POWELL.
65,"Barring a material and unexpected weakening in the outlook, this program will proceed on schedule, and our balance sheet will continue to shrink.",CHAIRMAN POWELL.
66,"As we have said, changing the target range for the federal funds rate is our primary means of adjusting the stance of monetary policy.",CHAIRMAN POWELL.
67,"And, finally, as discussed in the minutes of our May meeting, we’re making a small technical adjustment in one of our tools for implementing monetary policy.",CHAIRMAN POWELL.
68,"To keep the federal funds rate in the target range, we rely on the rate of interest on excess reserves, or the IOER rate.",CHAIRMAN POWELL.
69,"Up until now, we have set the IOER rate at the top of the target range for the federal funds rate.",CHAIRMAN POWELL.
70,"In recent months, the federal funds rate has moved up toward the IOER rate as short-term interest rates have risen more generally.",CHAIRMAN POWELL.
71,"So to move the federal funds rate closer to the middle of the target range, we are now setting the IOER rate 5 basis points below the upper end of the target range.",CHAIRMAN POWELL.
72,This minor technical adjustment has no bearing on the appropriate path for the federal funds rate or financial conditions more generally.,CHAIRMAN POWELL.
73,"Thanks for listening, and I’ll be happy to take your questions.",CHAIRMAN POWELL.
74,"Hi, Mr. Chairman.",JIM TANKERSLEY.
75,"Jim Tankersley, New York Times.",JIM TANKERSLEY.
76,I have a question about inflation and a question about growth.,JIM TANKERSLEY.
77,"On inflation, I’m curious if there’s anything that’s happened since March that has changed your assessment of the risk of inflation increases beyond what you forecast in the year to come.",JIM TANKERSLEY.
78,"And, on growth, you mentioned fiscal policy is adding to growth, and I’m curious if you could break that down a little bit further for us and say—what effects do you think the recent tax cuts are having on growth?",JIM TANKERSLEY.
79,Sure.,CHAIRMAN POWELL.
80,So since—I wouldn’t say anything has happened since March to really change the way I’m thinking about inflation or the way the Committee’s thinking about inflation.,CHAIRMAN POWELL.
81,We’ve seen inflation move very gradually up toward our 2 percent objective.,CHAIRMAN POWELL.
82,"And part of that has been just idiosyncratic things dropping out from last March, which were holding inflation—measured inflation—down.",CHAIRMAN POWELL.
83,Part of it is just that continued tightening in the labor market and the economy more broadly is pushing inflation up.,CHAIRMAN POWELL.
84,"So we continue to think, and the Committee continues to think, that we are just about at our 2 percent goal but, as I mentioned, not ready to declare victory until we sustain that over time, which we haven’t done yet.",CHAIRMAN POWELL.
85,"You also asked about fiscal policy, and there’s a range of views on the Committee and, I think more broadly, a range of views among economists generally.",CHAIRMAN POWELL.
86,"But I can say that the Committee members—Committee participants—generally believe that the fiscal changes—and that includes both the tax cuts, individual and corporate, and the spending changes—will provide meaningful support to demand, significant support to demand over the course of the next three years.",CHAIRMAN POWELL.
87,"And the question—the other question is, what about the supply side?",CHAIRMAN POWELL.
88,"So it is—it makes sense that if you lower corporate tax rates and allow faster expensing of investment, you will encourage greater investment.",CHAIRMAN POWELL.
89,That should drive productivity.,CHAIRMAN POWELL.
90,That should increase potential output.,CHAIRMAN POWELL.
91,So that really ought to happen as well.,CHAIRMAN POWELL.
92,I think the amounts and the timing of that coming in are also quite uncertain.,CHAIRMAN POWELL.
93,"There’s also the possibility that there would be more labor supply from lower individual tax rates, again, in amounts and in timing that might be more uncertain.",CHAIRMAN POWELL.
94,So that’s how the Committee generally is thinking about—about fiscal policy.,CHAIRMAN POWELL.
95,Thanks.,NICK TIMIRAOS.
96,"Nick Timiraos, the Wall Street Journal.",NICK TIMIRAOS.
97,"So the Fed is about four interest rate increases, using the projections released today, away from what might be considered a neutral fed funds rate.",NICK TIMIRAOS.
98,And I wanted to ask how you’re thinking about what to do once you get to neutral.,NICK TIMIRAOS.
99,"Under what conditions would you decide, once you get there, that it’s okay to stop raising rates?",NICK TIMIRAOS.
100,And under what conditions would you want to keep going?,NICK TIMIRAOS.
101,"So for many, many years, we’ve been far from maximum employment and stable prices, and so the need for accommodative policy has been—has been clear.",CHAIRMAN POWELL.
102,"As the economy has strengthened and as we’ve gradually raised interest rates, the question comes into view of, how much longer will you need to be accommodative?",CHAIRMAN POWELL.
103,And how will you know?,CHAIRMAN POWELL.
104,How will you know where—at what point policy will be neutral?,CHAIRMAN POWELL.
105,Neutral meaning that interest rates are neither pushing the economy up nor trying to restrain it.,CHAIRMAN POWELL.
106,So we know that we’re getting closer to that neutral level.,CHAIRMAN POWELL.
107,We don’t have an exact sense of how that will be.,CHAIRMAN POWELL.
108,"So the Committee is discussing, very actively, the questions that you raise.",CHAIRMAN POWELL.
109,"And, really, it boils down to a question of, what is appropriate policy?",CHAIRMAN POWELL.
110,"And, you know, I—you asked, how will we know?",CHAIRMAN POWELL.
111,"So I think we’ll be very carefully looking at incoming data on inflation, on financial readings, and on the labor market.",CHAIRMAN POWELL.
112,"We have to acknowledge that there are always wide uncertainty bands around the level of, for example, the natural rate of unemployment.",CHAIRMAN POWELL.
113,"But also, what is the neutral rate of interest?",CHAIRMAN POWELL.
114,What is that rate of interest that pushes neither up nor down?,CHAIRMAN POWELL.
115,So I think we—we’ll be guided by incoming data on the economy and try to keep our minds open as we move forward.,CHAIRMAN POWELL.
116,Howard Schneider with Reuters.,HOWARD SCHNEIDER.
117,"2.1 percent above target for two and a half years starts to feel like some of the alternate frameworks that have been discussed here, be it price-level targeting or trying to set expectations higher so that you hit your 2.",HOWARD SCHNEIDER.
118,"In deciding how symmetric is too symmetric, what sort of parameters are you using on that front?",HOWARD SCHNEIDER.
119,"You know, the—our target for—our medium-term objective for inflation is 2 percent PCE inflation.",CHAIRMAN POWELL.
120,"We feel that that target has served the economy well, and I’m strongly committed to it.",CHAIRMAN POWELL.
121,The Committee is strongly committed to it.,CHAIRMAN POWELL.
122,"The sort of barriers to making a material change to that would be—would be very high because, again, we think it’s fundamental, and we think it’s worked.",CHAIRMAN POWELL.
123,You asked about price-level targeting and that sort of thing.,CHAIRMAN POWELL.
124,"You know, there are some ideas that sort of take cognizance of the fact that rates are lower, we’re near the zero lower bound, and that could put downward pressure on inflation expectations if we’re going to be down at the zero lower bound and, therefore, sort of undermine the credibility of the 2 percent inflation objective.",CHAIRMAN POWELL.
125,So the idea is to have kind of a makeup.,CHAIRMAN POWELL.
126,"If you—if you’re below target for a while, you have a—you have a time of being above target.",CHAIRMAN POWELL.
127,And the idea is to enhance the credibility of that 2 percent—that 2 percent target.,CHAIRMAN POWELL.
128,This is an idea that’s been written about for many years.,CHAIRMAN POWELL.
129,It’s not something that the Committee has looked at seriously.,CHAIRMAN POWELL.
130,"I imagine we will be having discussions about it, but—not something that we have on the calendar right now.",CHAIRMAN POWELL.
131,"Well, thanks very much.",SAM FLEMING.
132,Sam Fleming from the Financial Times.,SAM FLEMING.
133,"Over the weekend, we saw some significant tensions within the G-7.",SAM FLEMING.
134,"In Canada, there is the potential, obviously, for further action against China right now and retaliatory action from major U.S. trading partners.",SAM FLEMING.
135,How big a risk do you currently see this as being to the United States economy?,SAM FLEMING.
136,And what kind of feedback are you getting in terms of corporate investment intentions?,SAM FLEMING.
137,Is there something that’s beginning to feature more prominently in your own discussions with major U.S. companies?,SAM FLEMING.
138,Thanks.,SAM FLEMING.
139,"I ought to start by saying that, you know, Congress has assigned us very important jobs and—you know, maximum employment, stable prices, we have a role in financial stability that we share with other agencies.",CHAIRMAN POWELL.
140,"Congress has very specifically given authority over trade to the executive branch, so I wouldn’t comment on any particular specific trade actions.",CHAIRMAN POWELL.
141,"I will say that we, of course, have—we have broad contacts in—among business leaders around the country.",CHAIRMAN POWELL.
142,"And the Reserve Bank presidents, in particular, have that.",CHAIRMAN POWELL.
143,And so they report in the Beige Book and then in person at the FOMC meeting.,CHAIRMAN POWELL.
144,"And they do come back and they say that concerns about changes in trade policy are arising, I think it’s fair to say, and also that you’re beginning to hear reports of companies holding off on making investments and hiring people.",CHAIRMAN POWELL.
145,So right now we don’t see that in the numbers at all.,CHAIRMAN POWELL.
146,The economy is very strong.,CHAIRMAN POWELL.
147,The labor market is strong.,CHAIRMAN POWELL.
148,Growth is strong.,CHAIRMAN POWELL.
149,We really don’t see it in the numbers.,CHAIRMAN POWELL.
150,It’s just not there.,CHAIRMAN POWELL.
151,But—so I would put it down as more of a risk.,CHAIRMAN POWELL.
152,"Steve Liesman, CNBC.",STEVE LIESMAN.
153,"Mr. Chairman, you said there’s a difference of opinion among economists, but looking at the longer-run GDP growth rates for the members of the Committee, there’s not a whole lot of difference.",STEVE LIESMAN.
154,"It’s 1.8 to 2, or 1.7 to 2.1, depending upon how you count it.",STEVE LIESMAN.
155,"Is that showing us that not a single member of the Committee—including yourself, Mr. Chairman—agrees with economists over at the White House that they can achieve long-run sustained growth rates above or at 3 percent or higher?",STEVE LIESMAN.
156,Do you believe in that?,STEVE LIESMAN.
157,"You know, first of all, that’s a—that’s a reasonable range, I think, of—it’s not that we’re all on the same number, but there are a range of views about potential growth.",CHAIRMAN POWELL.
158,And there’s so much uncertainty around this.,CHAIRMAN POWELL.
159,"You know, we don’t—the thing about fiscal policy is, you don’t have thousands of incidents to, you know, to—you don’t have big data, in a way.",CHAIRMAN POWELL.
160,You have very small data.,CHAIRMAN POWELL.
161,"You’ve got only a few instances here, so you have a lot of uncertainty around what the effects will be.",CHAIRMAN POWELL.
162,They could be large.,CHAIRMAN POWELL.
163,We hope they’re large.,CHAIRMAN POWELL.
164,"But I think our approach is going to be to watch and see and hope that, in fact, we do get significant effects to, you know, to potential growth out of the tax bill, and we’re just going to have to see.",CHAIRMAN POWELL.
165,How would you forecast it though?,STEVE LIESMAN.
166,I think we’re looking at a reasonable range of estimates and we’re putting every—different participants are putting different estimates in and we’re going to be waiting and seeing.,CHAIRMAN POWELL.
167,Donna Borak with CNN.,DONNA BORAK.
168,You said earlier that it’s still a little too early to declare victory on inflation.,DONNA BORAK.
169,I wanted to circle back on a question that was asked at the initial press conference about what—what does the Fed say in regards to the inflation target as symmetric?,DONNA BORAK.
170,"Like has the Committee given any further thought in terms of how comfortable it would be rising above—whether it goes higher than 2.1, if it reaches 2.2, 2.3, and for how long?",DONNA BORAK.
171,"And now that you’re planning to hold these regular press conferences, starting next year, how do you explain—how do you plan to explain that to the American people that inflation is not overrunning?",DONNA BORAK.
172,"You know, what we’ve said in our Statement of Longer-Run Principles and Monetary Policy Strategy is that the Committee would be concerned if inflation were to run persistently above or below 2 percent, persistently above or below 2 percent.",CHAIRMAN POWELL.
173,And that’s what we mean by symmetric.,CHAIRMAN POWELL.
174,We’re looking at it equally on either side and it’s a matter of persistent overruns.,CHAIRMAN POWELL.
175,We know that inflation is going to bounce around.,CHAIRMAN POWELL.
176,"For example, as I mentioned, later this summer there’s a good chance that headline inflation will move up above 2 percent because of oil prices.",CHAIRMAN POWELL.
177,"Things buffet inflation back and forth, but—so we acknowledge that, we understand that—and if inflation were to persistently run above or below 2 percent, then we would be using our tools to try to move inflation back in the direction of the target.",CHAIRMAN POWELL.
178,"We do understand, though, that we don’t have the ability to precisely hit that target, so we expect that inflation will be above or below.",CHAIRMAN POWELL.
179,And we just hope that that is—happens on a symmetric basis.,CHAIRMAN POWELL.
180,"Marty Crutsinger, Associated Press.",MARTIN CRUTSINGER.
181,"At this meeting, you hiked your—the funds rate, you changed the dot plot to move from 3 to 4 for this year, and you took out a sentence that you’d been using for years about how long rates might stay low.",MARTIN CRUTSINGER.
182,But you say that none of this signals a change in policy views.,MARTIN CRUTSINGER.
183,But shouldn’t we see from this combination of things that the Fed is moving to tighter policy?,MARTIN CRUTSINGER.
184,I think what you should see is that the economy is continuing to make progress.,CHAIRMAN POWELL.
185,"The economy has strengthened so much since I joined the Fed, you know, in 2012 and even over the last couple of years.",CHAIRMAN POWELL.
186,The economy is in a very different place.,CHAIRMAN POWELL.
187,We— unemployment was 10 percent at the height of the crisis.,CHAIRMAN POWELL.
188,It’s 3.8 percent now and moving lower.,CHAIRMAN POWELL.
189,So really what you—the decision you see today is another sign that the U.S. economy is in great shape.,CHAIRMAN POWELL.
190,"Growth is strong, labor markets are strong, inflation is close to target, and that’s what you’re seeing.",CHAIRMAN POWELL.
191,"For many years, as I mentioned—many years—we had interest rates held low to support economic activity.",CHAIRMAN POWELL.
192,"And it’s been clear that as we’ve gotten closer to our statutory goals, we should normalize policy, and that’s really what we’ve been consistently doing for some years now.",CHAIRMAN POWELL.
193,"Hi, Chair Powell.",HEATHER LONG.
194,Heather Long from the Washington Post.,HEATHER LONG.
195,Can you give us an update on what the FOMC thinks about wages?,HEATHER LONG.
196,Are we finally going to see that wage growth pickup this year?,HEATHER LONG.
197,"I know you’re forecasting a little bit more inflation, but is that going to translate through to wage growth?",HEATHER LONG.
198,"You know, wages have been gradually moving up.",CHAIRMAN POWELL.
