,Sentences,Speaker
416,"And, you know, I—as I mentioned earlier, we do hear from our business contacts, which are extensive in the United States, and we do report on that in the minutes, and I’ve just mentioned what those are.",CHAIRMAN POWELL.
417,There is —there is concern that trade changes could be disruptive.,CHAIRMAN POWELL.
418,"And I also—as I also mentioned, we don’t see it in the numbers yet.",CHAIRMAN POWELL.
419,We really don’t.,CHAIRMAN POWELL.
420,We see a very strong economy across a bunch of fronts.,CHAIRMAN POWELL.
421,"It hasn’t reached everyone, let’s be clear on that.",CHAIRMAN POWELL.
422,But most people who want a job can find one.,CHAIRMAN POWELL.
423,"We’re well aware that there are pockets out there of people who have not felt the recession yet, but, broadly speaking, it’s a good economy.1 STEVEN BECKNER.",CHAIRMAN POWELL.
424,"Steve Beckner, Mr. Chairman, freelance journalist reporting for NPR.",CHAIRMAN POWELL.
425,"About financial conditions, which worries you more—warnings that rising short-term rates are bringing the yield curve closer to inversion, or the fact that long rates have risen very slowly and, in fact, are nearly 20 basis points below their recent high?",CHAIRMAN POWELL.
426,How do you account for the fact that long rates have been so slow to rise?,CHAIRMAN POWELL.
427,And what does it say about the inflation outlook as well?,CHAIRMAN POWELL.
428,So let me—let me briefly mention the yield curve.,CHAIRMAN POWELL.
429,"I mean, I—the yield curve is something that people are talking about a lot, including FOMC participants.",CHAIRMAN POWELL.
430,And I—you have a range of views.,CHAIRMAN POWELL.
431,It’s something we’re going to continue to be talking about.,CHAIRMAN POWELL.
432,"It’s—but it’s only one of many things, of course, that we talk about.",CHAIRMAN POWELL.
433,"I think that that discussion is really about what is appropriate policy, and how do we think about policy as we approach the neutral rate.",CHAIRMAN POWELL.
434,How do we understand what the neutral rate is?,CHAIRMAN POWELL.
435,How do we know where it is?,CHAIRMAN POWELL.
436,And what are the consequences of being above or below it?,CHAIRMAN POWELL.
437,"That’s really what—when people are talking about the slope of the yield curve, that’s really what they’re talking about.",CHAIRMAN POWELL.
438,We know why—we know why the yield curve is flattening.,CHAIRMAN POWELL.
439,It’s because we’re raising the federal funds rate.,CHAIRMAN POWELL.
440,It makes all the sense in the world that the short end would come up.,CHAIRMAN POWELL.
441,"I think you asked—the harder question is, what’s happening with long rates?",CHAIRMAN POWELL.
442,And there are many things that move long rates around.,CHAIRMAN POWELL.
443,"Of course, there’s an embedded expectation of the path of short rates.",CHAIRMAN POWELL.
444,"There’s the term premium, which has been very low by historical standards.",CHAIRMAN POWELL.
445,And so arguments are made that a flatter yield curve has less of a signal embedded in it.,CHAIRMAN POWELL.
446,In                                                  1 Chairman Powell intended to say that there are pockets of people in the United States who have not yet experienced the economic recovery.,CHAIRMAN POWELL.
447,"addition, I think what you saw most recently that you referred to, Steve, was just risk-on, risk-off.",CHAIRMAN POWELL.
448,"In a risk-off environment, people want to own U.S. Treasuries, and you see—you know, Treasury prices go up, rates go down quite a lot.",CHAIRMAN POWELL.
449,"So—but I think ultimately, you know, what we’re—what we really care about is what’s the appropriate stance of policy.",CHAIRMAN POWELL.
450,"And there’s a—there may be a signal in that long-term rate about what is the neutral rate, and I think that’s why people are paying attention to the yield curve.",CHAIRMAN POWELL.
451,Nancy Marshall-Genzer with Marketplace.,NANCY MARSHALL-GENZER.
452,Companies are buying back their shares at a record rate.,NANCY MARSHALL-GENZER.
453,Corporate debt is up.,NANCY MARSHALL-GENZER.
454,Consumer debt is rising.,NANCY MARSHALL-GENZER.
455,Are we in a credit bubble?,NANCY MARSHALL-GENZER.
456,Is that something that you’re worried about?,NANCY MARSHALL-GENZER.
457,"So if you look at households, you do not see excess credit growth, you don’t see high levels of credit going out.",CHAIRMAN POWELL.
458,So not so much households.,CHAIRMAN POWELL.
459,"And that really was where the problems were before the financial crisis, was particularly in—among household borrowing, particularly around mortgages.",CHAIRMAN POWELL.
460,"With—if you take banks, then, of course, their leverage is significantly lower.",CHAIRMAN POWELL.
461,"Or, to say it differently, their capital is significantly higher.",CHAIRMAN POWELL.
462,"If you ask about nonfinancial corporates, that’s really where leverage is at levels that are high relative to history.",CHAIRMAN POWELL.
463,"But defaults are low, interest rates are low, you know, so it’s something—that’s something we’re watching very carefully.",CHAIRMAN POWELL.
464,"But, again, I don’t think we see it as—I think there are a range of views on that, but we are watching nonfinancial corporates.",CHAIRMAN POWELL.
465,"Households are in good shape, though, and that is—that is so important because that’s where—you know, that’s where we got into trouble before.",CHAIRMAN POWELL.
466,"And that’s—it’s often around property, and particularly housing, where you see real problems emerge.",CHAIRMAN POWELL.
467,"We don’t really see that now, so we take some solace from that.",CHAIRMAN POWELL.
468,Myles Udland with Yahoo Finance.,MYLES UDLAND.
469,"Chair Powell, you referenced a minute ago this idea of cushion, or the fact that the Fed doesn’t have as much of when rates are low and inflation is low.",MYLES UDLAND.
470,"And I’m wondering if you or the Committee has thought about your move to raise interest rates as partly responding to the economy, but partly giving yourselves room to navigate in the inevitable future recession, whenever that was to come.",MYLES UDLAND.
471,"And do you think that that has played any part in, you know, your outlook for policy or recent policy decisions?",MYLES UDLAND.
472,"Or is it, you know, just a purely based on what the economy is doing?",MYLES UDLAND.
473,So it doesn’t play any part in my thinking and I’ll tell you why.,CHAIRMAN POWELL.
474,"If you raise rates too quickly, you’re just increasing the likelihood of a recession, and that’s exactly what you don’t want to do.",CHAIRMAN POWELL.
475,"So the best thing you can do, I think—I think the incentives actually run in the other direction.",CHAIRMAN POWELL.
476,"If you’re—if you’re worried about going back to the lower bound, then risk management would suggest that you go a little slower in raising rates and tolerate—that’s likely to be a more sustainable strategy to get further away from the zero lower bound.",CHAIRMAN POWELL.
477,"I think we’re far enough away now, though, that the risks are kind of balanced.",CHAIRMAN POWELL.
478,"And so I think it’s more just—we’re just looking at the economy, and what does it need, and how do we—how do we sustain the expansion, keep the labor market strong, and try to keep inflation near 2 percent?",CHAIRMAN POWELL.
479,Mark Hamrick with Bankrate.,MARK HAMRICK.
480,You talked earlier about wage growth and your basic message to workers.,MARK HAMRICK.
481,"How confident are you that when we do see stock buybacks and the like, the workers will get whatever your view of that share is as well and the wage hikes in the near term and in the foreseeable future?",MARK HAMRICK.
482,Thank you.,MARK HAMRICK.
483,"You know, we don’t—we don’t have the tools to control that.",CHAIRMAN POWELL.
484,If companies choose to—companies in our system are free to do what they can—what they need to do once they’ve—once they’ve made profits and have cash to distribute.,CHAIRMAN POWELL.
485,"They can distribute it to their shareholders, they can buy—either through dividends or through buybacks.",CHAIRMAN POWELL.
486,They can pay their workers.,CHAIRMAN POWELL.
487,"You know, the part—and, you know, we don’t play a role in those decisions.",CHAIRMAN POWELL.
488,The part that we focus on is maximum employment.,CHAIRMAN POWELL.
489,That’s our mandate.,CHAIRMAN POWELL.
490,"So we view maximum employment as the maximum sustainable level of employment, meaning it’s not so much that it will cause the economy to overheat.",CHAIRMAN POWELL.
491,And so I think we’ve been committed to that.,CHAIRMAN POWELL.
492,I think we take that obligation very seriously.,CHAIRMAN POWELL.
493,"And, you know, over time, when—when labor markets are strong and companies are hiring, we should see higher wages.",CHAIRMAN POWELL.
494,"But, again, we don’t really have the tools that will address the distribution of profits and that kind of thing.",CHAIRMAN POWELL.
