,Sentences,Speaker
199,"Earlier in the recovery, they were—there are many different wage measures, of course, but—so just—but just to generalize, wages were running roughly around 2 percent and they’ve moved gradually up into between 2 to 3 percent as the labor market has become stronger and stronger.",CHAIRMAN POWELL.
200,"I think it’s fair to say that some of us—and I certainly would have expected wages to react more to the very significant reduction in unemployment that we’ve had, as I mentioned, from 10 percent to 3.8 percent.",CHAIRMAN POWELL.
201,"Part of that can be explained by low productivity, which is something we’ve talked about at the Committee and elsewhere.",CHAIRMAN POWELL.
202,"But, nonetheless, I think we had anticipated, and many people have anticipated, that wages—that in a world where we’re hearing lots and lots about labor shortages—everywhere we go now, we hear about labor shortages—but where is the wage reaction?",CHAIRMAN POWELL.
203,So it’s a bit of a puzzle.,CHAIRMAN POWELL.
204,"I wouldn’t say it’s a mystery, but it’s a bit of a puzzle.",CHAIRMAN POWELL.
205,"And, frankly, I do think there’s a lot to like about low unemployment.",CHAIRMAN POWELL.
206,"And one of the things is—you will see—pretty much people who want to get jobs—not everybody—but people who want to get jobs, many of them will be able to get jobs.",CHAIRMAN POWELL.
207,You will see wages go up.,CHAIRMAN POWELL.
208,"You’ll see people at the, sort of, the margins of the labor force having an opportunity to get back in work.",CHAIRMAN POWELL.
209,They benefit from that.,CHAIRMAN POWELL.
210,Society benefits from that.,CHAIRMAN POWELL.
211,"So there are a lot of things to really like, including higher wages, as you asked.",CHAIRMAN POWELL.
212,"Our role, though, is also to, you know, to make sure that—that maximum employment happens in a context of price stability and financial stability, which is why we’re gradually raising rates.",CHAIRMAN POWELL.
213,Just a follow-up on—Don Lee from the L.A. Times.,DON LEE.
214,"On both inflation and unemployment, the new projections—for unemployment lower than before and inflation higher.",DON LEE.
215,And how much is the Fed willing to accept that’s an overshoot for both of those before it affects policy?,DON LEE.
216,You mentioned that unemployment moved down and inflation moved up by truly small amounts.,CHAIRMAN POWELL.
217,"If you look at the Summary of Economic Projections, things are moving by just a tick or even a semitick between now and March.",CHAIRMAN POWELL.
218,"And you asked, you know—I mean, I think we take a longer-run view that we’re shooting for—we’re aiming for—2 percent inflation—inflation around 2 percent.",CHAIRMAN POWELL.
219,We know that it’ll be above or below.,CHAIRMAN POWELL.
220,"We’re not going to—we didn’t overreact, I think, to inflation being under 2 percent.",CHAIRMAN POWELL.
221,We won’t overreact to it being over 2 percent.,CHAIRMAN POWELL.
222,"And I think we’ll always be using our tools to move inflation in the direction of the target, if it—if it leaves—if it moves away from the target persistently, as I mentioned.",CHAIRMAN POWELL.
223,"In terms of unemployment, you know, you have to acknowledge that we are—no one really knows with certainty what the level of the natural rate of unemployment is, the rate that is sustainable over a long period of time.",CHAIRMAN POWELL.
224,"And we know that probably that rate has declined as the U.S. population has become more educated, as it has become older.",CHAIRMAN POWELL.
225,Older and more educated people have lower unemployment rates.,CHAIRMAN POWELL.
226,We don’t know this with precision.,CHAIRMAN POWELL.
227,So we have to be learning as we go.,CHAIRMAN POWELL.
228,We’ve got to be looking at data and informed by what’s coming in.,CHAIRMAN POWELL.
229,"And as I mentioned, I think at the last press conference, estimates by the—by members of the Committee have moved down by a full percentage point since maybe 2012 as we’ve learned—as unemployment has dropped and inflation hasn’t really reacted.",CHAIRMAN POWELL.
230,"So I can’t give you a precise number, but I just—you know, we will be very much informed by incoming data.",CHAIRMAN POWELL.
231,And this uncertainty is why—the fact that we live in that uncertainty is why we’ve been gradually raising rates.,CHAIRMAN POWELL.
232,We’re not waiting for inflation to show up.,CHAIRMAN POWELL.
233,"We’re going ahead and moving gradually and trying to navigate between two risks, really.",CHAIRMAN POWELL.
234,One would be moving too quickly—inflation never gets back to target if we do that.,CHAIRMAN POWELL.
235,"And the other is moving too slowly, and then we have—we have too much inflation or financial instability, and we have to raise quickly.",CHAIRMAN POWELL.
236,And that can also have bad outcomes.,CHAIRMAN POWELL.
237,"Chris Condon, Bloomberg News.",CHRISTOPHER CONDON.
238,"Mr. Chairman, I have a couple questions about the interest the Fed pays on excess reserves.",CHRISTOPHER CONDON.
239,"And you mentioned, of course, that—that the IOER was raised by the Committee 20 basis points, and that’s a result, as you said, of the upward drift of the effective fed funds rate in that target range.",CHRISTOPHER CONDON.
240,Do you think that that’s going to resolve that issue or might there be further action required by the Committee in the future to continue lowering IOER relative to the midpoint of the range?,CHRISTOPHER CONDON.
241,"And, further, was there discussion among the Committee today about what’s causing that?",CHRISTOPHER CONDON.
242,"Is it purely technical, perhaps related to bill issuance, or is it telling you something about the level of scarcity and truly excess bank reserves?",CHRISTOPHER CONDON.
243,Thank you.,CHRISTOPHER CONDON.
244,Thanks.,CHAIRMAN POWELL.
245,So I would say that—remember the important thing is that we want the federal funds rate to trade in the target range.,CHAIRMAN POWELL.
246,"That’s the whole, the whole idea.",CHAIRMAN POWELL.
247,IOER is the principal tool by which we assure that that will happen.,CHAIRMAN POWELL.
248,"And we’ve said in our, you know, basic documents that we will adjust the use of our tools, as appropriate.",CHAIRMAN POWELL.
249,"We don’t expect to have to do this often or again, but we’re not sure about that.",CHAIRMAN POWELL.
250,"If we have to do it again, we’ll do it again.",CHAIRMAN POWELL.
251,"Again, don’t expect it to happen.",CHAIRMAN POWELL.
252,You asked why.,CHAIRMAN POWELL.
253,"And yes, you know, we—of course, we’re looking carefully at that and, you know, the truth is we don’t—we don’t know with any precision.",CHAIRMAN POWELL.
254,"Really, no one does.",CHAIRMAN POWELL.
255,"It’s—you can’t run experiments, you know, with one effect and not the other.",CHAIRMAN POWELL.
256,"You know, I think there’s a lot of probability on the idea of just high bill supply leads to higher repo costs, higher money market rates generally, and the arbitrage pulls up federal funds rate towards IOER.",CHAIRMAN POWELL.
257,"We don’t know that that’s the only effect and, you know, we’re just going to have to be watching and learning.",CHAIRMAN POWELL.
258,"And, frankly, we don’t have to know today.",CHAIRMAN POWELL.
259,"What we really need is to have the federal funds rate trade in the range, and that’s what this minor technical adjustment accomplishes.",CHAIRMAN POWELL.
260,Edward Lawrence from Fox Business.,EDWARD LAWRENCE.
261,"So with the numbers that we’re looking at, you talked about more people getting jobs, the wages are increasing.",EDWARD LAWRENCE.
262,"Are we seeing a—with the fiscal policy—a fundamental shift in the economy, where we have lower natural unemployment, also possibly a lower rate of natural unemployment and lower inflation?",EDWARD LAWRENCE.
263,"Your question—your first question, really, is, do we think the natural rate of unemployment is lower?",CHAIRMAN POWELL.
264,So I think we do believe it has moved down significantly over a long period of time.,CHAIRMAN POWELL.
265,"We don’t think that the natural rate of unemployment—you know, it’s not one of those variables that moves around a lot.",CHAIRMAN POWELL.
266,"It tends to be driven by slow-moving variables, like the education level, the population, like the functioning of the labor market, and things like that.",CHAIRMAN POWELL.
267,"So, you know, it may—it may have moved down too, on a cyclical basis, lower.",CHAIRMAN POWELL.
268,"As the economy gets hotter and hotter, there’s some possibility of that.",CHAIRMAN POWELL.
269,"But, you know, the thing is, if you look back, there have been a lot of studies done and, you know, real-time estimates of the natural rate of unemployment have uncertainty bands, which are—which are quite wide, so we have to remember that and very much be guided by the—by the incoming data.",CHAIRMAN POWELL.
270,You asked about inflation.,CHAIRMAN POWELL.
271,"You know, inflation we look about—we look at the 2 percent inflation objective as something that central banks, the Fed, really control.",CHAIRMAN POWELL.
272,And we have to be strongly committed to achieving that using our tools to do that.,CHAIRMAN POWELL.
273,"I think in—in recent years the dominant force has been, you know, disinflationary—have been pushing down on inflation.",CHAIRMAN POWELL.
274,And so we’ve been pushing back up.,CHAIRMAN POWELL.
275,"Of course, all those years when we were growing up, it was the opposite.",CHAIRMAN POWELL.
276,Inflation was too high and central banks were constantly pushing down.,CHAIRMAN POWELL.
277,"It’s really important that inflation not fall below 2 percent, that inflation expectations remain well anchored at 2 percent—very important—because the implications of inflation below 2 percent are that you’re closer to the zero lower bound, meaning the Fed has less room to cut, meaning that we’ll spend more time there and we won’t be able to do the job that we’re assigned to do for our citizens.",CHAIRMAN POWELL.
278,Jeanna Smialek with Bloomberg Television.,JEANNA SMIALEK.
279,You guys moved the median unemployment forecast for 2020 down to 3.5 percent but left the longer-run at 4.5 percent today.,JEANNA SMIALEK.
280,But you’re only forecasting a moderate overshoot on the fed funds rate beyond your longer-run value.,JEANNA SMIALEK.
281,How are you going to get unemployment from 3.5 percent up to that 4.5 percent rate?,JEANNA SMIALEK.
282,"I would just—would—I would just emphasize, emphasize that—a couple things.",CHAIRMAN POWELL.
283,"First, we’re learning about the real location of the natural rate of unemployment as we go.",CHAIRMAN POWELL.
284,So it’s moved down by more than a full percentage point since 2012.,CHAIRMAN POWELL.
285,"So it’s not so simple as thinking, oh boy, we’ve just got to go ahead and get that rate up.",CHAIRMAN POWELL.
286,"If you—if you look at the forecast, two years from now, end of 2020, you’re still seeing inflation very close to target.",CHAIRMAN POWELL.
287,"So there’s no sense that inflation will—no sense in our models, or in our projections, or forecasts—that inflation will take off or move unexpectedly quickly from these levels, even if unemployment does remain low.",CHAIRMAN POWELL.
288,So that’s—that’s what—so it’s important to know that the—the unemployment rate forecasts go with the inflation forecasts and go with the rate forecasts.,CHAIRMAN POWELL.
289,"And so each person who’s submitting them is submitting accommodate—you know, appropriate monetary policy that fits with that person’s assessment.",CHAIRMAN POWELL.
290,And their assessments generally are to support maximum employment and stable prices around 2 percent.,CHAIRMAN POWELL.
291,"So if we thought that inflation were going to take off, obviously, we’d be showing higher rates, but that’s not what we think will happen.",CHAIRMAN POWELL.
292,If I could just follow up really quickly.,JEANNA SMIALEK.
293,"Then why, I guess, would the longer-run unemployment rate not be a little bit lower and closer to that 2020 number?",JEANNA SMIALEK.
294,"Yeah, it may be.",CHAIRMAN POWELL.
295,It may be.,CHAIRMAN POWELL.
296,We may find that out.,CHAIRMAN POWELL.
297,"You know, the best estimate that we have, over the longer run, is that.",CHAIRMAN POWELL.
298,"Although, you know, there’s a range of views, you know.",CHAIRMAN POWELL.
299,"Some people are in the low 4s, and, again, I said the uncertainty bands are, you know, not quite a full percentage point on either side, but ¾ of a percent, that kind of thing, so it’s very possible.",CHAIRMAN POWELL.
300,"We have to be, you know—we can’t do—we can’t be too attached to these unobservable variables.",CHAIRMAN POWELL.
301,"You know, we—I think we have to be practical about the way we think about these things and we do that by being grounded in the data and what we see happening in the real economy.",CHAIRMAN POWELL.
302,I have a couple of regulatory questions.,VICTORIA GUIDA.
303,"First of all, on the countercyclical capital buffer, I was wondering, what are the chances that the Fed is going to need to use that in the next year or two?",VICTORIA GUIDA.
304,"And then my second question is, there’s been a lot of talk lately in Congress about the ability for banks to serve marijuana businesses, and I was wondering if you think that banks should be able to serve those businesses in states where marijuana is legal.",VICTORIA GUIDA.
305,So the countercyclical capital buffer gives us the ability to raise capital requirements on the largest institutions when financial stability vulnerabilities are meaningfully above normal.,CHAIRMAN POWELL.
306,That’s the language that we’ve used.,CHAIRMAN POWELL.
307,And that’s certainly a possibility.,CHAIRMAN POWELL.
308,I wouldn’t say that—I wouldn't look at today’s financial stability landscape and say that risks are meaningfully above normal.,CHAIRMAN POWELL.
309,I would say that they’re roughly at normal.,CHAIRMAN POWELL.
310,"You have—you know, households are well—you know, are in good shape.",CHAIRMAN POWELL.
311,"They’re—they’ve paid down their debt, incomes are rising, people have jobs.",CHAIRMAN POWELL.
312,So households are not really a concern.,CHAIRMAN POWELL.
313,"And banks are highly capitalized, so that’s not really a concern.",CHAIRMAN POWELL.
314,We see—there’s some concern with asset prices in a couple of pockets.,CHAIRMAN POWELL.
315,"But overall, if you—if you bake it all in, I think we see, generally, financial vulnerabilities as moderate.",CHAIRMAN POWELL.
316,"Could that change, you asked, over a couple of years?",CHAIRMAN POWELL.
317,"Yeah, it could.",CHAIRMAN POWELL.
318,You also asked about marijuana businesses.,CHAIRMAN POWELL.
319,So this is a very difficult area because we have state law—many state laws permit the use of marijuana and federal law still doesn’t.,CHAIRMAN POWELL.
320,"So it puts, you know, federally chartered banks in a very difficult situation.",CHAIRMAN POWELL.
321,I think it would be great if that could be clarified.,CHAIRMAN POWELL.
322,"We don’t have—you know, it puts the supervisor in a very, very difficult position.",CHAIRMAN POWELL.
323,"And, of course, this isn’t our—our mandate has nothing to do with marijuana, so we don’t really—we just would love to see it clarified, I think.",CHAIRMAN POWELL.
324,"Hi, John Heltman with American Banker.",JOHN HELTMAN.
325,"So since you—since even before you were Chairman of the Fed, when you were chair of the supervisory committee, you laid out a sort of regulatory revision agenda that’s actually been pretty consistent.",JOHN HELTMAN.
326,"So there was the guidance on boards of governors, there was the—some changes to the stress tests, and—not changes to the stress test, but rather clarification on the modeling—and now, more recently, the changes to the enhanced supplemental leverage ratio.",JOHN HELTMAN.
327,"The Fed has also proposed some changes to the Volcker rule and, as I mentioned a minute ago, changes to the stress test with the stress capital buffer.",JOHN HELTMAN.
328,Are these kind of the—are there any new frontiers of regulatory changes that you are envisioning or are you just—are you kind of done for the time being?,JOHN HELTMAN.
329,Or what else can we expect from the Fed?,JOHN HELTMAN.
330,It’s actually a pretty full docket right now.,CHAIRMAN POWELL.
331,"You mentioned a number of the things, but I would—I would point out—we’re having, I guess, a public Board meeting tomorrow on the single counterparty credit limit provision.",CHAIRMAN POWELL.
332,We’ve also got quite a lot of work to promulgate rules to—after S. 2155 that Senator Crapo’s bill passed—we’ve got a lot of work to do under that.,CHAIRMAN POWELL.
333,"We’ve got to think about how we would reach below that $250 billion threshold to assess and supervise, regulate, you know, financial stability risks below that level.",CHAIRMAN POWELL.
334,So what am I missing?,CHAIRMAN POWELL.
335,"There’s—there—oh, oh, net stable funding ratio is out there to be done.",CHAIRMAN POWELL.
336,"So there’s a lot of work to do, I think.",CHAIRMAN POWELL.
337,"You know, and if I can just take this opportunity to say, you know, the financial system all but failed 10 years ago.",CHAIRMAN POWELL.
338,"We went to work for 10 years to strengthen it—stronger capital, stronger liquidity, stress testing, resolution planning.",CHAIRMAN POWELL.
339,We want to keep all that stuff.,CHAIRMAN POWELL.
340,"We want to make it, you know, even more effective and certainly more efficient.",CHAIRMAN POWELL.
341,We want to tailor those regulations for institutions.,CHAIRMAN POWELL.
342,We want the strongest provisions to apply to the most systemically important institutions.,CHAIRMAN POWELL.
343,And so we’re committed to preserving and enhancing that structure.,CHAIRMAN POWELL.
344,"But we—we’re finding a lot that we can do in the way of tailoring regulations for the smaller, less systemically important institutions, and that’s a lot of what we’re working on right now.",CHAIRMAN POWELL.
345,Thank you.,GREG ROBB.
346,You said at the beginning of your press conference that you plan to be more plainspoken.,GREG ROBB.
347,"And so, okay, I wanted to know what you would say to workers who are worried that, you know, these paths of rate hikes that you’ve laid out will kind of undercut the wage growth they are just starting to see.",GREG ROBB.
348,Thank you.,GREG ROBB.
349,"You know, I would say that the economy is in great shape.",CHAIRMAN POWELL.
350,"If you look at household surveys, confidence is high.",CHAIRMAN POWELL.
351,"Look at businesses, confidence is high.",CHAIRMAN POWELL.
352,"If you ask—if you survey workers about the job market, they’ll say that it’s a really good environment to find jobs.",CHAIRMAN POWELL.
353,"If you survey businesses, they’ll say that workers are scarce.",CHAIRMAN POWELL.
354,"So I think overall, we have—we have a really solid economy on our hands here.",CHAIRMAN POWELL.
355,"And so what we’re doing is, we are trying to conduct monetary policy in a way that will sustain that expansion, keep the labor markets strong, and keep inflation above—right at—sorry, not above, but right at 2 percent.",CHAIRMAN POWELL.
356,"That’s really what we’re trying to do and, you know, I would say I like the results so far.",CHAIRMAN POWELL.
357,"We’re—we’ve been very, very careful not to tighten too quickly.",CHAIRMAN POWELL.
358,I think we’ve been patient.,CHAIRMAN POWELL.
359,I think that patience has borne fruit and I think it continues to.,CHAIRMAN POWELL.
360,We had a lot of encouragement to go much faster and I’m really glad we didn’t.,CHAIRMAN POWELL.
361,"But, at this time, the—continuing on that gradual pace seems—continues to seem like the right thing.",CHAIRMAN POWELL.
362,"If we get a sense that the economy is reacting badly, then we’ll certainly react to that.",CHAIRMAN POWELL.
363,"Hi, David Harrison with Dow Jones Newswires.",DAVID HARRISON.
364,Where do you see the neutral interest rate is right now?,DAVID HARRISON.
365,Do you think it’s—do you see it sort of inching up because of the recent fiscal stimulus measures?,DAVID HARRISON.
366,And how will you know when we’re getting close to that neutral point?,DAVID HARRISON.
367,"So if—you know, if inflation stays around 2, it doesn’t go above 2 for a while, do you see a need to actually exceed that neutral point?",DAVID HARRISON.
368,"So I would just point you to the range of estimates at the Committee, which I think is 2¼ to 3½, and the median is 2.9, right in there.",CHAIRMAN POWELL.
369,So that’s the range of estimates of the nominal neutral rate of interest.,CHAIRMAN POWELL.
370,"And we do understand that there’s high uncertainty around the level, but that’s kind of—so you can think of 2.9 as being—which is sort of a full percentage point away from where fed funds is going to trade after today’s decision.",CHAIRMAN POWELL.
371,"You asked, is the—is the neutral rate moving up because of fiscal policy?",CHAIRMAN POWELL.
372,Yes.,CHAIRMAN POWELL.
373,"I mean, there’s—there should be an effect if you have increased deficits that should put upward pressure on, you know, a few tenths, let’s say.",CHAIRMAN POWELL.
374,"Again, though, they were estimating these things.",CHAIRMAN POWELL.
375,It’s one of these unobserved variables so it’s very hard to—we shouldn’t try to speak about it with a—with a lot of precision or confidence.,CHAIRMAN POWELL.
376,"But, yes, that should put upward pressure on it.",CHAIRMAN POWELL.
377,How will we know?,CHAIRMAN POWELL.
378,"Well, I think you have to look at inflation.",CHAIRMAN POWELL.
379,"You’ve got to look at—you’ve got to look at all of the indicators in the economy and look at inflation, look at unemployment, look at what’s happening in the job market.",CHAIRMAN POWELL.
380,And inflation is really important.,CHAIRMAN POWELL.
381,It’s worth noting that the last two business cycles didn’t end with high inflation—they ended with financial instability—so that’s something we need to also keep our eye on.,CHAIRMAN POWELL.
382,Virginie Montet with Agence France-Presse.,VIRGINIE MONTET.
383,Have you talked during the meeting about when the Fed is going to remove or change the word “accommodative” that describe the monetary policy for almost 10 years?,VIRGINIE MONTET.
384,And could this change in the vocabulary make the market nervous?,VIRGINIE MONTET.
385,And have you thought already at some options so to know how you’re going to call it down the road?,VIRGINIE MONTET.
386,"Yes, that is—that is something that we discuss.",CHAIRMAN POWELL.
387,We look at all the language.,CHAIRMAN POWELL.
388,"As you know, we made a—we made a significant number of changes at this meeting.",CHAIRMAN POWELL.
389,"So language gets in the statement and then, you know, the economy changes.",CHAIRMAN POWELL.
390,That’s what happens.,CHAIRMAN POWELL.
391,We really—our approach to policy hasn’t changed.,CHAIRMAN POWELL.
392,"And, you know, as I mentioned earlier, for a long time, the economy has needed accommodative monetary policy.",CHAIRMAN POWELL.
393,"As the economy has recovered, we’ve been gradually raising rates and we will—we will be at a place relatively soon when, again, assuming we stay on this path, when interest rates will be in the zone of what FOMC participants think is roughly neutral.",CHAIRMAN POWELL.
394,"And, at that point, it would no longer be accurate for us to say that the Committee thinks that policy is accommodative.",CHAIRMAN POWELL.
395,We know that’s coming.,CHAIRMAN POWELL.
396,"We kind of don’t think it’s here yet, but it’s certainly coming.",CHAIRMAN POWELL.
397,And I think that the market will understand that.,CHAIRMAN POWELL.
398,"I mean, the real message is that you’re getting close to the neutral rate.",CHAIRMAN POWELL.
399,It’s a characterization about where policy is.,CHAIRMAN POWELL.
400,"It’s not a statement, really, that should upset the markets.",CHAIRMAN POWELL.
401,"But, you know, we’ll obviously discuss it carefully in meetings and communicate about it.",CHAIRMAN POWELL.
402,So.,CHAIRMAN POWELL.
403,Thank you very much.,NAOATSU AOYAMA.
404,"Naoatsu Aoyama from the Asahi Shimbun, Japan’s newspaper.",NAOATSU AOYAMA.
405,"Would you expand on the—on your views on the downside risks—downside risks, especially in regard to trade issues?",NAOATSU AOYAMA.
406,Many people are—in the key allies of the United States—are concerned that the United States may destabilize the underpinnings of the international liberal order the United States has created and built up in the postwar environment.,NAOATSU AOYAMA.
407,"So—and that will, of course, have a very negative economic implications for the global economy as well as the U.S. economy.",NAOATSU AOYAMA.
408,So would you—have you—can I have your views on that?,NAOATSU AOYAMA.
409,Sure.,CHAIRMAN POWELL.
410,"So, you know, as I mentioned earlier, I’m really committed to staying in our lane on things.",CHAIRMAN POWELL.
411,"We have very important jobs assigned to us by Congress and that’s maximum employment, stable prices, financial stability.",CHAIRMAN POWELL.
412,Trade is explicitly assigned to the executive branch by Congress and not to us.,CHAIRMAN POWELL.
413,So we don’t really—we don’t really seek to play a role in trade policy.,CHAIRMAN POWELL.
414,We’re not at that table.,CHAIRMAN POWELL.
415,Those are—those powers and decisions are given to others and so we want to stick to what we do.,CHAIRMAN POWELL.
