,Sentences,Speaker
216,"Chair Powell, in 1998 the Fed eased policy in a way that some say may have avoided a recession, others say may have helped fuel the NASDAQ tech stock bubble.",NICK TIMIRAOS.
217,And financial conditions have eased considerably this year since the policy pivot that you made clear in January.,NICK TIMIRAOS.
218,"The S&P, for example, is just 3 percent below last summer’s peak.",NICK TIMIRAOS.
219,"And so, I wonder, does this episode from 20 years ago bear at all on your thinking today about the risks posed by rising asset values in an environment of a shallower policy path?",NICK TIMIRAOS.
220,"We’re in a very different world today and post-crisis, because we now very carefully monitor financial conditions and financial stability concerns on an ongoing basis, and we publish a report twice a year, and we have quarterly Board meetings and briefings where we look deeply into these things.",CHAIR POWELL.
221,So this is something we have very much on our radar screen.,CHAIR POWELL.
222,"And I would say, overall, we don’t see financial stability vulnerabilities as high.",CHAIR POWELL.
223,"There are some aspects of the financial markets that we’re carefully monitoring, and those are in the nature of things that might be amplifiers to a downturn—as opposed to a financial stability concern, which might lead to a financial crisis and that kind of thing, which we don’t see.",CHAIR POWELL.
224,So we do monitor that.,CHAIR POWELL.
225,"And I would also say, you know, that the whole question of monetary policy and financial stability is an unsettled and difficult one in our world.",CHAIR POWELL.
226,"We do think that the principal tools for, you know, for managing financial stability are regulation, supervision, macroprudential tools, and those sorts of things as opposed to changing the interest rate.",CHAIR POWELL.
227,But we’re certainly very mindful of financial conditions and those risks.,CHAIR POWELL.
228,"If I could ask a follow-up—if it’s the case that we’re in a lower neutral interest rate world where you could have more asset price appreciation, do you think the Fed needs more macroprudential tools so that it doesn’t have to lean on monetary policy to do so much?",NICK TIMIRAOS.
229,It’s a very difficult question with a long answer.,CHAIR POWELL.
230,"We—in our system, we mainly rely on “through the cycle” tools like high capital and stress tests.",CHAIR POWELL.
231,"Our financial stability system is built on those tools:  high capital, high liquidity, resolution planning, stress testing.",CHAIR POWELL.
232,So those are always on.,CHAIR POWELL.
233,"We also have some tools, like the countercyclical capital buffer, which we can deploy at times when vulnerabilities are meaningfully above normal.",CHAIR POWELL.
234,But we do rely on those tools.,CHAIR POWELL.
235,"And I would say, our banks are well capitalized.",CHAIR POWELL.
236,They’re far better capitalized and better aware of their risks and more liquid than they were before the financial crisis.,CHAIR POWELL.
237,"So they’ll be more resilient in, you know, in difficult states of the economy.",CHAIR POWELL.
238,Donna Borak with CNN.,DONNA BORAK.
239,"Included in the President’s fiscal 2020 budget is a new estimate that the nation’s debt will balloon to more than $31 trillion over the next decade, by 2029.",DONNA BORAK.
240,You’ve previously said that the country is on an unsustainable fiscal path.,DONNA BORAK.
241,How alarming is that number to you?,DONNA BORAK.
242,"And, while the United States might not be quite there yet, when do you begin to worry about a possible credit crisis?",DONNA BORAK.
243,"I do think that deficits matter, and I do think—I think it’s not really controversial to say that our debt can’t grow faster than our economy indefinitely and that’s what it’s doing now.",CHAIR POWELL.
244,"So this is something we will have to deal with, and I think we can’t really lose sight of that, and I’d like to see a greater focus on that over time.",CHAIR POWELL.
245,"It’s not in the nature of a near-term debt crisis or anything like that, and I wouldn’t want to try to predict when that would happen, but it is something that it’s important that the public discussion really come back to, if I can say that.",CHAIR POWELL.
246,And we will have to deal with it eventually.,CHAIR POWELL.
247,James Politi of the Financial Times.,JAMES POLITI.
248,There’s huge uncertainty at the moment over the fate of the Brexit negotiations.,JAMES POLITI.
249,"How much of a factor has this been for the Fed in turning towards a kind of patient approach to monetary policy, and what’s your base case on that?",JAMES POLITI.
250,"And on the size of the balance sheet, what’s your—do you have a numerical estimate for where it will be at the end of September once the runoff is complete?",JAMES POLITI.
251,"So, of course, we’re watching Brexit carefully and hoping that it can be resolved in an orderly way.",CHAIR POWELL.
252,"From our standpoint, the part of it that we can control is that we’ve been involved with supervising our financial institutions that are active either in the United Kingdom or the European Union or both to make sure that they’re ready for the full range of possible outcomes to the—to Brexit.",CHAIR POWELL.
253,"So—and in doing so, we’ve also had—we’ve also worked alongside regulators from the United Kingdom and the EU.",CHAIR POWELL.
254,"So we do, again, hope that that can be resolved well, but we know that our banks are well capitalized and resilient to different kinds of events.",CHAIR POWELL.
255,"In terms of the size of the balance sheet, the balance sheet will be of a size of approximately 17 percent of GDP around the end of this year, down from 25 percent of GDP at the end of 2014—so, significantly smaller relative to GDP than it was.",CHAIR POWELL.
256,"I’m guessing you’re looking for a dollar number, though, probably, and that would be—so, for the size of the balance sheet, it looks like it’ll be a bit above $3.5 trillion then.",CHAIR POWELL.
257,Greg Robb from MarketWatch.,GREG ROBB.
258,"Chairman Powell, could you talk through your outlook for inflation this year?",GREG ROBB.
259,Aren’t—you’re not concerned about it?,GREG ROBB.
260,And rising—why aren’t rising wages feeding into inflation?,GREG ROBB.
261,"Let me take wages first, if I can.",CHAIR POWELL.
262,"So wages have moved up in the last couple of years and are now running at healthier, higher levels, and that’s a good thing.",CHAIR POWELL.
263,"In fact, a lot of the wage gains have been going to lower-paid workers, as can happen late in the cycle, which is also a good thing.",CHAIR POWELL.
264,"So—but that’s not price inflation, that’s wage inflation.",CHAIR POWELL.
265,"Our mandate, sorry, is price inflation.",CHAIR POWELL.
266,So what I see is inflation that’s close to 2 percent but that sort of keeps bumping up against 2 percent and then maybe moving back down a little bit.,CHAIR POWELL.
267,And I don’t feel that we have kind of convincingly achieved our 2 percent mandate in a symmetrical way.,CHAIR POWELL.
268,"Now, what do we mean by “symmetrical”?",CHAIR POWELL.
269,"What we really mean is that we would look at—we know that inflation will move around on both sides of the target, and what we say is that we would be equally concerned with inflation persistently above as persistently below the target.",CHAIR POWELL.
270,So that’s really our framework.,CHAIR POWELL.
271,"And I don’t think we’ve quite achieved that yet, because we’re really 10 years deep in this—almost 10 years—in this expansion, and inflation is still kind of, I’d say, not, you know, clearly meeting our target.",CHAIR POWELL.
272,So that’s one of the reasons why we’re being patient.,CHAIR POWELL.
273,"I think, as I’ve said before, I think inflation that is a little bit below our target—particularly headline inflation this year will be, you know, meaningfully below our target for most of the year because of lower oil prices, but we project that core will be too—that gives us the ability to be patient and not move until we see that our target goals are being achieved.",CHAIR POWELL.
274,"I just wanted to press a little bit about, what is the story the Committee—you know, when you get in the discussion today and yesterday about inflation, what kind of is the story that emerges?",GREG ROBB.
275,So there are a bunch of different stories.,CHAIR POWELL.
276,There’s no real easy answer.,CHAIR POWELL.
277,One of them is just that the natural rate of unemployment is lower than people think.,CHAIR POWELL.
278,"That’s one way to think about it, that there’s still more slack in the economy.",CHAIR POWELL.
279,"Another is that expectations play a very—inflation expectations play a very key role in our framework and other frameworks, and, you know, there is the possibility that some people discuss of expectations being anchored but below 2 percent.",CHAIR POWELL.
280,"And so, either way, inflation itself has kind of bounced around a little below 2 percent.",CHAIR POWELL.
281,That’s the record.,CHAIR POWELL.
282,"Hi, Chairman Powell.",PAUL KIERNAN.
283,Thanks for the question.,PAUL KIERNAN.
284,Paul Kiernan from Dow Jones Newswires.,PAUL KIERNAN.
285,"I’m just kind of curious—I mean, this below-target inflation is a global phenomenon, at least across advanced economies, and I’d just like to kind of hear your thoughts about what kind of challenges that poses to policymakers like yourself and the global economy in general.",PAUL KIERNAN.
286,"Yes, thanks.",PAUL KIERNAN.
287,It’s a major challenge.,CHAIR POWELL.
288,"It’s one of the major challenges of our time, really, to have inflation—you know, downward pressure on inflation, let’s say.",CHAIR POWELL.
289,"It gives central banks less room to, you know, to respond to downturns, right?",CHAIR POWELL.
290,"So if inflation expectations are below 2 percent, they’re always going to be pulling inflation down, and we’re going to be paddling upstream in trying to, you know, keep inflation at 2 percent, which gives us some room to cut, you know, when it’s time to cut rates when the economy weakens.",CHAIR POWELL.
291,"And, you know, that’s something that central banks face all over the world, and we certainly face that problem too.",CHAIR POWELL.
292,It’s one of the—one of the things we’re looking into as part of our strategic monetary policy review this year.,CHAIR POWELL.
293,"The proximity to the zero lower bound calls for more creative thinking about ways we can, you know, uphold the credibility of our inflation target, and, you know, we’re open minded about ways we can do that.",CHAIR POWELL.
294,Edward Lawrence from Fox Business Network.,EDWARD LAWRENCE.
295,So I counted five downgrades in the first paragraph of the FOMC statement.,EDWARD LAWRENCE.
296,What conditions do you need to see in order for a rate cut or a rate hike on the other side of that then?,EDWARD LAWRENCE.
297,"Well, we—I think we were—we wanted to be careful to go ahead and acknowledge the things.",CHAIR POWELL.
298,"I think it’s relatively little hard data so far this year, but we were careful to point out lower retail sales—the weak November meeting—BFI, all those things, and I think that was the right thing to do.2  Notwithstanding that, we do have a positive outlook for the year for the reasons I mentioned—you know, solid underlying economic fundamentals, et cetera.",CHAIR POWELL.
299,"So, and in terms of what it would take, I’d say, again, today we don’t see any—we don’t see data coming in that suggests that we should move in either direction.",CHAIR POWELL.
300,They suggest that we should remain patient and let the situation clarify itself over time.,CHAIR POWELL.
301,"When the time comes, we’ll act appropriately.",CHAIR POWELL.
302,Hi.,MATTHEW BOESLER.
303,Matthew Boesler at Bloomberg.,MATTHEW BOESLER.
304,Fed Vice Chairman Rich Clarida has talked about how the decline in labor’s share of income and the corresponding high profit margins might mean that lower unemployment and higher wage growth is not flowing through to price inflation the way it used to.,MATTHEW BOESLER.
305,"But, so far throughout this tightening cycle, the Fed                                                  has not allowed wage growth to rise above longer-term interest rates until just very recently.",MATTHEW BOESLER.
306,"So I’m wondering if, going forward, given these insights about the labor share and high profit margins and the linkage between wages and prices, would you be in favor of allowing wage growth to continue accelerating without matching that with higher interest rates?",MATTHEW BOESLER.
307,"Well, let me say that we’ve had, you know, a significant move up in wages and compensation over the last few years, and I—which does not trouble me from the standpoint of inflation.",CHAIR POWELL.
308,"We’ve had—also had—in other cycles, we’ve had situations where, you know, unit labor costs were moving up above inflation, and that didn’t lead to price inflation.",CHAIR POWELL.
309,"It does—you know, in theory, it can squeeze corporate margins, and, you know, that can’t go on indefinitely.",CHAIR POWELL.
310,"But, nonetheless, I don’t see the current wage picture as concerning from an inflation standpoint.",CHAIR POWELL.
311,"More generally, to the extent that wage growth in excess of interest rates allows households to pay down debt faster, whereas interest rates in excess of wage growth risks a further buildup in debt, how do you account for the sort of financial stability consequences of varying interest rates relative to wage growth?",MATTHEW BOESLER.
312,"I don’t think we look at—I understand what you’re asking, but we’re looking at—our mandate is price inflation and maximum employment, and that’s what we’re looking at with setting interest rates.",CHAIR POWELL.
313,And we also monitor financial stability very carefully across all meaningful asset categories.,CHAIR POWELL.
314,I don’t think we tie it particularly to the relationship you’re talking about.,CHAIR POWELL.
315,Nancy Marshall-Genzer with Marketplace.,NANCY MARSHALL-GENZER.
316,Just a quick follow-up on Brexit.,NANCY MARSHALL-GENZER.
317,You mentioned that you’re making sure that U.S. financial institutions are ready for whatever outcome.,NANCY MARSHALL-GENZER.
318,"I’m wondering, can you be a little more specific about that?",NANCY MARSHALL-GENZER.
319,"And also, how are you preparing for any pressures that a hard Brexit would put on the U.S. dollar?",NANCY MARSHALL-GENZER.
320,"Well, as I mentioned, you know, with the stress tests that the largest financial institutions—and those are the ones that tend to be active internationally—that they undergo every year, we put them through very large financial shocks with large losses and big changes in markets every year.",CHAIR POWELL.
321,And we vary that every year.,CHAIR POWELL.
322,"So that’s a pretty good—you know, having done that for a number of years now, that’s—and having them be required to have adequate capital and liquidity even after all that happens.",CHAIR POWELL.
323,"So that’s a good thing to have done, knowing that you’re going into something that’s quite unknown, which may prove stressful, it may not prove stressful, depending on what the outcome is.",CHAIR POWELL.
324,So I think all that has probably prepared our institutions well.,CHAIR POWELL.
325,"That said, nothing like this has happened in recent years, and so it’s really hard to be confident.",CHAIR POWELL.
326,So we’re very watchful about what’s going on.,CHAIR POWELL.
327,And as far as the dollar goes?,NANCY MARSHALL-GENZER.
328,"So we don’t—you know, we—the dollar is really the business of the Treasury Department.",CHAIR POWELL.
329,"It’s certainly a financial condition unto itself that plays into our models, but we don’t, you know, seek or model or attempt to affect the dollar directly with our policies.",CHAIR POWELL.
330,Hi.,JOHN HELTMAN.
331,John Heltman—John Heltman with American Banker.,JOHN HELTMAN.
332,I have a question about the Fed’s proposal from October of last year regarding enhanced prudential standards for banks above $250 billion.,JOHN HELTMAN.
333,"Some analysts have suggested that that proposal could encourage consolidation mergers and acquisition among banks, particularly at the upper end of the range.",JOHN HELTMAN.
334,I’m curious if the Fed anticipated that outcome and whether you have any reservations or whether you—the Fed cares about bank consolidation more generally.,JOHN HELTMAN.
335,We’re not motivated by a particular view of industry structure that we’re trying to achieve through our regulation.,CHAIR POWELL.
336,I think we want to have banks of all different sizes and with different business models out there carrying out their functions in the economy.,CHAIR POWELL.
337,So that’s how we think about that.,CHAIR POWELL.
338,"I would also say, when banks merge and move into a larger asset category, they get stronger regulation, not weaker regulation.",CHAIR POWELL.
339,"So if you think about it, you know, if you’re a medium-sized bank and you merge with another medium-sized bank, you wind up being more than a medium-sized bank, you know.",CHAIR POWELL.
340,"But the sense of our tapering is that—“tailoring,” sorry—our tailoring policy is that the highest expectations fall upon the largest, most systemically important, most complex institutions, and then at every step along the way, the expectations become more tailored to the risks that that institution actually presents to the economy.",CHAIR POWELL.
341,So— BRIAN CHEUNG.,CHAIR POWELL.
342,"Hi, Chair Powell.",CHAIR POWELL.
343,Brian Cheung with Yahoo Finance.,CHAIR POWELL.
344,Thanks for taking my question.,CHAIR POWELL.
345,"So as the Fed remains on pause, does the central bank find the onus on fiscal policy to extend its economic recovery and fend off a slowdown—as in, is the Fed positioning itself to take on a reactionary role to whatever fiscal policy is doing?",CHAIR POWELL.
346,"I’m asking because we’re seeing the waning effect of tax reform and no material news on infrastructure, so just wondering kind of how you feel the monetary policy–fiscal policy balance is in swing right now.",CHAIR POWELL.
347,"So we take—we take fiscal policy as, you know, as exogenous to what we do.",CHAIR POWELL.
348,"You know, in other words, whatever happens with fiscal policy, we take that.",CHAIR POWELL.
349,"We don’t evaluate it, we don’t criticize it, and we don’t overreact to it either.",CHAIR POWELL.
350,So I think it’s just a fact.,CHAIR POWELL.
351,It’s just an external fact about the economy for us.,CHAIR POWELL.
352,"I mean, our policy is—the reason we’re on hold is that we think our policy rate is in a good place, and we think the economy is in a good place, and we’re watching carefully as we see these events evolve around the world and at home, and we think that’s what we need to be doing.",CHAIR POWELL.
353,"Steve Beckner, freelance journalist reporting for NPR, Mr. Chairman.",STEVEN BECKNER.
354,The Fed has been allowing the average maturity of securities in its bond portfolio to lengthen.,STEVEN BECKNER.
355,"Is this aimed at—consciously aimed at flattening the yield curve, and is that going to be part of the Fed’s longer-run balance sheet strategy?",STEVEN BECKNER.
356,"And if flattening the yield curve is a conscious long-term strategy, are you concerned about the side effect of the heightening concerns about a flatter or inverted yield curve being a harbinger of recession?",STEVEN BECKNER.
357,The basic answer to your question is “no.”  We are—the decision about the maturity composition of the Fed’s balance sheet in the longer run lies ahead of us.,CHAIR POWELL.
358,"We have not made that decision, and we’re—we really haven’t begun to have a serious series of discussions over a series of meetings to grapple with that.",CHAIR POWELL.
359,"That, I think, will be something we turn to reasonably soon, but I think it will take some time.",CHAIR POWELL.
360,It’s a consequential decision and one that needs some thought.,CHAIR POWELL.
361,"We’ve had a lot of balance sheet discussions, as I mentioned, over the last four meetings, but this is the next big one that—big decision that we’ll face.",CHAIR POWELL.
362,"And, you know, I think we’re not going to be in a rush to resolve it, but we’ll turn to it soon.",CHAIR POWELL.
363,"Can I just follow up, please?",STEVEN BECKNER.
364,"Well, how do you account for the fact that the average maturity has in fact been lengthening and contributing to a flattening of the yield curve?",STEVEN BECKNER.
365,Is that—what’s—what’s causing that?,STEVEN BECKNER.
366,"I think, isn’t it just that as securities roll off, you wind up investing in—you know, as a 10-year rolls off, you wind up investing in a 10-year, and automatically that lengthens things.",CHAIR POWELL.
367,It’s not at all a plan to lengthen the balance sheet.,CHAIR POWELL.
368,"It’s just been—we try to have a practice that we don’t deviate from, and it’s transparent, and—no policy message in that.",CHAIR POWELL.
369,"Hi, Jean Yung with Market News.",JEAN YUNG.
370,"I wanted to ask, at what point do you expect to begin to allow the balance sheet to grow slowly again?",JEAN YUNG.
371,What are—how will you make that decision?,JEAN YUNG.
372,"So, as I—as I mentioned, the balance sheet runoff will stop at about—at September 30.",CHAIR POWELL.
373,"And if it is our view at that time that we’re still a ways away from—a ways above a balance sheet that is what we need to efficiently and effectively conduct monetary policy, at that time we will hold the balance sheet constant.",CHAIR POWELL.
374,"And then what’ll happen is, organically, very gradually, currency and other nonreserved liabilities will grow, and reserves will shrink.",CHAIR POWELL.
375,"And the question you’re asking is, how long will that go on?",CHAIR POWELL.
376,"The truth is, we don’t know, and we don’t really know that we’ll move past September 30th.",CHAIR POWELL.
377,"The level of reserve demand is something that we’ve put a lot of effort and time into creating estimates, based on market intelligence and surveys and that kind of thing.",CHAIR POWELL.
378,"The truth is, we don’t know.",CHAIR POWELL.
379,It may evolve over time.,CHAIR POWELL.
380,So we’ll just have to see.,CHAIR POWELL.
381,"I wouldn’t want to put a time out there for that, but—so I’ll just leave it there.",CHAIR POWELL.
382,"Hi, Mr. Chairman.",COURTENAY BROWN.
383,Courtenay Brown from Axios.,COURTENAY BROWN.
384,Are you concerned at all what the market impact will be should the Fed resume policy tightening somewhere down the line?,COURTENAY BROWN.
385,"As I’m sure you know, the market listens to you very, very closely.",COURTENAY BROWN.
386,"You know, I’m just going to say that I think we’re in a good place right now, which is, we’re being patient, we’re watching, we don’t see any data pushing us to move rates in either direction, and we’re going to watch carefully and patiently as we allow events to evolve.",CHAIR POWELL.
387,"And when they do clarify, we will act appropriately.",CHAIR POWELL.
